#SQL[@9,N23]Result[]
DROP TABLE IF EXISTS t1;

#SQL[@10,N113]Result[]
CREATE TABLE t1 (
	id INT AUTO_INCREMENT,
	name VARCHAR(255),
	category_id INT,
	d TIMESTAMP,
	PRIMARY KEY (id)
);

#SQL[@17,N237]Result[]
INSERT INTO t1 (id, name, category_id, d) VALUES
(1, 'aaa', 1, '2010-06-10 19:14:37'),
(2, 'bbb', 2, '2010-06-10 19:14:55'),
(3, 'ccc', 1, '2010-06-10 19:16:02'),
(4, 'ddd', 1, '2010-06-10 19:16:15'),
(5, 'eee', 2, '2010-06-10 19:16:35');

#SQL[@24,N27]Result[36, 42, 42, 42, 42, 42]
SELECT * FROM t1 ORDER BY d;
id  ¦  name  ¦  category_id  ¦  d
1  ¦  aaa  ¦  1  ¦  2010-06-10 19:14:37
2  ¦  bbb  ¦  2  ¦  2010-06-10 19:14:55
3  ¦  ccc  ¦  1  ¦  2010-06-10 19:16:02
4  ¦  ddd  ¦  1  ¦  2010-06-10 19:16:15
5  ¦  eee  ¦  2  ¦  2010-06-10 19:16:35

#SQL[@25,N69]Result[36, 42, 42, 42, 42, 42]
SELECT * FROM (SELECT * FROM t1 ORDER BY d DESC) temp ORDER BY d DESC;
id  ¦  name  ¦  category_id  ¦  d
5  ¦  eee  ¦  2  ¦  2010-06-10 19:16:35
4  ¦  ddd  ¦  1  ¦  2010-06-10 19:16:15
3  ¦  ccc  ¦  1  ¦  2010-06-10 19:16:02
2  ¦  bbb  ¦  2  ¦  2010-06-10 19:14:55
1  ¦  aaa  ¦  1  ¦  2010-06-10 19:14:37

#SQL[@26,N50]Result[36, 42, 42, 42]
SELECT * FROM t1 WHERE category_id = 1 ORDER BY id;
id  ¦  name  ¦  category_id  ¦  d
1  ¦  aaa  ¦  1  ¦  2010-06-10 19:14:37
3  ¦  ccc  ¦  1  ¦  2010-06-10 19:16:02
4  ¦  ddd  ¦  1  ¦  2010-06-10 19:16:15

#SQL[@27,N49]Result[36, 42, 42, 42]
SELECT * FROM t1 WHERE category_id = 1 ORDER BY d;
id  ¦  name  ¦  category_id  ¦  d
1  ¦  aaa  ¦  1  ¦  2010-06-10 19:14:37
3  ¦  ccc  ¦  1  ¦  2010-06-10 19:16:02
4  ¦  ddd  ¦  1  ¦  2010-06-10 19:16:15

#SQL[@28,N49]Result[36, 42, 42, 42]
SELECT * FROM t1 WHERE category_id = 1 ORDER BY 1;
id  ¦  name  ¦  category_id  ¦  d
1  ¦  aaa  ¦  1  ¦  2010-06-10 19:14:37
3  ¦  ccc  ¦  1  ¦  2010-06-10 19:16:02
4  ¦  ddd  ¦  1  ¦  2010-06-10 19:16:15

#SQL[@29,N51]Result[36, 42, 42, 42]
SELECT * FROM t1 WHERE category_id = 1 ORDER BY 1+1;
id  ¦  name  ¦  category_id  ¦  d
1  ¦  aaa  ¦  1  ¦  2010-06-10 19:14:37
3  ¦  ccc  ¦  1  ¦  2010-06-10 19:16:02
4  ¦  ddd  ¦  1  ¦  2010-06-10 19:16:15

#SQL[@30,N54]Result[36, 42, 42, 42]
SELECT * FROM t1 WHERE category_id = 1 ORDER BY SIN(1);
id  ¦  name  ¦  category_id  ¦  d
1  ¦  aaa  ¦  1  ¦  2010-06-10 19:14:37
3  ¦  ccc  ¦  1  ¦  2010-06-10 19:16:02
4  ¦  ddd  ¦  1  ¦  2010-06-10 19:16:15

#SQL[@32,N52]Error[50]
SELECT * FROM t1 WHERE category_id = 1 ORDER BY TRUE;
SQL syntax error: non-integer constant in ORDER BY

#SQL[@35,N23]Result[]
DROP TABLE IF EXISTS t1;

#SQL[@36,N76]Result[]
CREATE TABLE t1 (
	name VARCHAR(200),
	area CHAR(200),
	PRIMARY KEY (name)
);

#SQL[@41,N454]Result[]
INSERT INTO t1() VALUES
('a','b'),
('tewr','lojj'),
('The index may also be used even if the ORDER BY d', ' all unused portions of the index and all ex'),
('ssed by the query, the index is used', 'ex is more efficient than a table scan if c'),
('more expensive than scanning the table and', 'e optimizer probably does not use the index. If SELECT'),
('imilar to the same queries without DESC', 'homogeneity, but need not have the same actual direction.');

#SQL[@50,N33]Result[4, 49, 1, 39, 42, 36, 4]
SELECT name FROM t1 ORDER BY name;
name
The index may also be used even if the ORDER BY d
a
imilar to the same queries without DESC
more expensive than scanning the table and
ssed by the query, the index is used
tewr

#SQL[@51,N38]Result[4, 49, 1, 39, 42, 36, 4]
SELECT name FROM t1 ORDER BY name,area;
name
The index may also be used even if the ORDER BY d
a
imilar to the same queries without DESC
more expensive than scanning the table and
ssed by the query, the index is used
tewr

#SQL[@52,N38]Result[4, 49, 1, 42, 36, 39, 4]
SELECT name FROM t1 ORDER BY area,name;
name
The index may also be used even if the ORDER BY d
a
more expensive than scanning the table and
ssed by the query, the index is used
imilar to the same queries without DESC
tewr

#SQL[@53,N47]Result[14, 8]
SELECT * FROM t1 WHERE name = 'a' ORDER BY area;
name  ¦  area
a  ¦  b

#SQL[@54,N58]Result[14, 99, 102, 102, 85]
SELECT * FROM t1 WHERE LENGTH(name) > 10 ORDER BY name ASC;
name  ¦  area
The index may also be used even if the ORDER BY d  ¦   all unused portions of the index and all ex
imilar to the same queries without DESC  ¦  homogeneity, but need not have the same actual direction.
more expensive than scanning the table and  ¦  e optimizer probably does not use the index. If SELECT
ssed by the query, the index is used  ¦  ex is more efficient than a table scan if c

#SQL[@55,N59]Result[14, 14, 8]
SELECT * FROM t1 WHERE LENGTH(name) < 10 ORDER BY name DESC;
name  ¦  area
tewr  ¦  lojj
a  ¦  b

#SQL[@56,N62]Result[14, 85, 99, 102, 102]
SELECT * FROM t1 WHERE LENGTH(name) > 10 ORDER BY LENGTH(area);
name  ¦  area
ssed by the query, the index is used  ¦  ex is more efficient than a table scan if c
The index may also be used even if the ORDER BY d  ¦   all unused portions of the index and all ex
more expensive than scanning the table and  ¦  e optimizer probably does not use the index. If SELECT
imilar to the same queries without DESC  ¦  homogeneity, but need not have the same actual direction.

#SQL[@57,N48]Result[4, 49, 1, 39, 42, 36, 4]
SELECT name FROM t1 ORDER BY name ASC, area DESC;
name
The index may also be used even if the ORDER BY d
a
imilar to the same queries without DESC
more expensive than scanning the table and
ssed by the query, the index is used
tewr

#SQL[@58,N48]Result[4, 4, 36, 42, 39, 1, 49]
SELECT name FROM t1 ORDER BY name DESC, area ASC;
name
tewr
ssed by the query, the index is used
more expensive than scanning the table and
imilar to the same queries without DESC
a
The index may also be used even if the ORDER BY d

#SQL[@59,N14]Result[]
DELETE FROM t1;

#SQL[@60,N103]Result[]
INSERT INTO t1(name) VALUES('abkl'),('bfdjskl'),('cdjkl'),('djiofj'),('efjkl;'),('fjkldsa'),('gljfdka');

#SQL[@61,N45]Result[14, 17, 17, 16, 16, 15, 17, 14]
SELECT * FROM t1 ORDER BY name DESC, name ASC;
name  ¦  area
gljfdka  ¦  null
fjkldsa  ¦  null
efjkl;  ¦  null
djiofj  ¦  null
cdjkl  ¦  null
bfdjskl  ¦  null
abkl  ¦  null

#SQL[@64,N23]Result[]
DROP TABLE IF EXISTS t1;

#SQL[@65,N57]Result[]
CREATE TABLE t1 (
	d1 DATE,
	d2 DATETIME,
	d3 TIMESTAMP
);

#SQL[@70,N89]Result[]
INSERT INTO t1() VALUES ('2020-08-08','2020-08-07 00:01:02','2020-08-07 00:01:02.136487');

#SQL[@71,N89]Result[]
INSERT INTO t1() VALUES ('2021-09-09','2020-09-09 10:11:02','2020-09-09 10:11:02.136558');

#SQL[@72,N89]Result[]
INSERT INTO t1() VALUES ('2021-07-07','2020-07-07 17:17:12','2020-07-07 07:07:05.135582');

#SQL[@73,N89]Result[]
INSERT INTO t1() VALUES ('2021-06-06','2020-06-06 21:21:22','2020-06-06 02:21:22.135418');

#SQL[@74,N33]Result[18, 60, 60, 60, 60]
SELECT * FROM t1 ORDER BY d1 DESC;
d1  ¦  d2  ¦  d3
2021-09-09  ¦  2020-09-09 10:11:02  ¦  2020-09-09 10:11:02
2021-07-07  ¦  2020-07-07 17:17:12  ¦  2020-07-07 07:07:05
2021-06-06  ¦  2020-06-06 21:21:22  ¦  2020-06-06 02:21:22
2020-08-08  ¦  2020-08-07 00:01:02  ¦  2020-08-07 00:01:02

#SQL[@75,N50]Result[18, 60, 60, 60, 60]
SELECT * FROM t1 ORDER BY d1 DESC, d2 ASC, d3 DESC;
d1  ¦  d2  ¦  d3
2021-09-09  ¦  2020-09-09 10:11:02  ¦  2020-09-09 10:11:02
2021-07-07  ¦  2020-07-07 17:17:12  ¦  2020-07-07 07:07:05
2021-06-06  ¦  2020-06-06 21:21:22  ¦  2020-06-06 02:21:22
2020-08-08  ¦  2020-08-07 00:01:02  ¦  2020-08-07 00:01:02

#SQL[@76,N49]Result[18, 60, 60, 60, 60]
SELECT * FROM t1 ORDER BY d2 ASC, d1 ASC, d3 DESC;
d1  ¦  d2  ¦  d3
2021-06-06  ¦  2020-06-06 21:21:22  ¦  2020-06-06 02:21:22
2021-07-07  ¦  2020-07-07 17:17:12  ¦  2020-07-07 07:07:05
2020-08-08  ¦  2020-08-07 00:01:02  ¦  2020-08-07 00:01:02
2021-09-09  ¦  2020-09-09 10:11:02  ¦  2020-09-09 10:11:02

#SQL[@77,N75]Result[18, 60, 60]
SELECT * FROM t1 WHERE d1 BETWEEN '2021-06-06' AND '2021-08-08' ORDER BY d1;
d1  ¦  d2  ¦  d3
2021-06-06  ¦  2020-06-06 21:21:22  ¦  2020-06-06 02:21:22
2021-07-07  ¦  2020-07-07 17:17:12  ¦  2020-07-07 07:07:05

#SQL[@80,N23]Result[]
DROP TABLE IF EXISTS t1;

#SQL[@81,N125]Result[]
CREATE TABLE t1(
    tiny TINYINT NOT NULL,
    small SMALLINT NOT NULL,
    int_test INT NOT NULL,
    big BIGINT NOT NULL
);

#SQL[@87,N98]Error[50]
INSERT INTO t1() VALUES(1, 2, 3, 4),(100, 101, 102, 103),(NULL, NULL, NULL, 204),(64,1,4564,46843);
constraint violation: Column 'tiny' cannot be null

#SQL[@88,N36]Result[]
SELECT * FROM t1 ORDER BY small DESC;

#SQL[@89,N50]Result[]
SELECT * FROM t1 WHERE tiny < 100 ORDER BY big ASC;

#SQL[@90,N70]Result[]
SELECT * FROM t1 ORDER BY tiny ASC, small DESC, int_test ASC, big DESC;

#SQL[@93,N23]Result[]
DROP TABLE IF EXISTS t1;

#SQL[@94,N73]Result[]
CREATE TABLE t1(
    float_32 FLOAT,
    float_64 DOUBLE,
    d DECIMAL
);

#SQL[@99,N101]Result[]
INSERT INTO t1() VALUES(0.01, 0.02, 0.03), (0.000001,0.000002,0),(-1,-1.1,-1.2),(0.000003,0.000001,3);

#SQL[@100,N53]Result[29, 20, 29, 29, 21]
SELECT * FROM t1 ORDER BY float_32 ASC, float_64 DESC;
float_32  ¦  float_64  ¦  d
-1  ¦  -1.1  ¦  -1
0.000001  ¦  0.000002  ¦  0
0.000003  ¦  0.000001  ¦  3
0.01  ¦  0.02  ¦  0

#SQL[@101,N39]Result[29, 21, 29, 29, 20]
SELECT * FROM t1 ORDER BY float_64 DESC;
float_32  ¦  float_64  ¦  d
0.01  ¦  0.02  ¦  0
0.000001  ¦  0.000002  ¦  0
0.000003  ¦  0.000001  ¦  3
-1  ¦  -1.1  ¦  -1

#SQL[@102,N31]Result[29, 20, 21, 29, 29]
SELECT * FROM t1 ORDER BY d ASC;
float_32  ¦  float_64  ¦  d
-1  ¦  -1.1  ¦  -1
0.01  ¦  0.02  ¦  0
0.000001  ¦  0.000002  ¦  0
0.000003  ¦  0.000001  ¦  3

#SQL[@105,N23]Result[]
DROP TABLE IF EXISTS t1;

#SQL[@106,N23]Result[]
DROP TABLE IF EXISTS t2;

#SQL[@107,N23]Result[]
DROP TABLE IF EXISTS t3;

#SQL[@108,N88]Result[]
CREATE TABLE t1(
    id INT NOT NULL,
    name CHAR(20) NOT NULL,
    PRIMARY KEY (id)
);

#SQL[@113,N100]Result[]
CREATE TABLE t2(
    id VARCHAR(10) NOT NULL,
    nation VARCHAR(20) NOT NULL,
    PRIMARY KEY(id)
);

#SQL[@118,N127]Result[]
CREATE TABLE t3(
    nation VARCHAR(20) NOT NULL,
    city CHAR(20) NOT NULL,
    GDP FLOAT NOT NULL,
    PRIMARY KEY(nation)
);

#SQL[@124,N76]Result[]
INSERT INTO t1() VALUES(1,'ronaldo'), (2,'kante'), (3,'noyer'),(4,'modrici');

#SQL[@125,N62]Result[]
INSERT INTO t2() VALUES(1,'Poutanga'), (2,'NA'), (4,'Fenland');

#SQL[@126,N108]Result[]
INSERT INTO t3() VALUES('Poutanga','liseber',520135), ('NA','bolando',62102), ('Fenland','yisdilne', 612094);

#SQL[@127,N85]Result[32, 27, 34, 35]
SELECT * FROM t1 JOIN t2 ON t1.id = t2.id WHERE t1.id BETWEEN 1 AND 4+1 ORDER BY name;
id  ¦  name  ¦  id  ¦  nation
2  ¦  kante  ¦  2  ¦  NA
4  ¦  modrici  ¦  4  ¦  Fenland
1  ¦  ronaldo  ¦  1  ¦  Poutanga

#SQL[@128,N56]Result[32, 35, 27, 34]
SELECT * FROM t1 JOIN t2 ON t1.id = t2.id ORDER BY t1.id;
id  ¦  name  ¦  id  ¦  nation
1  ¦  ronaldo  ¦  1  ¦  Poutanga
2  ¦  kante  ¦  2  ¦  NA
4  ¦  modrici  ¦  4  ¦  Fenland

#SQL[@129,N110]Result[63, 73, 59, 74]
SELECT * FROM t1 JOIN t2 ON t1.id = t2.id JOIN t3 ON t2.nation = t3.nation ORDER BY t2.nation ASC, t3.GDP DESC;
id  ¦  name  ¦  id  ¦  nation  ¦  nation  ¦  city  ¦  gdp
4  ¦  modrici  ¦  4  ¦  Fenland  ¦  Fenland  ¦  yisdilne  ¦  612094
2  ¦  kante  ¦  2  ¦  NA  ¦  NA  ¦  bolando  ¦  62102
1  ¦  ronaldo  ¦  1  ¦  Poutanga  ¦  Poutanga  ¦  liseber  ¦  520135

#SQL[@130,N121]Result[63, 73, 59, 74]
SELECT * FROM t1 LEFT JOIN t2 ON t1.id = t2.id RIGHT JOIN t3 ON t2.nation = t3.nation ORDER BY t2.nation ASC, t3.GDP DESC;
id  ¦  name  ¦  id  ¦  nation  ¦  nation  ¦  city  ¦  gdp
4  ¦  modrici  ¦  4  ¦  Fenland  ¦  Fenland  ¦  yisdilne  ¦  612094
2  ¦  kante  ¦  2  ¦  NA  ¦  NA  ¦  bolando  ¦  62102
1  ¦  ronaldo  ¦  1  ¦  Poutanga  ¦  Poutanga  ¦  liseber  ¦  520135

#SQL[@131,N123]Result[63, 74, 59, 73]
SELECT * FROM t1 INNER JOIN t2 ON t1.id = t2.id RIGHT JOIN t3 ON t2.nation = t3.nation ORDER BY t2.nation DESC, t3.GDP DESC;
id  ¦  name  ¦  id  ¦  nation  ¦  nation  ¦  city  ¦  gdp
1  ¦  ronaldo  ¦  1  ¦  Poutanga  ¦  Poutanga  ¦  liseber  ¦  520135
2  ¦  kante  ¦  2  ¦  NA  ¦  NA  ¦  bolando  ¦  62102
4  ¦  modrici  ¦  4  ¦  Fenland  ¦  Fenland  ¦  yisdilne  ¦  612094

#SQL[@134,N23]Result[]
DROP TABLE IF EXISTS t1;

#SQL[@135,N23]Result[]
DROP TABLE IF EXISTS t2;

#SQL[@136,N114]Result[]
CREATE TABLE t1(
    id INT NOT NULL,
    name CHAR(20) NOT NULL,
    sex CHAR(4) NOT NULL,
    PRIMARY KEY (id)
);

#SQL[@142,N131]Result[]
CREATE TABLE t2(
    id VARCHAR(10) NOT NULL,
    name VARCHAR(20) NOT NULL,
    nation VARCHAR(20) NOT NULL,
    PRIMARY KEY(id)
);

#SQL[@148,N92]Result[]
INSERT INTO t1() VALUES(1,'ronaldo','F'), (2,'kante','M'), (3,'noyer','F'),(4,'modrici','M');

#SQL[@149,N111]Result[]
INSERT INTO t2() VALUES(1,'ronaldo','American'), (2,'kante','Franch'), (3,'noyer','Germany'),(4,'modrici','UK');

#SQL[@150,N57]Result[21, 24, 19, 22, 21, 25, 19, 28, 21]
SELECT * FROM t1 UNION ALL SELECT * FROM t2 ORDER BY name;
id  ¦  name  ¦  sex
2  ¦  kante  ¦  Franch
2  ¦  kante  ¦  M
4  ¦  modrici  ¦  UK
4  ¦  modrici  ¦  M
3  ¦  noyer  ¦  Germany
3  ¦  noyer  ¦  F
1  ¦  ronaldo  ¦  American
1  ¦  ronaldo  ¦  F

#SQL[@151,N72]Result[21, 28, 21, 25, 19, 22, 21, 24, 19]
(SELECT * FROM t1 UNION ALL SELECT * FROM t2) ORDER BY name DESC, id ASC;
id  ¦  name  ¦  sex
1  ¦  ronaldo  ¦  American
1  ¦  ronaldo  ¦  F
3  ¦  noyer  ¦  Germany
3  ¦  noyer  ¦  F
4  ¦  modrici  ¦  UK
4  ¦  modrici  ¦  M
2  ¦  kante  ¦  Franch
2  ¦  kante  ¦  M

#SQL[@152,N76]Result[21, 21, 22, 19, 25, 19, 24, 21, 28]
(SELECT * FROM t1) UNION (SELECT * FROM t2 ORDER BY nation) ORDER BY id DESC;
id  ¦  name  ¦  sex
4  ¦  modrici  ¦  M
4  ¦  modrici  ¦  UK
3  ¦  noyer  ¦  F
3  ¦  noyer  ¦  Germany
2  ¦  kante  ¦  M
2  ¦  kante  ¦  Franch
1  ¦  ronaldo  ¦  F
1  ¦  ronaldo  ¦  American

#SQL[@153,N56]Result[21, 21, 19, 19, 21, 28, 24, 25, 22]
(SELECT * FROM t1 ORDER BY sex) UNION (SELECT * FROM t2);
id  ¦  name  ¦  sex
1  ¦  ronaldo  ¦  F
3  ¦  noyer  ¦  F
2  ¦  kante  ¦  M
4  ¦  modrici  ¦  M
1  ¦  ronaldo  ¦  American
2  ¦  kante  ¦  Franch
3  ¦  noyer  ¦  Germany
4  ¦  modrici  ¦  UK

#SQL[@154,N127]Result[21, 19, 25, 21, 22]
(SELECT * FROM t1 WHERE sex = 'M' ORDER BY sex DESC)
UNION
(SELECT * FROM t2 WHERE id >= 3 ORDER BY nation ASC) ORDER BY id ASC;
id  ¦  name  ¦  sex
2  ¦  kante  ¦  M
3  ¦  noyer  ¦  Germany
4  ¦  modrici  ¦  M
4  ¦  modrici  ¦  UK

#SQL[@158,N136]Result[21, 19, 21, 28]
(SELECT * FROM t1 WHERE id BETWEEN 1 AND 2 ORDER BY name)
UNION ALL
(SELECT * FROM t2 WHERE nation BETWEEN 'A' AND 'F' ORDER BY id DESC);
id  ¦  name  ¦  sex
2  ¦  kante  ¦  M
1  ¦  ronaldo  ¦  F
1  ¦  ronaldo  ¦  American

#SQL[@163,N23]Result[]
DROP TABLE IF EXISTS t1;

#SQL[@164,N23]Result[]
DROP TABLE IF EXISTS t2;

#SQL[@165,N23]Result[]
DROP TABLE IF EXISTS t3;

#SQL[@166,N88]Result[]
CREATE TABLE t1(
    id INT NOT NULL,
    name CHAR(20) NOT NULL,
    PRIMARY KEY (id)
);

#SQL[@171,N100]Result[]
CREATE TABLE t2(
    id VARCHAR(10) NOT NULL,
    nation VARCHAR(20) NOT NULL,
    PRIMARY KEY(id)
);

#SQL[@176,N98]Result[]
CREATE TABLE t3(
    id VARCHAR(10) NOT NULL,
    area VARCHAR(20) NOT NULL,
    PRIMARY KEY(id)
);

#SQL[@181,N76]Result[]
INSERT INTO t1() VALUES(1,'ronaldo'), (2,'kante'), (3,'noyer'),(4,'modrici');

#SQL[@182,N61]Result[]
INSERT INTO t2() VALUES(1,'UK'), (2,'USA'), (3,'RA'),(4,'CN');

#SQL[@183,N60]Result[]
INSERT INTO t3() VALUES(1,'EU'), (2,'NA'), (3,'AU'),(4,'AS');

#SQL[@184,N103]Result[12, 9, 9, 9, 9, 9, 9, 10, 9, 14, 12, 12, 14]
(SELECT * FROM t1) UNION (SELECT * FROM t2 ORDER BY id DESC) UNION ALL (SELECT * FROM t3 ORDER BY area);
id  ¦  name
4  ¦  AS
3  ¦  AU
1  ¦  EU
2  ¦  NA
4  ¦  CN
3  ¦  RA
2  ¦  USA
1  ¦  UK
1  ¦  ronaldo
2  ¦  kante
3  ¦  noyer
4  ¦  modrici

#SQL[@185,N117]Result[12, 9, 9, 14, 9, 10, 12, 9, 9, 12, 9, 9, 14]
((SELECT * FROM t1 ORDER BY id DESC) UNION (SELECT * FROM t2) UNION ALL (SELECT * FROM t3 ORDER BY area)) ORDER BY id;
id  ¦  name
1  ¦  EU
1  ¦  UK
1  ¦  ronaldo
2  ¦  NA
2  ¦  USA
2  ¦  kante
3  ¦  AU
3  ¦  RA
3  ¦  noyer
4  ¦  AS
4  ¦  CN
4  ¦  modrici

#SQL[@186,N112]Result[12, 9, 9, 9, 9, 12, 14, 12, 14, 9, 10, 9, 9]
(SELECT * FROM t1 ORDER BY name) UNION (SELECT * FROM t2 ORDER BY id) UNION ALL (SELECT * FROM t3 ORDER BY area);
id  ¦  name
4  ¦  AS
3  ¦  AU
1  ¦  EU
2  ¦  NA
2  ¦  kante
4  ¦  modrici
3  ¦  noyer
1  ¦  ronaldo
1  ¦  UK
2  ¦  USA
3  ¦  RA
4  ¦  CN

#SQL[@188,N134]Result[32, 24, 24, 25, 24, 29, 28, 27, 29]
(SELECT * FROM t1 JOIN t2 ON t1.id = t2.id ORDER BY t2.id)
UNION
(SELECT * FROM t2 RIGHT JOIN t3 ON t2.id = t3.id ORDER BY t3.id DESC);
id  ¦  name  ¦  id  ¦  nation
4  ¦  CN  ¦  4  ¦  AS
3  ¦  RA  ¦  3  ¦  AU
2  ¦  USA  ¦  2  ¦  NA
1  ¦  UK  ¦  1  ¦  EU
1  ¦  ronaldo  ¦  1  ¦  UK
2  ¦  kante  ¦  2  ¦  USA
3  ¦  noyer  ¦  3  ¦  RA
4  ¦  modrici  ¦  4  ¦  CN

#SQL[@192,N172]Result[30, 24, 24, 24, 25, 29, 27, 27, 29]
(SELECT * FROM t1 LEFT JOIN t3 ON t1.id = t3.id ORDER BY t1.id DESC, t3.area ASC)
UNION
(SELECT * FROM t2 RIGHT JOIN t3 ON t2.id = t3.id ORDER BY t2.nation ASC, t3.id DESC);
id  ¦  name  ¦  id  ¦  area
4  ¦  CN  ¦  4  ¦  AS
3  ¦  RA  ¦  3  ¦  AU
1  ¦  UK  ¦  1  ¦  EU
2  ¦  USA  ¦  2  ¦  NA
4  ¦  modrici  ¦  4  ¦  AS
3  ¦  noyer  ¦  3  ¦  AU
2  ¦  kante  ¦  2  ¦  NA
1  ¦  ronaldo  ¦  1  ¦  EU

#SQL[@197,N23]Result[]
DROP TABLE IF EXISTS t1;

#SQL[@198,N23]Result[]
DROP TABLE IF EXISTS t2;

#SQL[@199,N113]Result[]
CREATE TABLE t1(
    id INT NOT NULL,
    d1 CHAR(50) NOT NULL,
    salary FLOAT NOT NULL,
    PRIMARY KEY (id)
);

#SQL[@205,N114]Result[]
CREATE TABLE t2(
    id INT NOT NULL,
    name CHAR(50) NOT NULL,
    sex CHAR(4) NOT NULL,
    PRIMARY KEY (id)
);

#SQL[@211,N90]Result[]
INSERT INTO t1() VALUES(1,'2020-01-01',23.6), (2,'2020-01-01',89.6), (3,'2020-01-02',45.6);

#SQL[@212,N91]Result[]
INSERT INTO t1() VALUES(4,'2020-01-01',66.6), (5,'2020-01-03',17.6), (6,'2020-01-03',123.6);

#SQL[@213,N86]Result[]
INSERT INTO t2() VALUES(1,'jaca','F'), (2,'mecan','M'),(3,'right','F'),(4,'rodia','M');

#SQL[@214,N53]Result[]
INSERT INTO t2() VALUES(5,'hila','F'), (6,'pika','M');

#SQL[@215,N74]Result[25, 21, 20, 20]
SELECT DATE(d1), MAX(salary) FROM t1 GROUP BY d1 ORDER BY MAX(salary) DESC;
DATE(d1)  ¦  MAX(salary)
2020-01-03  ¦  123.6
2020-01-01  ¦  89.6
2020-01-02  ¦  45.6

#SQL[@216,N73]Result[25, 20, 20, 21]
SELECT DATE(d1), MAX(salary) FROM t1 GROUP BY d1 ORDER BY MAX(salary) ASC;
DATE(d1)  ¦  MAX(salary)
2020-01-02  ¦  45.6
2020-01-01  ¦  89.6
2020-01-03  ¦  123.6

#SQL[@217,N99]Result[25, 21, 20, 20]
SELECT DATE(d1), MAX(salary) FROM t1 JOIN t2 ON t1.id = t2.id GROUP BY d1 ORDER BY MAX(salary) DESC;
DATE(d1)  ¦  MAX(salary)
2020-01-03  ¦  123.6
2020-01-01  ¦  89.6
2020-01-02  ¦  45.6

#SQL[@221,N23]Result[]
DROP TABLE IF EXISTS t1;

#SQL[@222,N69]Result[]
CREATE TABLE t1(
    id INT,
    name CHAR(20),
    PRIMARY KEY(id)
);

#SQL[@227,N76]Result[]
INSERT INTO t1() VALUES(1, 'jacak'), (2, 'tommy'), (3, 'rorgdbs'), (4, NULL);

#SQL[@228,N34]Result[12, 11, 12, 14, 12]
SELECT * FROM t1 ORDER BY name ASC;
id  ¦  name
4  ¦  null
1  ¦  jacak
3  ¦  rorgdbs
2  ¦  tommy

#SQL[@229,N43]Result[12, 12, 14, 12, 11]
SELECT * FROM t1 ORDER BY name DESC, id ASC;
id  ¦  name
2  ¦  tommy
3  ¦  rorgdbs
1  ¦  jacak
4  ¦  null

#SQL[@230,N45]Result[12, 12, 14, 12, 11]
SELECT * FROM t1 ORDER BY name ASC NULLS LAST;
id  ¦  name
1  ¦  jacak
3  ¦  rorgdbs
2  ¦  tommy
4  ¦  null

#SQL[@231,N46]Result[12, 11, 12, 14, 12]
SELECT * FROM t1 ORDER BY name ASC NULLS FIRST;
id  ¦  name
4  ¦  null
1  ¦  jacak
3  ¦  rorgdbs
2  ¦  tommy

#SQL[@232,N51]Error[200]
SELECT * FROM t1 ORDER BY name ASC NULLS FIRST LAST;
SQL parser error: You have an error in your SQL syntax; check the manual that corresponds to your MatrixOne server version for the right syntax to use. syntax error at line 1 column 51 near \" LAST\";

#SQL[@234,N23]Result[]
DROP TABLE IF EXISTS t1;

#SQL[@235,N101]Result[]
CREATE TABLE t1(
    id INT,
    name CHAR(20),
    salary FLOAT,
    dept INT,
    PRIMARY KEY(id)
);

#SQL[@242,N111]Result[]
INSERT INTO t1() VALUES(1,'bdkia',133.1,11), (2, 'dodro',983.6,NULL), (3, 'fafeaz',301.5,10), (4, NULL,NULL,13);

#SQL[@243,N66]Result[34, 29, 32, 33]
SELECT * FROM t1 WHERE id > 1 ORDER BY id DESC, salary NULLS FIRST;
id  ¦  name  ¦  salary  ¦  dept
4  ¦  null  ¦  null  ¦  13
3  ¦  fafeaz  ¦  301.5  ¦  10
2  ¦  dodro  ¦  983.6  ¦  null

#SQL[@244,N100]Result[34, 29, 32, 33, 31]
SELECT * FROM t1 WHERE id BETWEEN 1 AND 4 ORDER BY id DESC, dept NULLS LAST, salary DESC NULLS FIRST;
id  ¦  name  ¦  salary  ¦  dept
4  ¦  null  ¦  null  ¦  13
3  ¦  fafeaz  ¦  301.5  ¦  10
2  ¦  dodro  ¦  983.6  ¦  null
1  ¦  bdkia  ¦  133.1  ¦  11

#SQL[@245,N99]Result[12, 11, 12, 13, 12]
SELECT id,name FROM t1 ORDER BY salary DESC NULLS FIRST, dept DESC NULLS LAST, name ASC NULLS FIRST;
id  ¦  name
4  ¦  null
2  ¦  dodro
3  ¦  fafeaz
1  ¦  bdkia

#SQL[@248,N23]Result[]
DROP TABLE IF EXISTS t1;

#SQL[@249,N23]Result[]
DROP TABLE IF EXISTS t2;

#SQL[@250,N69]Result[]
CREATE TABLE t1(
    id INT,
    name CHAR(20),
    PRIMARY KEY(id)
);

#SQL[@255,N71]Result[]
CREATE TABLE t2(
    id INT,
    nation CHAR(20),
    PRIMARY KEY(id)
);

#SQL[@260,N74]Result[]
INSERT INTO t1() VALUES(1, 'jacak'), (2, 'tommy'), (3, 'roses'), (4, NULL);

#SQL[@261,N76]Result[]
INSERT INTO t2() VALUES(1, 'US'), (2, 'UK'), (3, NULL), (4, NULL), (5, NULL);

#SQL[@262,N72]Result[32, 28, 27, 29, 27]
SELECT * FROM t1 JOIN t2 ON t1.id = t2.id ORDER BY name DESC NULLS FIRST;
id  ¦  name  ¦  id  ¦  nation
4  ¦  null  ¦  4  ¦  null
2  ¦  tommy  ¦  2  ¦  UK
3  ¦  roses  ¦  3  ¦  null
1  ¦  jacak  ¦  1  ¦  US

#SQL[@263,N75]Result[32, 27, 29, 27, 28]
SELECT * FROM t1 LEFT JOIN t2 ON t1.id = t2.id ORDER BY name ASC NULLS LAST;
id  ¦  name  ¦  id  ¦  nation
1  ¦  jacak  ¦  1  ¦  US
3  ¦  roses  ¦  3  ¦  null
2  ¦  tommy  ¦  2  ¦  UK
4  ¦  null  ¦  4  ¦  null

#SQL[@264,N89]Result[32, 28, 31, 27, 29, 27]
SELECT * FROM t1 RIGHT JOIN t2 ON t1.id = t2.id ORDER BY name ASC, nation DESC NULLS LAST;
id  ¦  name  ¦  id  ¦  nation
4  ¦  null  ¦  4  ¦  null
null  ¦  null  ¦  5  ¦  null
1  ¦  jacak  ¦  1  ¦  US
3  ¦  roses  ¦  3  ¦  null
2  ¦  tommy  ¦  2  ¦  UK

#SQL[@265,N90]Result[32, 27, 29, 27, 28]
SELECT * FROM t1 INNER JOIN t2 ON t1.id = t2.id ORDER BY name DESC, nation ASC NULLS FIRST;
id  ¦  name  ¦  id  ¦  nation
2  ¦  tommy  ¦  2  ¦  UK
3  ¦  roses  ¦  3  ¦  null
1  ¦  jacak  ¦  1  ¦  US
4  ¦  null  ¦  4  ¦  null

#SQL[@268,N23]Result[]
DROP TABLE IF EXISTS t1;

#SQL[@269,N23]Result[]
DROP TABLE IF EXISTS t2;

#SQL[@270,N47]Result[]
CREATE TABLE t1(
    id INT,
    sex CHAR(20)
);

#SQL[@274,N48]Result[]
CREATE TABLE t2(
    id INT,
    home CHAR(20)
);

#SQL[@278,N79]Result[]
INSERT INTO t1() VALUES(1, 'F'), (2, 'M'), (NULL, 'M'), (4, NULL), (NULL, NULL);

#SQL[@279,N90]Result[]
INSERT INTO t2() VALUES(1, 'EU'), (2, 'UK'), (3, NULL), (4, NULL), (5, NULL), (NULL, NULL);

#SQL[@280,N74]Result[29, 23, 23, 31, 28, 34]
SELECT * FROM t1 LEFT JOIN t2 ON t1.id = t2.id ORDER BY sex ASC NULLS LAST;
id  ¦  sex  ¦  id  ¦  home
1  ¦  F  ¦  1  ¦  EU
2  ¦  M  ¦  2  ¦  UK
null  ¦  M  ¦  null  ¦  null
4  ¦  null  ¦  4  ¦  null
null  ¦  null  ¦  null  ¦  null

#SQL[@281,N77]Result[29, 31, 28, 31, 34, 23, 23]
SELECT * FROM t1 RIGHT JOIN t2 ON t1.id = t2.id ORDER BY home ASC NULLS FIRST;
id  ¦  sex  ¦  id  ¦  home
null  ¦  null  ¦  3  ¦  null
4  ¦  null  ¦  4  ¦  null
null  ¦  null  ¦  5  ¦  null
null  ¦  null  ¦  null  ¦  null
1  ¦  F  ¦  1  ¦  EU
2  ¦  M  ¦  2  ¦  UK

#SQL[@282,N87]Result[29, 28, 23, 23]
SELECT * FROM t1 INNER JOIN t2 ON t1.id = t2.id ORDER BY home ASC, sex DESC NULLS FIRST;
id  ¦  sex  ¦  id  ¦  home
4  ¦  null  ¦  4  ¦  null
1  ¦  F  ¦  1  ¦  EU
2  ¦  M  ¦  2  ¦  UK

