#SQL[@7,N74]Result[82, 198]
select -3.402823466E+38,-3.402823467E+38,-1.175494351E-38,-1.175494352E-38;
-3.402823466e+38  ¦  -3.402823467e+38  ¦  -1.175494351e-38  ¦  -1.175494352e-38
-340282346600000000000000000000000000000  ¦  -340282346700000000000000000000000000000  ¦  -0.00000000000000000000000000000000000001175494351  ¦  -0.00000000000000000000000000000000000001175494352

#SQL[@8,N70]Result[78, 194]
select 1.175494351E-38,1.175494352E-38,3.402823467E+38,3.402823467E+38;
1.175494351e-38  ¦  1.175494352e-38  ¦  3.402823467e+38  ¦  3.402823467e+38
0.00000000000000000000000000000000000001175494351  ¦  0.00000000000000000000000000000000000001175494352  ¦  340282346700000000000000000000000000000  ¦  340282346700000000000000000000000000000

#SQL[@9,N50]Result[52, 96]
select -3.402823466E+38*1,-1.175494351E-38-0.1E-38;
-3.402823466e+38 * 1  ¦  -1.175494351e-38 - 0.1e-38
-340282346600000000000000000000000000000  ¦  -0.00000000000000000000000000000000000001275494351

#SQL[@12,N23]Result[]
drop table if exists t1;

#SQL[@13,N50]Result[]
create table t1 (a float not null, primary key(a));

#SQL[@14,N98]Result[]
insert into t1 values(-3.402823466E+38),(-1.175494351E-38),(0),(1.175494351E-38),(3.402823466E+38);

#SQL[@15,N27]Result[1, 40, 48, 1, 47, 39]
select * from t1 order by 1;
a
-340282350000000000000000000000000000000
-0.000000000000000000000000000000000000011754944
0
0.000000000000000000000000000000000000011754944
340282350000000000000000000000000000000

#SQL[@16,N24]Result[]
delete from t1 where a>0;

#SQL[@17,N23]Result[]
drop table if exists t1;

#SQL[@18,N31]Result[]
create table t1(a float(23,22));

#SQL[@19,N82]Result[]
insert into t1 values(-3.402823466),(-1.175494351),(0),(1.175494351),(3.402823466);

#SQL[@20,N31]Result[1, 10, 10, 1, 9, 9]
select * from t1 order by 1 asc;
a
-3.4028234
-1.1754943
0
1.1754943
3.4028234

#SQL[@21,N23]Result[]
drop table if exists t1;

#SQL[@22,N28]Result[]
create table t1(a float(23));

#SQL[@23,N82]Result[]
insert into t1 values(-3.402823466),(-1.175494351),(0),(1.175494351),(3.402823466);

#SQL[@24,N31]Result[1, 10, 10, 1, 9, 9]
select * from t1 order by a asc;
a
-3.4028234
-1.1754943
0
1.1754943
3.4028234

#SQL[@25,N13]Result[]
drop table t1;

#SQL[@26,N74]Result[]
create table t1 ( a float not null default 1, big float(20,5) primary key);

#SQL[@27,N76]Result[]
insert into t1 (big) values (-1),(12345678.901234567),(92233720368547.75807);

#SQL[@28,N41]Result[10, 9, 15, 21]
select * from t1 order by a desc, big asc;
a  ¦  big
1  ¦  -1
1  ¦  12345679
1  ¦  92233720000000

#SQL[@29,N43]Result[40, 42]
select min(big),max(big),max(big)-1 from t1;
min(big)  ¦  max(big)  ¦  max(big) - 1
-1  ¦  92233720000000  ¦  92233718038527

#SQL[@30,N65]Result[40, 42]
select min(big),max(big),max(big)-1 from t1 group by a order by 3;
min(big)  ¦  max(big)  ¦  max(big) - 1
-1  ¦  92233720000000  ¦  92233718038527

#SQL[@31,N13]Result[]
drop table t1;

#SQL[@32,N56]Result[]
create table t1 ( a float not null default 1, big float);

#SQL[@33,N76]Result[]
insert into t1 (big) values (-1),(12345678.901234567),(92233720368547.75807);

#SQL[@34,N40]Result[10, 9, 15, 21]
select * from t1 order by a asc, big asc;
a  ¦  big
1  ¦  -1
1  ¦  12345679
1  ¦  92233720000000

#SQL[@35,N39]Result[10, 15, 21]
select * from t1 order by big limit 1,2;
a  ¦  big
1  ¦  12345679
1  ¦  92233720000000

#SQL[@36,N46]Result[10, 15, 21]
select * from t1 order by big limit 2 offset 1;
a  ¦  big
1  ¦  12345679
1  ¦  92233720000000

#SQL[@37,N43]Result[40, 42]
select min(big),max(big),max(big)-1 from t1;
min(big)  ¦  max(big)  ¦  max(big) - 1
-1  ¦  92233720000000  ¦  92233718038527

#SQL[@38,N67]Result[40, 42]
select min(big),max(big),max(big)-1 from t1 group by a order by 1+2;
min(big)  ¦  max(big)  ¦  max(big) - 1
-1  ¦  92233720000000  ¦  92233718038527

#SQL[@39,N13]Result[]
drop table t1;

#SQL[@40,N45]Result[]
create table t1 (id float primary key, a int);

#SQL[@41,N29]Result[]
insert into t1 values (1.1,1);

#SQL[@42,N30]Result[]
insert into t1 values (2.22,2);

#SQL[@43,N31]Result[]
insert into t1 values (3.333,3);

#SQL[@44,N32]Result[]
insert into t1 values (4.4444,4);

#SQL[@45,N33]Result[9, 13, 12, 11, 10]
select * from t1 order by id desc;
id  ¦  a
4.4444  ¦  4
3.333  ¦  3
2.22  ¦  2
1.1  ¦  1

#SQL[@48,N23]Result[]
drop table if exists t1;

#SQL[@49,N23]Result[]
drop table if exists t2;

#SQL[@50,N70]Result[]
create table t1 (
a float not null,
b float not null,
primary key(a)
);

#SQL[@55,N76]Result[]
create table t2 (
a  float  not null,
b  integer  not null,
primary key(a)
);

#SQL[@60,N34]Result[]
insert into t1 values(0.123456, 1);

#SQL[@61,N33]Result[]
insert into t1 values(1.23456, 2);

#SQL[@62,N36]Result[]
insert into t2 values(1.23456e-1, 3);

#SQL[@63,N35]Result[]
insert into t2 values(1.23456e1, 4);

#SQL[@64,N26]Result[]
insert into t1 values(3,5);

#SQL[@65,N16]Result[8, 15, 14, 8]
select * from t1;
a  ¦  b
0.123456  ¦  1
1.23456  ¦  2
3  ¦  5

#SQL[@66,N16]Result[8, 15, 14]
select * from t2;
a  ¦  b
0.123456  ¦  3
12.3456  ¦  4

#SQL[@67,N66]Result[22, 36]
select * from t1 join t2 on t1.a=t2.a order by t1.a asc, t2.b desc;
a  ¦  b  ¦  a  ¦  b
0.123456  ¦  1  ¦  0.123456  ¦  3

#SQL[@68,N74]Result[22, 36]
select * from t1 join t2 on t1.a=t2.a where t1.a>=0.123456 order by abs(3);
a  ¦  b  ¦  a  ¦  b
0.123456  ¦  1  ¦  0.123456  ¦  3

#SQL[@69,N55]Result[22, 29]
select * from t1 join t2 on t2.b=t1.a order by 1,2 desc;
a  ¦  b  ¦  a  ¦  b
3  ¦  5  ¦  0.123456  ¦  3

#SQL[@72,N23]Result[]
drop table if exists t1;

#SQL[@73,N23]Result[]
drop table if exists t2;

#SQL[@74,N25]Result[]
create table t1 (a float);

#SQL[@75,N30]Result[]
insert into t1 values (17.666);

#SQL[@76,N33]Result[1, 6]
select * from t1 where a>=17.6660;
a
17.666

#SQL[@77,N35]Result[1, 6]
select * from t1 where a>='17.6660';
a
17.666

#SQL[@78,N34]Result[6, 18]
select a  mod 50 as result from t1;
result
17.666000366210938

#SQL[@79,N51]Result[6, 2]
select cast(a as unsigned) mod 50 as result from t1;
result
18

#SQL[@80,N34]Result[21, 2]
select cast(a+a as signed) from t1;
cast(a + a as signed)
35

#SQL[@82,N34]Result[21, 3]
select cast(0-a as signed) from t1;
cast(0 - a as signed)
-18

#SQL[@84,N13]Result[]
drop table t1;

#SQL[@85,N64]Result[]
CREATE TABLE t1 (id INT PRIMARY KEY,
a float(20),
b VARCHAR(20));

#SQL[@88,N160]Result[]
INSERT INTO t1 (id,a) VALUES
(1,0),
(2,CAST(0x7FFFFFFFFFFFFFFF AS UNSIGNED)),
(3,CAST(0x8000000000000000 AS UNSIGNED)),
(4,CAST(0xFFFFFFFFFFFFFFFF AS UNSIGNED));

#SQL[@93,N16]Result[16, 18, 36, 36, 37]
select * from t1;
id  ¦  a  ¦  b
1  ¦  0  ¦  null
2  ¦  9223372000000000000  ¦  null
3  ¦  9223372000000000000  ¦  null
4  ¦  18446744000000000000  ¦  null

#SQL[@94,N19]Result[]
UPDATE t1 SET b = a;

#SQL[@95,N140]Result[]
select a,count(a) from t1 where ((a = 9.223372036854776e18) and (b = '9.223372036854776e18')) group by a having count(a)>2 order by count(a);

#SQL[@96,N108]Result[8, 8, 39]
select distinct a,b from t1 where ((a != 9.223372036854776e18) and (b != '9.223372036854776e18')) order by 2;
a  ¦  b
0  ¦  0
18446744000000000000  ¦  1.8446744E+19

#SQL[@97,N35]Result[]
CREATE TABLE t_float(id float(2,1));

#SQL[@98,N41]Result[]
INSERT INTO t_float VALUES (1),(1.1), (2);

#SQL[@99,N33]Result[17, 12, 13, 11]
SELECT id, id >= 1.1 FROM t_float;
id  ¦  id >= 1.1
1  ¦  false
1.1  ¦  true
2  ¦  true

#SQL[@100,N33]Result[17, 12, 13, 11]
SELECT id, 1.1 <= id FROM t_float;
id  ¦  1.1 <= id
1  ¦  false
1.1  ¦  true
2  ¦  true

#SQL[@106,N38]Result[2, 3]
SELECT * from t_float WHERE id = '1.1';
id
1.1

#SQL[@107,N40]Result[2, 3]
SELECT * from t_float WHERE id = '1.1e0';
id
1.1

#SQL[@108,N44]Result[2, 3]
SELECT * from t_float WHERE id IN (1.1, 2.2);
id
1.1

#SQL[@109,N48]Result[]
SELECT * from t_float WHERE id IN (1.1e0, 2.2e0);

#SQL[@110,N48]Result[2, 3]
SELECT * from t_float WHERE id IN ('1.1', '2.2');
id
1.1

#SQL[@111,N52]Result[2, 3]
SELECT * from t_float WHERE id IN ('1.1e0', '2.2e0');
id
1.1

#SQL[@112,N50]Result[2, 3]
SELECT * from t_float WHERE id BETWEEN 1.1 AND 1.9;
id
1.1

#SQL[@113,N54]Result[2, 3]
SELECT * from t_float WHERE id BETWEEN 1.1e0 AND 1.9e0;
id
1.1

#SQL[@114,N54]Result[2, 3]
SELECT * from t_float WHERE id BETWEEN '1.1' AND '1.9';
id
1.1

#SQL[@115,N58]Result[2, 3]
SELECT * from t_float WHERE id BETWEEN '1.1e0' AND '1.9e0';
id
1.1

#SQL[@116,N13]Result[]
drop table t1;

#SQL[@117,N28]Result[]
CREATE TABLE t1 (a float(3));

#SQL[@118,N38]Result[]
INSERT INTO t1 VALUES (1),(0.00),(0.8);

#SQL[@124,N42]Result[1, 1, 3]
SELECT * FROM t1 WHERE a BETWEEN 0 AND 0.9;
a
0
0.8

#SQL[@125,N28]Result[]
SELECT * FROM t1 WHERE a=0.9;

#SQL[@126,N37]Result[1, 3]
SELECT * FROM t1 WHERE a IN (0.8,0.9);
a
0.8

#SQL[@127,N13]Result[]
drop table t1;

#SQL[@128,N33]Result[]
create table t1 (id float, b int);

#SQL[@129,N30]Result[]
insert into t1 values(4.574,1);

#SQL[@130,N31]Result[]
insert into t1 values(5.3111,2);

#SQL[@131,N32]Result[]
insert into t1 values(177.171,3);

#SQL[@132,N57]Result[8, 1]
select count(*) from t1
where id>=5.3111 and id <=177.171;
count(*)
2

#SQL[@134,N59]Result[8, 1]
select count(*) from t1
where id between 5.3111 and 177.171;
count(*)
2

#SQL[@136,N13]Result[]
drop table t1;

#SQL[@137,N34]Result[25, 4]
SELECT (1234.0 BETWEEN 0 AND 1234);
1234.0 between 0 and 1234
true

#SQL[@138,N17]Result[10, 4]
SELECT 0.000 >= 0;
0.000 >= 0
true

#SQL[@139,N24]Result[17, 4]
SELECT 00.000 <= 0.00001;
00.000 <= 0.00001
true

#SQL[@140,N46]Result[39, 5]
SELECT CAST(1.00 AS UNSIGNED) BETWEEN 1 AND -1;
cast(1.00 as unsigned) between 1 and -1
false

#SQL[@141,N50]Result[43, 4]
SELECT CAST(1.00 AS UNSIGNED) NOT BETWEEN 1 AND -1;
cast(1.00 as unsigned) not between 1 and -1
true

#SQL[@142,N46]Result[39, 5]
SELECT CAST(0.00 AS UNSIGNED) BETWEEN 0 AND -1;
cast(0.00 as unsigned) between 0 and -1
false

#SQL[@143,N50]Result[43, 4]
SELECT CAST(0.00 AS UNSIGNED) NOT BETWEEN 0 AND -1;
cast(0.00 as unsigned) not between 0 and -1
true

#SQL[@144,N29]Result[18, 5]
SELECT ( -1 BETWEEN 0 AND 1 );
-1 between 0 and 1
false

#SQL[@145,N39]Result[27, 5]
SELECT ( 0 BETWEEN  0.000000001 AND 1 );
0 between 0.000000001 and 1
false

#SQL[@146,N35]Result[25, 5]
SELECT ( 1 BETWEEN 1.0000001 and 0);
1 between 1.0000001 and 0
false

#SQL[@149,N23]Result[]
drop table if exists t1;

#SQL[@150,N23]Result[]
drop table if exists t2;

#SQL[@151,N23]Result[]
drop table if exists t3;

#SQL[@152,N24]Result[]
drop table if exists t11;

#SQL[@153,N24]Result[]
drop table if exists t12;

#SQL[@154,N52]Result[]
CREATE TABLE t1 (a float(3), b float(5) primary key);

#SQL[@155,N49]Result[]
INSERT INTO t1 VALUES (1.00,1.0000),(1.00,2.0000);

#SQL[@156,N38]Result[]
update t1 set a=2.00 where a=1 limit 1;

#SQL[@157,N16]Result[8, 8, 8]
select * from t1;
a  ¦  b
1  ¦  2
2  ¦  1

#SQL[@158,N27]Result[]
INSERT INTO t1 VALUES (1,3);

#SQL[@159,N30]Result[]
update t1 set a=2 where a=1.00;

#SQL[@160,N16]Result[8, 8, 8, 8]
select * from t1;
a  ¦  b
2  ¦  1
2  ¦  2
2  ¦  3

#SQL[@161,N13]Result[]
drop table t1;

#SQL[@162,N440]Result[]
create table t1 (
a float(10,5) not null,
b int not null default 12346,
c float(10,5) not null default 12345.67890,
d float(10,5) not null default 12345.67890,
e float(10,5) not null default 12345.67890,
f float(10,5) not null default 12345.67890,
g float(10,5) not null default 12345.67890,
h float(10,5) not null default 12345.67890,
i float(10,5) not null default 12345.67890,
j float(10,5) not null default 12345.67890,
primary key (a));

#SQL[@174,N91]Result[]
insert into t1 (a) values (2),(4),(6),(8),(10),(12),(14),(16),(18),(20),(22),(24),(26),(23);

#SQL[@175,N21]Result[]
update t1 set a=a+101;

#SQL[@176,N18]Result[8, 14, 14, 14, 14, 14, 14, 14, 14, 14, 14, 14, 14, 14, 14]
select a,b from t1;
a  ¦  b
103  ¦  12346
105  ¦  12346
107  ¦  12346
109  ¦  12346
111  ¦  12346
113  ¦  12346
115  ¦  12346
117  ¦  12346
119  ¦  12346
121  ¦  12346
123  ¦  12346
125  ¦  12346
127  ¦  12346
124  ¦  12346

#SQL[@177,N30]Result[]
update t1 set a=27 where a=125;

#SQL[@178,N18]Result[8, 14, 14, 14, 14, 14, 14, 14, 14, 14, 14, 14, 14, 14, 13]
select a,b from t1;
a  ¦  b
103  ¦  12346
105  ¦  12346
107  ¦  12346
109  ¦  12346
111  ¦  12346
113  ¦  12346
115  ¦  12346
117  ¦  12346
119  ¦  12346
121  ¦  12346
123  ¦  12346
127  ¦  12346
124  ¦  12346
27  ¦  12346

#SQL[@179,N31]Result[]
update t1 set a=a-1 where 1 > 2;

#SQL[@180,N18]Result[8, 14, 14, 14, 14, 14, 14, 14, 14, 14, 14, 14, 14, 14, 13]
select a,b from t1;
a  ¦  b
103  ¦  12346
105  ¦  12346
107  ¦  12346
109  ¦  12346
111  ¦  12346
113  ¦  12346
115  ¦  12346
117  ¦  12346
119  ¦  12346
121  ¦  12346
123  ¦  12346
127  ¦  12346
124  ¦  12346
27  ¦  12346

#SQL[@181,N31]Result[]
update t1 set a=a-1 where 3 > 2;

#SQL[@182,N18]Result[8, 14, 14, 14, 14, 14, 14, 14, 14, 14, 14, 14, 14, 14, 13]
select a,b from t1;
a  ¦  b
102  ¦  12346
104  ¦  12346
106  ¦  12346
108  ¦  12346
110  ¦  12346
112  ¦  12346
114  ¦  12346
116  ¦  12346
118  ¦  12346
120  ¦  12346
122  ¦  12346
126  ¦  12346
123  ¦  12346
26  ¦  12346

#SQL[@183,N13]Result[]
drop table t1;

#SQL[@184,N55]Result[]
create table t1 (a float(10,5) primary key, b char(32));

#SQL[@185,N46]Result[]
insert into t1 values (1,'apple'), (2,'apple');

#SQL[@186,N16]Result[8, 12, 12]
select * from t1;
a  ¦  b
1  ¦  apple
2  ¦  apple

#SQL[@189,N23]Result[]
drop table if exists t1;

#SQL[@190,N23]Result[]
drop table if exists t2;

#SQL[@191,N23]Result[]
drop table if exists t3;

#SQL[@192,N24]Result[]
drop table if exists t11;

#SQL[@193,N24]Result[]
drop table if exists t12;

#SQL[@194,N52]Result[]
CREATE TABLE t1 (a float(3), b float(5) primary key);

#SQL[@195,N33]Result[]
INSERT INTO t1 VALUES (1,1),(1,2);

#SQL[@196,N32]Result[]
delete from t1 where a=1 limit 1;

#SQL[@197,N16]Result[8, 8]
select * from t1;
a  ¦  b
1  ¦  2

#SQL[@198,N27]Result[]
INSERT INTO t1 VALUES (1,3);

#SQL[@199,N24]Result[]
delete from t1 where a=1;

#SQL[@200,N16]Result[]
select * from t1;

#SQL[@201,N13]Result[]
drop table t1;

#SQL[@202,N440]Result[]
create table t1 (
a float(10,5) not null,
b int not null default 12346,
c float(10,5) not null default 12345.67890,
d float(10,5) not null default 12345.67890,
e float(10,5) not null default 12345.67890,
f float(10,5) not null default 12345.67890,
g float(10,5) not null default 12345.67890,
h float(10,5) not null default 12345.67890,
i float(10,5) not null default 12345.67890,
j float(10,5) not null default 12345.67890,
primary key (a));

#SQL[@214,N72]Result[]
insert into t1 (a) values (2.1111),(4),(00006.12311),(8.41231),(24.0000);

#SQL[@215,N31]Result[]
delete from t1 where a=2+2.0000;

#SQL[@216,N18]Result[8, 17, 18, 18, 13]
select a,b from t1;
a  ¦  b
2.1111  ¦  12346
6.12311  ¦  12346
8.41231  ¦  12346
24  ¦  12346

#SQL[@217,N31]Result[]
delete from t1 where  a=24.0000;

#SQL[@218,N18]Result[8, 17, 18, 18]
select a,b from t1;
a  ¦  b
2.1111  ¦  12346
6.12311  ¦  12346
8.41231  ¦  12346

#SQL[@219,N27]Result[]
delete from t1 where  3 < 2;

#SQL[@220,N18]Result[8, 17, 18, 18]
select a,b from t1;
a  ¦  b
2.1111  ¦  12346
6.12311  ¦  12346
8.41231  ¦  12346

#SQL[@221,N27]Result[]
delete from t1 where  1 < 2;

#SQL[@222,N18]Result[]
select a,b from t1;

#SQL[@223,N13]Result[]
drop table t1;

#SQL[@224,N55]Result[]
create table t1 (a float(10,5) primary key, b char(32));

#SQL[@225,N46]Result[]
insert into t1 values (1,'apple'), (2,'apple');

#SQL[@226,N16]Result[8, 12, 12]
select * from t1;
a  ¦  b
1  ¦  apple
2  ¦  apple

#SQL[@227,N33]Result[26, 3]
select cast(1.1 as float(255, 3));
cast(1.1 as float(255, 3))
1.1

#SQL[@229,N23]Result[]
drop table if exists t1;

#SQL[@230,N30]Result[]
create table t1(a float(5, 2));

#SQL[@231,N32]Error[51]
insert into t1 values("999.995");
data out of range: data type float, value '999.995'

#SQL[@232,N29]Error[48]
insert into t1 values("1000");
data out of range: data type float, value '1000'

#SQL[@233,N33]Error[52]
insert into t1 values("-999.995");
data out of range: data type float, value '-999.995'

#SQL[@234,N30]Error[49]
insert into t1 values("-1000");
data out of range: data type float, value '-1000'

#SQL[@235,N53]Result[]
insert into t1 values("999.994"), ("-999.994"),(null);

#SQL[@236,N93]Result[]
insert into t1 values("90.004"), ("90.005"), ("-90.004"), ("-90.005"), ("90.006"), ("90.007");

#SQL[@237,N16]Result[1, 6, 7, 4, 2, 2, 3, 3, 5, 5]
select * from t1;
a
999.99
-999.99
null
90
90
-90
-90
90.01
90.01

#SQL[@238,N14]Result[]
delete from t1;

#SQL[@239,N59]Result[]
insert into t1 values(90.012), (90.013), (90.014), (90.015);

#SQL[@240,N16]Result[1, 5, 5, 5, 5]
select * from t1;
a
90.01
90.01
90.01
90.02

#SQL[@241,N32]Result[1, 5]
select * from t1 where a > 90.01;
a
90.02

#SQL[@243,N23]Result[]
drop table if exists t1;

#SQL[@244,N23]Result[]
drop table if exists t2;

#SQL[@245,N30]Result[]
create table t1(a float(3, 1));

#SQL[@246,N26]Result[]
create table t2(a tinyint);

#SQL[@247,N26]Result[]
insert into t2 values(100);

#SQL[@248,N31]Error[47]
insert into t1 select * from t2;
data out of range: data type float, value '100'

#SQL[@249,N14]Result[]
delete from t2;

#SQL[@250,N27]Result[]
insert into t2 values(-100);

#SQL[@251,N31]Error[48]
insert into t1 select * from t2;
data out of range: data type float, value '-100'

#SQL[@252,N14]Result[]
delete from t2;

#SQL[@253,N32]Result[]
insert into t2 values(99), (-99);

#SQL[@254,N31]Result[]
insert into t1 select * from t2;

#SQL[@255,N16]Result[1, 2, 3]
select * from t1;
a
99
-99

#SQL[@257,N23]Result[]
drop table if exists t2;

#SQL[@258,N35]Result[]
create table t2(a tinyint unsigned);

#SQL[@259,N26]Result[]
insert into t2 values(100);

#SQL[@260,N31]Error[47]
insert into t1 select * from t2;
data out of range: data type float, value '100'

#SQL[@261,N14]Result[]
delete from t2;

#SQL[@262,N30]Result[]
insert into t2 values(99), (0);

#SQL[@263,N31]Result[]
insert into t1 select * from t2;

#SQL[@264,N16]Result[1, 2, 3, 2, 1]
select * from t1;
a
99
-99
99
0

#SQL[@266,N23]Result[]
drop table if exists t1;

#SQL[@267,N23]Result[]
drop table if exists t2;

#SQL[@268,N30]Result[]
create table t1(a float(5, 2));

#SQL[@269,N27]Result[]
create table t2(a smallint);

#SQL[@270,N29]Result[]
insert into t2 values("1000");

#SQL[@271,N31]Error[48]
insert into t1 select * from t2;
data out of range: data type float, value '1000'

#SQL[@272,N14]Result[]
delete from t2;

#SQL[@273,N30]Result[]
insert into t2 values("-1000");

#SQL[@274,N31]Error[49]
insert into t1 select * from t2;
data out of range: data type float, value '-1000'

#SQL[@275,N14]Result[]
delete from t2;

#SQL[@276,N50]Result[]
insert into t2 values(999), (-999), (0), (1), (-1);

#SQL[@277,N31]Result[]
insert into t1 select * from t2;

#SQL[@278,N16]Result[1, 3, 4, 1, 1, 2]
select * from t1;
a
999
-999
0
1
-1

#SQL[@280,N14]Result[]
delete from t1;

#SQL[@281,N23]Result[]
drop table if exists t2;

#SQL[@282,N22]Result[]
create table t2(a int);

#SQL[@283,N29]Result[]
insert into t2 values("1000");

#SQL[@284,N31]Error[48]
insert into t1 select * from t2;
data out of range: data type float, value '1000'

#SQL[@285,N14]Result[]
delete from t2;

#SQL[@286,N30]Result[]
insert into t2 values("-1000");

#SQL[@287,N31]Error[49]
insert into t1 select * from t2;
data out of range: data type float, value '-1000'

#SQL[@288,N14]Result[]
delete from t2;

#SQL[@289,N50]Result[]
insert into t2 values(999), (-999), (0), (1), (-1);

#SQL[@290,N31]Result[]
insert into t1 select * from t2;

#SQL[@291,N16]Result[1, 3, 4, 1, 1, 2]
select * from t1;
a
999
-999
0
1
-1

#SQL[@293,N14]Result[]
delete from t1;

#SQL[@294,N23]Result[]
drop table if exists t2;

#SQL[@295,N25]Result[]
create table t2(a bigint);

#SQL[@296,N29]Result[]
insert into t2 values("1000");

#SQL[@297,N31]Error[48]
insert into t1 select * from t2;
data out of range: data type float, value '1000'

#SQL[@298,N14]Result[]
delete from t2;

#SQL[@299,N30]Result[]
insert into t2 values("-1000");

#SQL[@300,N31]Error[49]
insert into t1 select * from t2;
data out of range: data type float, value '-1000'

#SQL[@301,N14]Result[]
delete from t2;

#SQL[@302,N50]Result[]
insert into t2 values(999), (-999), (0), (1), (-1);

#SQL[@303,N31]Result[]
insert into t1 select * from t2;

#SQL[@304,N16]Result[1, 3, 4, 1, 1, 2]
select * from t1;
a
999
-999
0
1
-1

#SQL[@306,N23]Result[]
drop table if exists t2;

#SQL[@307,N33]Result[]
create table t2(a decimal(10, 3));

#SQL[@308,N30]Result[]
insert into t2 values(999.995);

#SQL[@309,N31]Error[51]
insert into t1 select * from t2;
data out of range: data type float, value '999.995'

#SQL[@310,N14]Result[]
delete from t2;

#SQL[@311,N31]Result[]
insert into t2 values(-999.995);

#SQL[@312,N31]Error[52]
insert into t1 select * from t2;
data out of range: data type float, value '-999.995'

#SQL[@313,N14]Result[]
delete from t2;

#SQL[@314,N58]Result[]
insert into t2 values(999.994), (-999.994), (99.005), (99);

#SQL[@315,N14]Result[]
delete from t1;

#SQL[@316,N31]Result[]
insert into t1 select * from t2;

#SQL[@317,N16]Result[1, 6, 7, 2, 2]
select * from t1;
a
999.99
-999.99
99
99

#SQL[@319,N23]Result[]
drop table if exists t2;

#SQL[@320,N33]Result[]
create table t2(a decimal(30, 3));

#SQL[@321,N30]Result[]
insert into t2 values(999.995);

#SQL[@322,N31]Error[51]
insert into t1 select * from t2;
data out of range: data type float, value '999.995'

#SQL[@323,N14]Result[]
delete from t2;

#SQL[@324,N31]Result[]
insert into t2 values(-999.995);

#SQL[@325,N31]Error[52]
insert into t1 select * from t2;
data out of range: data type float, value '-999.995'

#SQL[@326,N14]Result[]
delete from t2;

#SQL[@327,N58]Result[]
insert into t2 values(999.994), (-999.994), (99.005), (99);

#SQL[@328,N14]Result[]
delete from t1;

#SQL[@329,N31]Result[]
insert into t1 select * from t2;

#SQL[@330,N16]Result[1, 6, 7, 2, 2]
select * from t1;
a
999.99
-999.99
99
99

#SQL[@332,N23]Result[]
drop table if exists t1;

#SQL[@333,N24]Result[]
create table t1(a float);

#SQL[@334,N34]Result[]
insert into t1 values(3214321.213);

#SQL[@335,N33]Result[18, 9]
select cast(a as varchar) from t1;
cast(a as varchar)
3214321.2

#SQL[@336,N44]Result[]
insert into t1 values(1234567891234567.1234);

#SQL[@337,N39]Result[]
insert into t1 values(0.00000000000001);

#SQL[@338,N33]Result[18, 9, 12, 5]
select cast(a as varchar) from t1;
cast(a as varchar)
3214321.2
1.234568E+15
1E-14

