#SQL[@7,N62]Result[]
create table t1 (a smallint unsigned not null, primary key(a));

#SQL[@8,N57]Result[]
insert into t1 values (65535), (0xFFFC), (65534), (65533);

#SQL[@9,N31]Result[1, 5, 5, 5, 5]
select * from t1 order by a asc;
a
65532
65533
65534
65535

#SQL[@10,N46]Result[1, 5]
select * from t1 where a=65535 order by 1 desc;
a
65535

#SQL[@11,N28]Result[]
delete from t1 where a=65535;

#SQL[@12,N16]Result[1, 5, 5, 5]
select * from t1;
a
65532
65534
65533

#SQL[@13,N13]Result[]
drop table t1;

#SQL[@14,N81]Result[]
create table t1 ( a smallint not null default 1, smallint16 smallint primary key);

#SQL[@15,N56]Result[]
insert into t1 (smallint16) values (-1),(32767),(-32768);

#SQL[@16,N39]Result[17, 13, 9, 12]
select * from t1 order by a desc, 2 asc;
a  ¦  smallint16
1  ¦  -32768
1  ¦  -1
1  ¦  32767

#SQL[@17,N64]Result[61, 28]
select min(smallint16),max(smallint16),max(smallint16)-1 from t1;
min(smallint16)  ¦  max(smallint16)  ¦  max(smallint16) - 1
-32768  ¦  32767  ¦  32766

#SQL[@18,N90]Result[61, 28]
select min(smallint16),max(smallint16),max(smallint16)-1 from t1 group by a order by 1 asc;
min(smallint16)  ¦  max(smallint16)  ¦  max(smallint16) - 1
-32768  ¦  32767  ¦  32766

#SQL[@19,N13]Result[]
drop table t1;

#SQL[@20,N78]Result[]
create table t1 ( a smallint not null default 1, smallint16 smallint unsigned);

#SQL[@21,N74]Result[]
insert into t1 (smallint16) values (0),(65535), (0xFFFE), (65534), (65533);

#SQL[@22,N16]Result[17, 8, 12, 12, 12, 12]
select * from t1;
a  ¦  smallint16
1  ¦  0
1  ¦  65535
1  ¦  65534
1  ¦  65534
1  ¦  65533

#SQL[@23,N46]Result[17, 12, 12, 12]
select * from t1 order by smallint16 limit 1,3;
a  ¦  smallint16
1  ¦  65533
1  ¦  65534
1  ¦  65534

#SQL[@24,N53]Result[17, 12, 12, 12]
select * from t1 order by smallint16 limit 3 offset 1;
a  ¦  smallint16
1  ¦  65533
1  ¦  65534
1  ¦  65534

#SQL[@25,N64]Result[61, 23]
select min(smallint16),max(smallint16),max(smallint16)-1 from t1;
min(smallint16)  ¦  max(smallint16)  ¦  max(smallint16) - 1
0  ¦  65535  ¦  65534

#SQL[@26,N75]Result[61, 23]
select min(smallint16),max(smallint16),max(smallint16)-1 from t1 group by a;
min(smallint16)  ¦  max(smallint16)  ¦  max(smallint16) - 1
0  ¦  65535  ¦  65534

#SQL[@27,N13]Result[]
drop table t1;

#SQL[@28,N53]Result[]
create table t1 (id smallint, a smallint primary key);

#SQL[@29,N27]Result[]
insert into t1 values (1,1);

#SQL[@30,N16]Result[9, 8]
select * from t1;
id  ¦  a
1  ¦  1

#SQL[@31,N27]Result[9, 8]
select * from t1 limit 9999;
id  ¦  a
1  ¦  1

#SQL[@34,N23]Result[]
drop table if exists t1;

#SQL[@35,N23]Result[]
drop table if exists t2;

#SQL[@36,N116]Result[]
create table t1 (
valueu16  smallint unsigned  not null,
value16  smallint          not null,
primary key(value16)
);

#SQL[@41,N116]Result[]
create table t2 (
valueu16  smallint unsigned  not null,
value16  smallint          not null,
primary key(value16)
);

#SQL[@46,N31]Result[]
insert into t1 values(65535, 1);

#SQL[@47,N32]Result[]
insert into t1 values( 32767, 2);

#SQL[@48,N31]Result[]
insert into t2 values(65535, 3);

#SQL[@49,N32]Result[]
insert into t2 values( 32767, 4);

#SQL[@50,N31]Result[]
insert into t1 values(5,-32768);

#SQL[@51,N31]Result[]
insert into t2 values(5,-32768);

#SQL[@52,N16]Result[21, 12, 12, 13]
select * from t1;
valueu16  ¦  value16
65535  ¦  1
32767  ¦  2
5  ¦  -32768

#SQL[@53,N16]Result[21, 12, 12, 13]
select * from t2;
valueu16  ¦  value16
65535  ¦  3
32767  ¦  4
5  ¦  -32768

#SQL[@54,N84]Result[48, 32, 30, 30]
select * from t1 join t2 on t1.valueu16=t2.valueu16  order by 1 asc, t2.value16 desc;
valueu16  ¦  value16  ¦  valueu16  ¦  value16
5  ¦  -32768  ¦  5  ¦  -32768
32767  ¦  2  ¦  32767  ¦  4
65535  ¦  1  ¦  65535  ¦  3

#SQL[@55,N92]Result[48, 30]
select * from t1 join t2 on t1.valueu16=t2.valueu16 where t1.valueu16=65535 order by 1+2 asc;
valueu16  ¦  value16  ¦  valueu16  ¦  value16
65535  ¦  1  ¦  65535  ¦  3

#SQL[@56,N60]Result[48, 32]
select * from t1 join t2 on t1.value16=t2.value16 order by 2;
valueu16  ¦  value16  ¦  valueu16  ¦  value16
5  ¦  -32768  ¦  5  ¦  -32768

#SQL[@57,N23]Result[]
drop table if exists t1;

#SQL[@58,N23]Result[]
drop table if exists t2;

#SQL[@59,N46]Result[]
create table t1 (smallint16 smallint not null);

#SQL[@60,N30]Result[]
insert into t1 values (-32768);

#SQL[@61,N16]Result[10, 6]
select * from t1;
smallint16
-32768

#SQL[@62,N13]Result[]
drop table t1;

#SQL[@63,N48]Result[]
create table t1 (smallint_col smallint unsigned);

#SQL[@64,N29]Result[]
insert into t1 values (65500);

#SQL[@65,N61]Result[12, 5]
select * from t1 where smallint_col=65500 order by abs(1) asc;
smallint_col
65500

#SQL[@69,N13]Result[]
drop table t1;

#SQL[@72,N47]Result[6, 1]
select cast(65500 as unsigned) mod 50 as result;
result
0

#SQL[@73,N28]Result[21, 5]
select cast(32767 as signed);
cast(32767 as signed)
32767

#SQL[@74,N29]Result[22, 6]
select cast(-32768 as signed);
cast(-32768 as signed)
-32768

#SQL[@75,N79]Result[]
CREATE TABLE t1 (id SMALLINT PRIMARY KEY,
a SMALLINT(6) UNSIGNED,
b VARCHAR(6));

#SQL[@78,N124]Result[]
INSERT INTO t1 (id,a) VALUES
(1,0),
(2,CAST(0x7FFF AS UNSIGNED)),
(3,CAST(0x8000 AS UNSIGNED)),
(4,CAST(0xFFFF AS UNSIGNED));

#SQL[@87,N36]Result[]
CREATE TABLE t_smallint(id SMALLINT);

#SQL[@88,N38]Result[]
INSERT INTO t_smallint VALUES (1), (2);

#SQL[@89,N36]Result[17, 12, 11]
SELECT id, id >= 1.1 FROM t_smallint;
id  ¦  id >= 1.1
1  ¦  false
2  ¦  true

#SQL[@90,N36]Result[17, 12, 11]
SELECT id, 1.1 <= id FROM t_smallint;
id  ¦  1.1 <= id
1  ¦  false
2  ¦  true

#SQL[@91,N35]Result[16, 12, 12]
SELECT id, id = 1.1 FROM t_smallint;
id  ¦  id = 1.1
1  ¦  false
2  ¦  false

#SQL[@92,N35]Result[16, 12, 12]
SELECT id, 1.1 = id FROM t_smallint;
id  ¦  1.1 = id
1  ¦  false
2  ¦  false

#SQL[@93,N39]Result[]
SELECT * from t_smallint WHERE id = 1.1;

#SQL[@94,N41]Result[]
SELECT * from t_smallint WHERE id = 1.1e0;

#SQL[@99,N47]Result[]
SELECT * from t_smallint WHERE id IN (1.1, 2.2);

#SQL[@100,N51]Result[]
SELECT * from t_smallint WHERE id IN (1.1e0, 2.2e0);

#SQL[@105,N53]Result[]
SELECT * from t_smallint WHERE id BETWEEN 1.1 AND 1.9;

#SQL[@106,N57]Result[]
SELECT * from t_smallint WHERE id BETWEEN 1.1e0 AND 1.9e0;

#SQL[@111,N13]Result[]
drop table t1;

#SQL[@112,N28]Result[]
CREATE TABLE t1 (a SMALLINT);

#SQL[@113,N25]Result[]
INSERT INTO t1 VALUES (1);

#SQL[@119,N42]Result[]
SELECT * FROM t1 WHERE a BETWEEN 0 AND 0.9;

#SQL[@120,N28]Result[]
SELECT * FROM t1 WHERE a=0.9;

#SQL[@121,N48]Result[]
SELECT * FROM t1 WHERE a IN (0.8,0.9) order by 1;

#SQL[@122,N13]Result[]
drop table t1;

#SQL[@123,N49]Result[]
create table t (id smallint unsigned, b smallint);

#SQL[@124,N29]Result[]
insert into t values(32767,1);

#SQL[@125,N29]Result[]
insert into t values(65535,2);

#SQL[@126,N29]Result[]
insert into t values(32768,3);

#SQL[@127,N64]Result[8, 1]
select count(*) from t
where id>=32767 and id <=65535 order by 1;
count(*)
3

#SQL[@129,N55]Result[8, 1]
select count(*) from t
where id between 32767 and 65535;
count(*)
3

#SQL[@131,N12]Result[]
drop table t;

#SQL[@132,N34]Result[25, 4]
SELECT (65534 BETWEEN 0 AND 65535);
65534 between 0 and 65535
true

#SQL[@133,N19]Result[11, 4]
SELECT  -32000 <= 0;
-32000 <= 0
true

#SQL[@134,N17]Result[10, 4]
SELECT 0 <= 32767;
0 <= 32767
true

#SQL[@135,N45]Result[38, 5]
SELECT CAST(100 AS UNSIGNED) BETWEEN 1 AND -1;
cast(100 as unsigned) between 1 and -1
false

#SQL[@136,N49]Result[42, 4]
SELECT CAST(100 AS UNSIGNED) NOT BETWEEN 1 AND -1;
cast(100 as unsigned) not between 1 and -1
true

#SQL[@137,N43]Result[36, 5]
SELECT CAST(0 AS UNSIGNED) BETWEEN 0 AND -1;
cast(0 as unsigned) between 0 and -1
false

#SQL[@138,N47]Result[40, 4]
SELECT CAST(0 AS UNSIGNED) NOT BETWEEN 0 AND -1;
cast(0 as unsigned) not between 0 and -1
true

#SQL[@139,N40]Result[29, 4]
SELECT ( 65535 BETWEEN 65535 AND 65535 );
65535 between 65535 and 65535
true

#SQL[@140,N36]Result[25, 5]
SELECT ( 32767 BETWEEN 65535 AND 1 );
32767 between 65535 and 1
false

#SQL[@141,N33]Result[22, 5]
SELECT ( -1 BETWEEN 65535 AND 1 );
-1 between 65535 and 1
false

#SQL[@142,N32]Result[21, 5]
SELECT ( 0 BETWEEN 65535 AND 1 );
0 between 65535 and 1
false

#SQL[@143,N32]Result[21, 5]
SELECT ( 1 BETWEEN 65535 AND 1 );
1 between 65535 and 1
false

#SQL[@146,N23]Result[]
drop table if exists t1;

#SQL[@147,N23]Result[]
drop table if exists t2;

#SQL[@148,N23]Result[]
drop table if exists t3;

#SQL[@149,N24]Result[]
drop table if exists t11;

#SQL[@150,N24]Result[]
drop table if exists t12;

#SQL[@151,N58]Result[]
CREATE TABLE t1 (a smallint(3), b smallint(5) primary key);

#SQL[@152,N33]Result[]
INSERT INTO t1 VALUES (1,1),(1,2);

#SQL[@153,N35]Result[]
update t1 set a=2 where a=1 limit 1;

#SQL[@154,N16]Result[8, 8, 8]
select * from t1;
a  ¦  b
1  ¦  2
2  ¦  1

#SQL[@155,N27]Result[]
INSERT INTO t1 VALUES (1,3);

#SQL[@156,N27]Result[]
update t1 set a=2 where a=1;

#SQL[@157,N16]Result[8, 8, 8, 8]
select * from t1;
a  ¦  b
2  ¦  1
2  ¦  2
2  ¦  3

#SQL[@158,N13]Result[]
drop table t1;

#SQL[@159,N334]Result[]
create table t1 (
a smallint not null,
b smallint not null default 0,
c smallint not null default 0,
d smallint not null default 0,
e smallint not null default 0,
f smallint not null default 0,
g smallint not null default 0,
h smallint not null default 0,
i smallint not null default 0,
j smallint not null default 0,
primary key (a));

#SQL[@171,N91]Result[]
insert into t1 (a) values (2),(4),(6),(8),(10),(12),(14),(16),(18),(20),(22),(24),(26),(23);

#SQL[@172,N21]Result[]
update t1 set a=a+101;

#SQL[@173,N18]Result[8, 10, 10, 10, 10, 10, 10, 10, 10, 10, 10, 10, 10, 10, 10]
select a,b from t1;
a  ¦  b
103  ¦  0
105  ¦  0
107  ¦  0
109  ¦  0
111  ¦  0
113  ¦  0
115  ¦  0
117  ¦  0
119  ¦  0
121  ¦  0
123  ¦  0
125  ¦  0
127  ¦  0
124  ¦  0

#SQL[@174,N30]Result[]
update t1 set a=127 where a=25;

#SQL[@175,N18]Result[8, 10, 10, 10, 10, 10, 10, 10, 10, 10, 10, 10, 10, 10, 10]
select a,b from t1;
a  ¦  b
103  ¦  0
105  ¦  0
107  ¦  0
109  ¦  0
111  ¦  0
113  ¦  0
115  ¦  0
117  ¦  0
119  ¦  0
121  ¦  0
123  ¦  0
125  ¦  0
127  ¦  0
124  ¦  0

#SQL[@176,N31]Result[]
update t1 set a=a-1 where 1 > 2;

#SQL[@177,N18]Result[8, 10, 10, 10, 10, 10, 10, 10, 10, 10, 10, 10, 10, 10, 10]
select a,b from t1;
a  ¦  b
103  ¦  0
105  ¦  0
107  ¦  0
109  ¦  0
111  ¦  0
113  ¦  0
115  ¦  0
117  ¦  0
119  ¦  0
121  ¦  0
123  ¦  0
125  ¦  0
127  ¦  0
124  ¦  0

#SQL[@178,N31]Result[]
update t1 set a=a-1 where 3 > 2;

#SQL[@179,N18]Result[8, 10, 10, 10, 10, 10, 10, 10, 10, 10, 10, 10, 10, 10, 10]
select a,b from t1;
a  ¦  b
102  ¦  0
104  ¦  0
106  ¦  0
108  ¦  0
110  ¦  0
112  ¦  0
114  ¦  0
116  ¦  0
118  ¦  0
120  ¦  0
122  ¦  0
124  ¦  0
126  ¦  0
123  ¦  0

#SQL[@180,N13]Result[]
drop table t1;

#SQL[@181,N52]Result[]
create table t1 (a smallint primary key, b char(32));

#SQL[@182,N46]Result[]
insert into t1 values (1,'apple'), (2,'apple');

#SQL[@183,N16]Result[8, 12, 12]
select * from t1;
a  ¦  b
1  ¦  apple
2  ¦  apple

#SQL[@186,N23]Result[]
drop table if exists t1;

#SQL[@187,N23]Result[]
drop table if exists t2;

#SQL[@188,N23]Result[]
drop table if exists t3;

#SQL[@189,N24]Result[]
drop table if exists t11;

#SQL[@190,N24]Result[]
drop table if exists t12;

#SQL[@191,N58]Result[]
CREATE TABLE t1 (a smallint(3), b smallint(5) primary key);

#SQL[@192,N33]Result[]
INSERT INTO t1 VALUES (1,1),(1,2);

#SQL[@193,N32]Result[]
delete from t1 where a=1 limit 1;

#SQL[@194,N16]Result[8, 8]
select * from t1;
a  ¦  b
1  ¦  2

#SQL[@195,N27]Result[]
INSERT INTO t1 VALUES (1,3);

#SQL[@196,N24]Result[]
delete from t1 where a=1;

#SQL[@197,N16]Result[]
select * from t1;

#SQL[@198,N13]Result[]
drop table t1;

#SQL[@199,N334]Result[]
create table t1 (
a smallint not null,
b smallint not null default 0,
c smallint not null default 0,
d smallint not null default 0,
e smallint not null default 0,
f smallint not null default 0,
g smallint not null default 0,
h smallint not null default 0,
i smallint not null default 0,
j smallint not null default 0,
primary key (a));

#SQL[@211,N91]Result[]
insert into t1 (a) values (2),(4),(6),(8),(10),(12),(14),(16),(18),(20),(22),(24),(26),(23);

#SQL[@212,N26]Result[]
delete from t1 where a=2+2;

#SQL[@213,N18]Result[8, 8, 8, 8, 9, 9, 9, 9, 9, 9, 9, 9, 9, 9]
select a,b from t1;
a  ¦  b
2  ¦  0
6  ¦  0
8  ¦  0
10  ¦  0
12  ¦  0
14  ¦  0
16  ¦  0
18  ¦  0
20  ¦  0
22  ¦  0
24  ¦  0
26  ¦  0
23  ¦  0

#SQL[@214,N26]Result[]
delete from t1 where  a=24;

#SQL[@215,N18]Result[8, 8, 8, 8, 9, 9, 9, 9, 9, 9, 9, 9, 9]
select a,b from t1;
a  ¦  b
2  ¦  0
6  ¦  0
8  ¦  0
10  ¦  0
12  ¦  0
14  ¦  0
16  ¦  0
18  ¦  0
20  ¦  0
22  ¦  0
26  ¦  0
23  ¦  0

#SQL[@216,N27]Result[]
delete from t1 where  3 < 2;

#SQL[@217,N18]Result[8, 8, 8, 8, 9, 9, 9, 9, 9, 9, 9, 9, 9]
select a,b from t1;
a  ¦  b
2  ¦  0
6  ¦  0
8  ¦  0
10  ¦  0
12  ¦  0
14  ¦  0
16  ¦  0
18  ¦  0
20  ¦  0
22  ¦  0
26  ¦  0
23  ¦  0

#SQL[@218,N27]Result[]
delete from t1 where  1 < 2;

#SQL[@219,N18]Result[]
select a,b from t1;

#SQL[@220,N13]Result[]
drop table t1;

#SQL[@221,N52]Result[]
create table t1 (a smallint primary key, b char(32));

#SQL[@222,N46]Result[]
insert into t1 values (1,'apple'), (2,'apple');

#SQL[@223,N16]Result[8, 12, 12]
select * from t1;
a  ¦  b
1  ¦  apple
2  ¦  apple

#SQL[@225,N13]Result[]
drop table t1;

#SQL[@226,N27]Result[]
create table t1(a smallint);

#SQL[@227,N38]Result[]
insert into t1 values(-32768), (32767);

#SQL[@228,N16]Result[1, 6, 5]
select * from t1;
a
-32768
32767

#SQL[@229,N29]Error[50]
insert into t1 values(-32769);
data out of range: data type int16, value '-32769'

#SQL[@230,N28]Error[49]
insert into t1 values(32768);
data out of range: data type int16, value '32768'

#SQL[@232,N36]Result[]
create table t2(a smallint unsigned);

#SQL[@233,N33]Result[]
insert into t2 values(0), (32767);

#SQL[@234,N31]Result[]
insert into t1 select * from t1;

#SQL[@235,N28]Result[]
insert into t2 values(32768);

#SQL[@236,N31]Error[49]
insert into t1 select * from t2;
data out of range: data type int16, value '32768'

#SQL[@238,N13]Result[]
drop table t2;

#SQL[@239,N22]Result[]
create table t2(a int);

#SQL[@240,N28]Result[]
insert into t2 values(32768);

#SQL[@241,N31]Error[49]
insert into t1 select * from t2;
data out of range: data type int16, value '32768'

#SQL[@242,N14]Result[]
delete from t2;

#SQL[@243,N29]Result[]
insert into t2 values(-32769);

#SQL[@244,N31]Error[50]
insert into t1 select * from t2;
data out of range: data type int16, value '-32769'

#SQL[@246,N13]Result[]
drop table t2;

#SQL[@247,N31]Result[]
create table t2(a int unsigned);

#SQL[@248,N28]Result[]
insert into t2 values(32768);

#SQL[@249,N31]Error[49]
insert into t1 select * from t2;
data out of range: data type int16, value '32768'

#SQL[@251,N13]Result[]
drop table t2;

#SQL[@252,N25]Result[]
create table t2(a bigint);

#SQL[@253,N28]Result[]
insert into t2 values(32768);

#SQL[@254,N31]Error[49]
insert into t1 select * from t2;
data out of range: data type int16, value '32768'

#SQL[@255,N14]Result[]
delete from t2;

#SQL[@256,N29]Result[]
insert into t2 values(-32769);

#SQL[@257,N31]Error[50]
insert into t1 select * from t2;
data out of range: data type int16, value '-32769'

#SQL[@259,N13]Result[]
drop table t2;

#SQL[@260,N34]Result[]
create table t2(a bigint unsigned);

#SQL[@261,N28]Result[]
insert into t2 values(32768);

#SQL[@262,N31]Error[49]
insert into t1 select * from t2;
data out of range: data type int16, value '32768'

#SQL[@264,N13]Result[]
drop table t1;

#SQL[@265,N36]Result[]
create table t1(a smallint unsigned);

#SQL[@266,N33]Result[]
insert into t1 values(0), (65535);

#SQL[@267,N16]Result[1, 1, 5]
select * from t1;
a
0
65535

#SQL[@268,N25]Error[47]
insert into t1 values(-1);
data out of range: data type uint16, value '-1'

#SQL[@269,N28]Error[50]
insert into t1 values(65536);
data out of range: data type uint16, value '65536'

#SQL[@271,N13]Result[]
drop table t2;

#SQL[@272,N22]Result[]
create table t2(a int);

#SQL[@273,N28]Result[]
insert into t2 values(65536);

#SQL[@274,N31]Error[50]
insert into t1 select * from t2;
data out of range: data type uint16, value '65536'

#SQL[@275,N14]Result[]
delete from t2;

#SQL[@276,N25]Result[]
insert into t2 values(-1);

#SQL[@277,N31]Error[47]
insert into t1 select * from t2;
data out of range: data type uint16, value '-1'

#SQL[@279,N13]Result[]
drop table t2;

#SQL[@280,N31]Result[]
create table t2(a int unsigned);

#SQL[@281,N28]Result[]
insert into t2 values(65536);

#SQL[@282,N31]Error[50]
insert into t1 select * from t2;
data out of range: data type uint16, value '65536'

#SQL[@284,N13]Result[]
drop table t2;

#SQL[@285,N25]Result[]
create table t2(a bigint);

#SQL[@286,N28]Result[]
insert into t2 values(65536);

#SQL[@287,N31]Error[50]
insert into t1 select * from t2;
data out of range: data type uint16, value '65536'

#SQL[@288,N14]Result[]
delete from t2;

#SQL[@289,N25]Result[]
insert into t2 values(-1);

#SQL[@290,N31]Error[47]
insert into t1 select * from t2;
data out of range: data type uint16, value '-1'

#SQL[@292,N13]Result[]
drop table t2;

#SQL[@293,N34]Result[]
create table t2(a bigint unsigned);

#SQL[@294,N28]Result[]
insert into t2 values(65536);

#SQL[@295,N31]Error[50]
insert into t1 select * from t2;
data out of range: data type uint16, value '65536'

#SQL[@297,N13]Result[]
drop table t1;

#SQL[@298,N13]Result[]
drop table t2;

