#SQL[@2,N30]Result[]
create table t1(a int, b uuid);

#SQL[@3,N7]Result[71, 51, 51]
desc t1;
Field  ¦  Type  ¦  Null  ¦  Key  ¦  Default  ¦  Extra  ¦  Comment
a  ¦  INT(32)  ¦  YES  ¦    ¦  null  ¦    ¦  
b  ¦  UUID(0)  ¦  YES  ¦    ¦  null  ¦    ¦  

#SQL[@4,N20]Result[23, 77]
show create table t1;
Table  ¦  Create Table
t1  ¦  CREATE TABLE `t1` (
  `a` int DEFAULT NULL,
  `b` uuid DEFAULT NULL
)

#SQL[@5,N13]Result[]
drop table t1;

#SQL[@30,N30]Result[]
create table t3(a int, b uuid);

#SQL[@31,N65]Result[]
insert into t3 values(10, "f6355110-2d0c-11ed-940f-000c29847904");

#SQL[@32,N65]Result[]
insert into t3 values(20, "1ef96142-2d0d-11ed-940f-000c29847904");

#SQL[@33,N65]Result[]
insert into t3 values(30, "117a0bd5-2d0d-11ed-940f-000c29847904");

#SQL[@34,N65]Result[]
insert into t3 values(40, "18b21c70-2d0d-11ed-940f-000c29847904");

#SQL[@35,N65]Result[]
insert into t3 values(50, "1b50c129-2dba-11ed-940f-000c29847904");

#SQL[@36,N65]Result[]
insert into t3 values(60, "ad9f83eb-2dbd-11ed-940f-000c29847904");

#SQL[@37,N65]Result[]
insert into t3 values(70, "6d1b1fdb-2dbf-11ed-940f-000c29847904");

#SQL[@38,N65]Result[]
insert into t3 values(80, "6d1b1fdb-2dbf-11ed-940f-000c29847904");

#SQL[@39,N65]Result[]
insert into t3 values(90, "1b50c129-2dba-11ed-940f-000c29847904");

#SQL[@42,N16]Result[8, 44, 44, 44, 44, 44, 44, 44, 44, 44]
select * from t3;
a  ¦  b
10  ¦  f6355110-2d0c-11ed-940f-000c29847904
20  ¦  1ef96142-2d0d-11ed-940f-000c29847904
30  ¦  117a0bd5-2d0d-11ed-940f-000c29847904
40  ¦  18b21c70-2d0d-11ed-940f-000c29847904
50  ¦  1b50c129-2dba-11ed-940f-000c29847904
60  ¦  ad9f83eb-2dbd-11ed-940f-000c29847904
70  ¦  6d1b1fdb-2dbf-11ed-940f-000c29847904
80  ¦  6d1b1fdb-2dbf-11ed-940f-000c29847904
90  ¦  1b50c129-2dba-11ed-940f-000c29847904

#SQL[@43,N68]Result[8, 44]
select a,b from t3 where b =  "18b21c70-2d0d-11ed-940f-000c29847904";
a  ¦  b
40  ¦  18b21c70-2d0d-11ed-940f-000c29847904

#SQL[@44,N68]Result[8, 44, 44, 44, 44, 44, 44, 44, 44]
select a,b from t3 where b != "18b21c70-2d0d-11ed-940f-000c29847904";
a  ¦  b
10  ¦  f6355110-2d0c-11ed-940f-000c29847904
20  ¦  1ef96142-2d0d-11ed-940f-000c29847904
30  ¦  117a0bd5-2d0d-11ed-940f-000c29847904
50  ¦  1b50c129-2dba-11ed-940f-000c29847904
60  ¦  ad9f83eb-2dbd-11ed-940f-000c29847904
70  ¦  6d1b1fdb-2dbf-11ed-940f-000c29847904
80  ¦  6d1b1fdb-2dbf-11ed-940f-000c29847904
90  ¦  1b50c129-2dba-11ed-940f-000c29847904

#SQL[@45,N68]Result[]
select a,b from t3 where b >  "f6355110-2d0c-11ed-940f-000c29847904";

#SQL[@46,N68]Result[8, 44]
select a,b from t3 where b >= "f6355110-2d0c-11ed-940f-000c29847904";
a  ¦  b
10  ¦  f6355110-2d0c-11ed-940f-000c29847904

#SQL[@47,N68]Result[]
select a,b from t3 where b <  "117a0bd5-2d0d-11ed-940f-000c29847904";

#SQL[@48,N68]Result[8, 44]
select a,b from t3 where b <= "117a0bd5-2d0d-11ed-940f-000c29847904";
a  ¦  b
30  ¦  117a0bd5-2d0d-11ed-940f-000c29847904

#SQL[@51,N21]Result[6, 36]
select min(b) from t3;
min(b)
117a0bd5-2d0d-11ed-940f-000c29847904

#SQL[@52,N21]Result[6, 36]
select max(b) from t3;
max(b)
f6355110-2d0c-11ed-940f-000c29847904

#SQL[@55,N34]Result[8, 1, 1, 1, 1, 1, 1, 1]
select count(*) from t3 group by b;
count(*)
1
1
1
1
2
1
2

#SQL[@56,N34]Result[8, 1, 1, 1, 1, 1, 1, 1]
select count(b) from t3 group by b;
count(b)
1
1
1
1
2
1
2

#SQL[@57,N32]Result[6, 2, 2, 2, 2, 3, 2, 3]
select sum(a) from t3 group by b;
sum(a)
10
20
30
40
140
60
150

#SQL[@58,N54]Error[210]
select sum(a) from t3 group by b having by sum(a) > 20;
SQL parser error: You have an error in your SQL syntax; check the manual that corresponds to your MatrixOne server version for the right syntax to use. syntax error at line 1 column 42 near \" by sum(a) > 20\";

#SQL[@60,N27]Result[8, 44, 44, 44, 44, 44, 44, 44, 44, 44]
select * from t3 order by b;
a  ¦  b
30  ¦  117a0bd5-2d0d-11ed-940f-000c29847904
40  ¦  18b21c70-2d0d-11ed-940f-000c29847904
50  ¦  1b50c129-2dba-11ed-940f-000c29847904
90  ¦  1b50c129-2dba-11ed-940f-000c29847904
20  ¦  1ef96142-2d0d-11ed-940f-000c29847904
70  ¦  6d1b1fdb-2dbf-11ed-940f-000c29847904
80  ¦  6d1b1fdb-2dbf-11ed-940f-000c29847904
60  ¦  ad9f83eb-2dbd-11ed-940f-000c29847904
10  ¦  f6355110-2d0c-11ed-940f-000c29847904

#SQL[@61,N32]Result[8, 44, 44, 44, 44, 44, 44, 44, 44, 44]
select * from t3 order by b desc;
a  ¦  b
10  ¦  f6355110-2d0c-11ed-940f-000c29847904
60  ¦  ad9f83eb-2dbd-11ed-940f-000c29847904
70  ¦  6d1b1fdb-2dbf-11ed-940f-000c29847904
80  ¦  6d1b1fdb-2dbf-11ed-940f-000c29847904
20  ¦  1ef96142-2d0d-11ed-940f-000c29847904
50  ¦  1b50c129-2dba-11ed-940f-000c29847904
90  ¦  1b50c129-2dba-11ed-940f-000c29847904
40  ¦  18b21c70-2d0d-11ed-940f-000c29847904
30  ¦  117a0bd5-2d0d-11ed-940f-000c29847904

#SQL[@63,N63]Result[]
delete from t3 where b = 'ad9f83eb-2dbd-11ed-940f-000c29847904';

#SQL[@64,N16]Result[8, 44, 44, 44, 44, 44, 44, 44, 44]
select * from t3;
a  ¦  b
10  ¦  f6355110-2d0c-11ed-940f-000c29847904
20  ¦  1ef96142-2d0d-11ed-940f-000c29847904
30  ¦  117a0bd5-2d0d-11ed-940f-000c29847904
40  ¦  18b21c70-2d0d-11ed-940f-000c29847904
50  ¦  1b50c129-2dba-11ed-940f-000c29847904
70  ¦  6d1b1fdb-2dbf-11ed-940f-000c29847904
80  ¦  6d1b1fdb-2dbf-11ed-940f-000c29847904
90  ¦  1b50c129-2dba-11ed-940f-000c29847904

#SQL[@66,N69]Result[]
update t3 set b = 'e5c8314e-2ea7-11ed-8ec0-000c29847904' where a = 50;

#SQL[@67,N29]Result[8, 44]
select * from t3 where a = 50;
a  ¦  b
50  ¦  e5c8314e-2ea7-11ed-8ec0-000c29847904

#SQL[@68,N13]Result[]
drop table t3;

#SQL[@69,N30]Result[]
create table t4(a int, b uuid);

#SQL[@70,N44]Result[]
insert into t4 values(1, uuid()),(2, uuid());

#SQL[@71,N30]Result[1, 1, 1]
select a from t4 order by b, a;
a
1
2

