#SQL[@1,N98]Result[6, 41]
SELECT JSON_INSERT('{"fruits": ["apple", "banana", "cherry"]}', '$.fruits[1]', 'orange') AS result;
result
{"fruits": ["apple", "banana", "cherry"]}

#SQL[@2,N88]Result[6, 41]
SELECT JSON_INSERT('{"fruits": ["apple", "banana"]}', '$.fruits[2]', 'cherry') AS result;
result
{"fruits": ["apple", "banana", "cherry"]}

#SQL[@3,N114]Result[6, 70]
SELECT JSON_INSERT('{"fruits": [{"name": "apple"}, {"name": "banana"}]}', '$.fruits[1].color', 'yellow') AS result;
result
{"fruits": [{"name": "apple"}, {"color": "yellow", "name": "banana"}]}

#SQL[@4,N114]Result[6, 57]
SELECT JSON_INSERT('{"user": {"name": "John", "age": 30}}', '$.user.age', 31, '$.user.city', 'New York') AS result;
result
{"user": {"age": 30, "city": "New York", "name": "John"}}

#SQL[@5,N223]Result[6, 125]
SELECT JSON_INSERT('{"company": {"name": "Moonshot AI", "employees": [{"id": 1, "name": "John"}, {"id": 2, "name": "Jane"}]}}', '$.company.employees[0].name', 'John Doe', '$.company.employees[1].department', 'HR') AS result;
result
{"company": {"employees": [{"id": 1, "name": "John"}, {"department": "HR", "id": 2, "name": "Jane"}], "name": "Moonshot AI"}}

#SQL[@6,N60]Result[]
CREATE TABLE users (
    id INT PRIMARY KEY,
    info JSON
);

#SQL[@11,N414]Result[]
INSERT INTO users (id, info) VALUES
(1, '{"name": "Alice", "age": 30, "email": "alice@example.com", "address": {"city": "New York", "zip": "10001"}}'),
(2, '{"name": "Bob", "age": 25, "email": "bob@example.com", "address": {"city": "Los Angeles", "zip": "90001"}}'),
(3, '{"name": "Charlie", "age": 28, "email": "charlie@example.com", "address": {"city": "Chicago", "zip": "60601"}, "skills": ["Java", "Python"]}');

#SQL[@16,N19]Result[12, 114, 113, 147]
SELECT * FROM users;
id  ¦  info
1  ¦  {"address": {"city": "New York", "zip": "10001"}, "age": 30, "email": "alice@example.com", "name": "Alice"}
2  ¦  {"address": {"city": "Los Angeles", "zip": "90001"}, "age": 25, "email": "bob@example.com", "name": "Bob"}
3  ¦  {"address": {"city": "Chicago", "zip": "60601"}, "age": 28, "email": "charlie@example.com", "name": "Charlie", "skills": ["Java", "Python"]}

#SQL[@18,N81]Result[]
UPDATE users
SET info = JSON_INSERT(info, '$.phone', '123-456-7890')
WHERE id = 1;

#SQL[@21,N19]Result[12, 113, 147, 139]
SELECT * FROM users;
id  ¦  info
2  ¦  {"address": {"city": "Los Angeles", "zip": "90001"}, "age": 25, "email": "bob@example.com", "name": "Bob"}
3  ¦  {"address": {"city": "Chicago", "zip": "60601"}, "age": 28, "email": "charlie@example.com", "name": "Charlie", "skills": ["Java", "Python"]}
1  ¦  {"address": {"city": "New York", "zip": "10001"}, "age": 30, "email": "alice@example.com", "name": "Alice", "phone": "123-456-7890"}

#SQL[@23,N79]Result[]
UPDATE users
SET info = JSON_INSERT(info, '$.address.state', 'CA')
WHERE id = 2;

#SQL[@26,N19]Result[12, 147, 139, 128]
SELECT * FROM users;
id  ¦  info
3  ¦  {"address": {"city": "Chicago", "zip": "60601"}, "age": 28, "email": "charlie@example.com", "name": "Charlie", "skills": ["Java", "Python"]}
1  ¦  {"address": {"city": "New York", "zip": "10001"}, "age": 30, "email": "alice@example.com", "name": "Alice", "phone": "123-456-7890"}
2  ¦  {"address": {"city": "Los Angeles", "state": "CA", "zip": "90001"}, "age": 25, "email": "bob@example.com", "name": "Bob"}

#SQL[@28,N76]Result[]
UPDATE users
SET info = JSON_INSERT(info, '$.skills[2]', 'SQL')
WHERE id = 3;

#SQL[@31,N19]Result[12, 139, 128, 154]
SELECT * FROM users;
id  ¦  info
1  ¦  {"address": {"city": "New York", "zip": "10001"}, "age": 30, "email": "alice@example.com", "name": "Alice", "phone": "123-456-7890"}
2  ¦  {"address": {"city": "Los Angeles", "state": "CA", "zip": "90001"}, "age": 25, "email": "bob@example.com", "name": "Bob"}
3  ¦  {"address": {"city": "Chicago", "zip": "60601"}, "age": 28, "email": "charlie@example.com", "name": "Charlie", "skills": ["Java", "Python", "SQL"]}

#SQL[@33,N106]Result[]
UPDATE users
SET info = JSON_INSERT(info, '$.phone', '123-456-7890', '$.address.state', 'NY')
WHERE id = 1;

#SQL[@36,N19]Result[12, 128, 154, 154]
SELECT * FROM users;
id  ¦  info
2  ¦  {"address": {"city": "Los Angeles", "state": "CA", "zip": "90001"}, "age": 25, "email": "bob@example.com", "name": "Bob"}
3  ¦  {"address": {"city": "Chicago", "zip": "60601"}, "age": 28, "email": "charlie@example.com", "name": "Charlie", "skills": ["Java", "Python", "SQL"]}
1  ¦  {"address": {"city": "New York", "state": "NY", "zip": "10001"}, "age": 30, "email": "alice@example.com", "name": "Alice", "phone": "123-456-7890"}

#SQL[@38,N16]Result[]
drop table users;

