#SQL[@1,N27]Result[]
drop database if exists db2;

#SQL[@2,N19]Result[]
create database db2;

#SQL[@3,N7]Result[]
use db2;

#SQL[@5,N51]Result[]
CREATE TABLE t1 (a INTEGER PRIMARY KEY, b CHAR(10));

#SQL[@6,N7]Result[71, 53, 52]
desc t1;
Field  ¦  Type  ¦  Null  ¦  Key  ¦  Default  ¦  Extra  ¦  Comment
a  ¦  INT(32)  ¦  NO  ¦  PRI  ¦  null  ¦    ¦  
b  ¦  CHAR(10)  ¦  YES  ¦    ¦  null  ¦    ¦  

#SQL[@8,N30]Result[]
insert into t1 values(1, 'ab');

#SQL[@9,N30]Result[]
insert into t1 values(2, 'ac');

#SQL[@10,N30]Result[]
insert into t1 values(3, 'ad');

#SQL[@12,N16]Result[8, 9, 9, 9]
select * from t1;
a  ¦  b
1  ¦  ab
2  ¦  ac
3  ¦  ad

#SQL[@14,N37]Result[]
alter table t1 change a x VARCHAR(20);

#SQL[@15,N7]Result[71, 57, 52]
desc t1;
Field  ¦  Type  ¦  Null  ¦  Key  ¦  Default  ¦  Extra  ¦  Comment
x  ¦  VARCHAR(20)  ¦  NO  ¦  PRI  ¦  null  ¦    ¦  
b  ¦  CHAR(10)  ¦  YES  ¦    ¦  null  ¦    ¦  

#SQL[@16,N16]Result[8, 9, 9, 9]
select * from t1;
x  ¦  b
1  ¦  ab
2  ¦  ac
3  ¦  ad

#SQL[@18,N23]Result[]
drop table if exists t1;

#SQL[@19,N59]Result[]
CREATE TABLE t1 (a INTEGER PRIMARY KEY, b CHAR(10), c date);

#SQL[@20,N7]Result[71, 53, 52, 51]
desc t1;
Field  ¦  Type  ¦  Null  ¦  Key  ¦  Default  ¦  Extra  ¦  Comment
a  ¦  INT(32)  ¦  NO  ¦  PRI  ¦  null  ¦    ¦  
b  ¦  CHAR(10)  ¦  YES  ¦    ¦  null  ¦    ¦  
c  ¦  DATE(0)  ¦  YES  ¦    ¦  null  ¦    ¦  

#SQL[@22,N44]Result[]
insert into t1 values(1, 'ab', '1980-12-17');

#SQL[@23,N44]Result[]
insert into t1 values(2, 'ac', '1981-02-20');

#SQL[@24,N44]Result[]
insert into t1 values(3, 'ad', '1981-02-22');

#SQL[@26,N16]Result[15, 25, 25, 25]
select * from t1;
a  ¦  b  ¦  c
1  ¦  ab  ¦  1980-12-17
2  ¦  ac  ¦  1981-02-20
3  ¦  ad  ¦  1981-02-22

#SQL[@28,N45]Result[]
alter table t1 change a x VARCHAR(20) after b;

#SQL[@29,N7]Result[71, 52, 57, 51]
desc t1;
Field  ¦  Type  ¦  Null  ¦  Key  ¦  Default  ¦  Extra  ¦  Comment
b  ¦  CHAR(10)  ¦  YES  ¦    ¦  null  ¦    ¦  
x  ¦  VARCHAR(20)  ¦  NO  ¦  PRI  ¦  null  ¦    ¦  
c  ¦  DATE(0)  ¦  YES  ¦    ¦  null  ¦    ¦  

#SQL[@30,N16]Result[15, 25, 25, 25]
select * from t1;
b  ¦  x  ¦  c
ab  ¦  1  ¦  1980-12-17
ac  ¦  2  ¦  1981-02-20
ad  ¦  3  ¦  1981-02-22

#SQL[@32,N23]Result[]
drop table if exists t1;

#SQL[@33,N59]Result[]
CREATE TABLE t1 (a INTEGER PRIMARY KEY, b CHAR(10), c date);

#SQL[@34,N7]Result[71, 53, 52, 51]
desc t1;
Field  ¦  Type  ¦  Null  ¦  Key  ¦  Default  ¦  Extra  ¦  Comment
a  ¦  INT(32)  ¦  NO  ¦  PRI  ¦  null  ¦    ¦  
b  ¦  CHAR(10)  ¦  YES  ¦    ¦  null  ¦    ¦  
c  ¦  DATE(0)  ¦  YES  ¦    ¦  null  ¦    ¦  

#SQL[@36,N44]Result[]
insert into t1 values(1, 'ab', '1980-12-17');

#SQL[@37,N44]Result[]
insert into t1 values(2, 'ac', '1981-02-20');

#SQL[@38,N44]Result[]
insert into t1 values(3, 'ad', '1981-02-22');

#SQL[@40,N16]Result[15, 25, 25, 25]
select * from t1;
a  ¦  b  ¦  c
1  ¦  ab  ¦  1980-12-17
2  ¦  ac  ¦  1981-02-20
3  ¦  ad  ¦  1981-02-22

#SQL[@42,N45]Result[]
alter table t1 change a x VARCHAR(20) after c;

#SQL[@43,N7]Result[71, 52, 51, 57]
desc t1;
Field  ¦  Type  ¦  Null  ¦  Key  ¦  Default  ¦  Extra  ¦  Comment
b  ¦  CHAR(10)  ¦  YES  ¦    ¦  null  ¦    ¦  
c  ¦  DATE(0)  ¦  YES  ¦    ¦  null  ¦    ¦  
x  ¦  VARCHAR(20)  ¦  NO  ¦  PRI  ¦  null  ¦    ¦  

#SQL[@44,N16]Result[15, 25, 25, 25]
select * from t1;
b  ¦  c  ¦  x
ab  ¦  1980-12-17  ¦  1
ac  ¦  1981-02-20  ¦  2
ad  ¦  1981-02-22  ¦  3

#SQL[@46,N23]Result[]
drop table if exists t1;

#SQL[@47,N63]Result[]
CREATE TABLE t1 (a INTEGER, b CHAR(10), c date, PRIMARY KEY(a));

#SQL[@48,N7]Result[71, 53, 52, 51]
desc t1;
Field  ¦  Type  ¦  Null  ¦  Key  ¦  Default  ¦  Extra  ¦  Comment
a  ¦  INT(32)  ¦  NO  ¦  PRI  ¦  null  ¦    ¦  
b  ¦  CHAR(10)  ¦  YES  ¦    ¦  null  ¦    ¦  
c  ¦  DATE(0)  ¦  YES  ¦    ¦  null  ¦    ¦  

#SQL[@50,N44]Result[]
insert into t1 values(1, 'ab', '1980-12-17');

#SQL[@51,N44]Result[]
insert into t1 values(2, 'ac', '1981-02-20');

#SQL[@52,N44]Result[]
insert into t1 values(3, 'ad', '1981-02-22');

#SQL[@54,N16]Result[15, 25, 25, 25]
select * from t1;
a  ¦  b  ¦  c
1  ¦  ab  ¦  1980-12-17
2  ¦  ac  ¦  1981-02-20
3  ¦  ad  ¦  1981-02-22

#SQL[@56,N43]Result[]
alter table t1 change b x VARCHAR(20) first;

#SQL[@57,N7]Result[71, 55, 53, 51]
desc t1;
Field  ¦  Type  ¦  Null  ¦  Key  ¦  Default  ¦  Extra  ¦  Comment
x  ¦  VARCHAR(20)  ¦  YES  ¦    ¦  null  ¦    ¦  
a  ¦  INT(32)  ¦  NO  ¦  PRI  ¦  null  ¦    ¦  
c  ¦  DATE(0)  ¦  YES  ¦    ¦  null  ¦    ¦  

#SQL[@58,N16]Result[15, 25, 25, 25]
select * from t1;
x  ¦  a  ¦  c
ab  ¦  1  ¦  1980-12-17
ac  ¦  2  ¦  1981-02-20
ad  ¦  3  ¦  1981-02-22

#SQL[@61,N23]Result[]
drop table if exists t1;

#SQL[@62,N75]Result[]
CREATE TABLE t1 (a INTEGER PRIMARY KEY, b CHAR(10), c date, d decimal(7,2));

#SQL[@63,N7]Result[71, 53, 52, 51, 56]
desc t1;
Field  ¦  Type  ¦  Null  ¦  Key  ¦  Default  ¦  Extra  ¦  Comment
a  ¦  INT(32)  ¦  NO  ¦  PRI  ¦  null  ¦    ¦  
b  ¦  CHAR(10)  ¦  YES  ¦    ¦  null  ¦    ¦  
c  ¦  DATE(0)  ¦  YES  ¦    ¦  null  ¦    ¦  
d  ¦  DECIMAL(7,2)  ¦  YES  ¦    ¦  null  ¦    ¦  

#SQL[@65,N49]Result[]
insert into t1 values(1, 'ab', '1980-12-17', 800);

#SQL[@66,N50]Result[]
insert into t1 values(2, 'ac', '1981-02-20', 1600);

#SQL[@67,N49]Result[]
insert into t1 values(3, 'ad', '1981-02-22', 500);

#SQL[@69,N16]Result[22, 37, 38, 37]
select * from t1;
a  ¦  b  ¦  c  ¦  d
1  ¦  ab  ¦  1980-12-17  ¦  800.00
2  ¦  ac  ¦  1981-02-20  ¦  1600.00
3  ¦  ad  ¦  1981-02-22  ¦  500.00

#SQL[@71,N62]Result[]
alter table t1 change b x VARCHAR(20), change d y int unsigned;

#SQL[@73,N7]Result[71, 53, 55, 51, 60]
desc t1;
Field  ¦  Type  ¦  Null  ¦  Key  ¦  Default  ¦  Extra  ¦  Comment
a  ¦  INT(32)  ¦  NO  ¦  PRI  ¦  null  ¦    ¦  
x  ¦  VARCHAR(20)  ¦  YES  ¦    ¦  null  ¦    ¦  
c  ¦  DATE(0)  ¦  YES  ¦    ¦  null  ¦    ¦  
y  ¦  INT UNSIGNED(32)  ¦  YES  ¦    ¦  null  ¦    ¦  

#SQL[@74,N16]Result[22, 34, 35, 34]
select * from t1;
a  ¦  x  ¦  c  ¦  y
1  ¦  ab  ¦  1980-12-17  ¦  800
2  ¦  ac  ¦  1981-02-20  ¦  1600
3  ¦  ad  ¦  1981-02-22  ¦  500

#SQL[@76,N23]Result[]
drop table if exists t1;

#SQL[@77,N75]Result[]
CREATE TABLE t1 (a INTEGER PRIMARY KEY, b CHAR(10), c date, d decimal(7,2));

#SQL[@78,N7]Result[71, 53, 52, 51, 56]
desc t1;
Field  ¦  Type  ¦  Null  ¦  Key  ¦  Default  ¦  Extra  ¦  Comment
a  ¦  INT(32)  ¦  NO  ¦  PRI  ¦  null  ¦    ¦  
b  ¦  CHAR(10)  ¦  YES  ¦    ¦  null  ¦    ¦  
c  ¦  DATE(0)  ¦  YES  ¦    ¦  null  ¦    ¦  
d  ¦  DECIMAL(7,2)  ¦  YES  ¦    ¦  null  ¦    ¦  

#SQL[@80,N49]Result[]
insert into t1 values(1, 'ab', '1980-12-17', 800);

#SQL[@81,N50]Result[]
insert into t1 values(2, 'ac', '1981-02-20', 1600);

#SQL[@82,N49]Result[]
insert into t1 values(3, 'ad', '1981-02-22', 500);

#SQL[@84,N16]Result[22, 37, 38, 37]
select * from t1;
a  ¦  b  ¦  c  ¦  d
1  ¦  ab  ¦  1980-12-17  ¦  800.00
2  ¦  ac  ¦  1981-02-20  ¦  1600.00
3  ¦  ad  ¦  1981-02-22  ¦  500.00

#SQL[@86,N49]Error[28]
alter table t1 change a x VARCHAR(20) PRIMARY KEY;
Multiple primary key defined

#SQL[@88,N49]Error[28]
alter table t1 change b x VARCHAR(20) PRIMARY KEY;
Multiple primary key defined

#SQL[@90,N76]Error[35]
alter table t1 change b z VARCHAR(20) first, change d m int unsigned after b;
Unknown column 'b' in 'Columns Set'

#SQL[@92,N38]Result[]
ALTER TABLE t1 CHANGE a a INT NOT NULL;

#SQL[@93,N7]Result[71, 53, 52, 51, 56]
desc t1;
Field  ¦  Type  ¦  Null  ¦  Key  ¦  Default  ¦  Extra  ¦  Comment
a  ¦  INT(32)  ¦  NO  ¦  PRI  ¦  null  ¦    ¦  
b  ¦  CHAR(10)  ¦  YES  ¦    ¦  null  ¦    ¦  
c  ¦  DATE(0)  ¦  YES  ¦    ¦  null  ¦    ¦  
d  ¦  DECIMAL(7,2)  ¦  YES  ¦    ¦  null  ¦    ¦  

#SQL[@94,N16]Result[22, 37, 38, 37]
select * from t1;
a  ¦  b  ¦  c  ¦  d
1  ¦  ab  ¦  1980-12-17  ¦  800.00
2  ¦  ac  ¦  1981-02-20  ¦  1600.00
3  ¦  ad  ¦  1981-02-22  ¦  500.00

#SQL[@95,N76]Result[]
alter table t1 change b z VARCHAR(20) first, change d m int unsigned after z;

#SQL[@97,N7]Result[71, 55, 60, 53, 51]
desc t1;
Field  ¦  Type  ¦  Null  ¦  Key  ¦  Default  ¦  Extra  ¦  Comment
z  ¦  VARCHAR(20)  ¦  YES  ¦    ¦  null  ¦    ¦  
m  ¦  INT UNSIGNED(32)  ¦  YES  ¦    ¦  null  ¦    ¦  
a  ¦  INT(32)  ¦  NO  ¦  PRI  ¦  null  ¦    ¦  
c  ¦  DATE(0)  ¦  YES  ¦    ¦  null  ¦    ¦  

#SQL[@98,N16]Result[22, 34, 35, 34]
select * from t1;
z  ¦  m  ¦  a  ¦  c
ab  ¦  800  ¦  1  ¦  1980-12-17
ac  ¦  1600  ¦  2  ¦  1981-02-20
ad  ¦  500  ¦  3  ¦  1981-02-22

#SQL[@100,N23]Result[]
drop table if exists t1;

#SQL[@101,N85]Result[]
CREATE TABLE t1(a INTEGER, b CHAR(10), c datetime, d decimal(7,2), PRIMARY KEY(a, b));

#SQL[@102,N7]Result[71, 53, 54, 55, 56]
desc t1;
Field  ¦  Type  ¦  Null  ¦  Key  ¦  Default  ¦  Extra  ¦  Comment
a  ¦  INT(32)  ¦  NO  ¦  PRI  ¦  null  ¦    ¦  
b  ¦  CHAR(10)  ¦  NO  ¦  PRI  ¦  null  ¦    ¦  
c  ¦  DATETIME(0)  ¦  YES  ¦    ¦  null  ¦    ¦  
d  ¦  DECIMAL(7,2)  ¦  YES  ¦    ¦  null  ¦    ¦  

#SQL[@104,N58]Result[]
insert into t1 values(1, 'ab', '1980-12-17 11:34:45', 800);

#SQL[@105,N59]Result[]
insert into t1 values(2, 'ac', '1981-02-20 10:34:45', 1600);

#SQL[@106,N58]Result[]
insert into t1 values(3, 'ad', '1981-02-22 09:34:45', 500);

#SQL[@107,N16]Result[22, 46, 47, 46]
select * from t1;
a  ¦  b  ¦  c  ¦  d
1  ¦  ab  ¦  1980-12-17 11:34:45  ¦  800.00
2  ¦  ac  ¦  1981-02-20 10:34:45  ¦  1600.00
3  ¦  ad  ¦  1981-02-22 09:34:45  ¦  500.00

#SQL[@109,N92]Result[]
alter table t1 change c x datetime default '2023-06-21 12:34:45' on update CURRENT_TIMESTAMP;

#SQL[@110,N7]Result[71, 53, 54, 70, 56]
desc t1;
Field  ¦  Type  ¦  Null  ¦  Key  ¦  Default  ¦  Extra  ¦  Comment
a  ¦  INT(32)  ¦  NO  ¦  PRI  ¦  null  ¦    ¦  
b  ¦  CHAR(10)  ¦  NO  ¦  PRI  ¦  null  ¦    ¦  
x  ¦  DATETIME(0)  ¦  YES  ¦    ¦  2023-06-21 12:34:45  ¦    ¦  
d  ¦  DECIMAL(7,2)  ¦  YES  ¦    ¦  null  ¦    ¦  

#SQL[@111,N16]Result[22, 46, 47, 46]
select * from t1;
a  ¦  b  ¦  x  ¦  d
1  ¦  ab  ¦  1980-12-17 11:34:45  ¦  800.00
2  ¦  ac  ¦  1981-02-20 10:34:45  ¦  1600.00
3  ¦  ad  ¦  1981-02-22 09:34:45  ¦  500.00

#SQL[@113,N30]Result[]
alter table t1 change x y date;

#SQL[@114,N7]Result[71, 53, 54, 51, 56]
desc t1;
Field  ¦  Type  ¦  Null  ¦  Key  ¦  Default  ¦  Extra  ¦  Comment
a  ¦  INT(32)  ¦  NO  ¦  PRI  ¦  null  ¦    ¦  
b  ¦  CHAR(10)  ¦  NO  ¦  PRI  ¦  null  ¦    ¦  
y  ¦  DATE(0)  ¦  YES  ¦    ¦  null  ¦    ¦  
d  ¦  DECIMAL(7,2)  ¦  YES  ¦    ¦  null  ¦    ¦  

#SQL[@115,N16]Result[22, 37, 38, 37]
select * from t1;
a  ¦  b  ¦  y  ¦  d
1  ¦  ab  ¦  1980-12-17  ¦  800.00
2  ¦  ac  ¦  1981-02-20  ¦  1600.00
3  ¦  ad  ¦  1981-02-22  ¦  500.00

#SQL[@117,N23]Result[]
drop table if exists t1;

#SQL[@118,N112]Result[]
CREATE TABLE t1 (a INTEGER, b CHAR(10), c datetime PRIMARY KEY default '2023-06-21' on update CURRENT_TIMESTAMP);

#SQL[@119,N7]Result[71, 51, 52, 63]
desc t1;
Field  ¦  Type  ¦  Null  ¦  Key  ¦  Default  ¦  Extra  ¦  Comment
a  ¦  INT(32)  ¦  YES  ¦    ¦  null  ¦    ¦  
b  ¦  CHAR(10)  ¦  YES  ¦    ¦  null  ¦    ¦  
c  ¦  DATETIME(0)  ¦  NO  ¦  PRI  ¦  2023-06-21  ¦    ¦  

#SQL[@121,N44]Result[]
insert into t1 values(1, 'ab', '1980-12-17');

#SQL[@122,N44]Result[]
insert into t1 values(2, 'ac', '1981-02-20');

#SQL[@123,N44]Result[]
insert into t1 values(3, 'ad', '1981-02-22');

#SQL[@124,N16]Result[15, 34, 34, 34]
select * from t1;
a  ¦  b  ¦  c
1  ¦  ab  ¦  1980-12-17 00:00:00
2  ¦  ac  ¦  1981-02-20 00:00:00
3  ¦  ad  ¦  1981-02-22 00:00:00

#SQL[@126,N36]Result[]
alter table t1 change c x date first;

#SQL[@127,N7]Result[71, 53, 51, 52]
desc t1;
Field  ¦  Type  ¦  Null  ¦  Key  ¦  Default  ¦  Extra  ¦  Comment
x  ¦  DATE(0)  ¦  NO  ¦  PRI  ¦  null  ¦    ¦  
a  ¦  INT(32)  ¦  YES  ¦    ¦  null  ¦    ¦  
b  ¦  CHAR(10)  ¦  YES  ¦    ¦  null  ¦    ¦  

#SQL[@128,N16]Result[15, 25, 25, 25]
select * from t1;
x  ¦  a  ¦  b
1980-12-17  ¦  1  ¦  ab
1981-02-20  ¦  2  ¦  ac
1981-02-22  ¦  3  ¦  ad

#SQL[@130,N55]Result[]
alter table t1 change x y datetime default '2023-06-21';

#SQL[@131,N7]Result[71, 63, 51, 52]
desc t1;
Field  ¦  Type  ¦  Null  ¦  Key  ¦  Default  ¦  Extra  ¦  Comment
y  ¦  DATETIME(0)  ¦  NO  ¦  PRI  ¦  2023-06-21  ¦    ¦  
a  ¦  INT(32)  ¦  YES  ¦    ¦  null  ¦    ¦  
b  ¦  CHAR(10)  ¦  YES  ¦    ¦  null  ¦    ¦  

#SQL[@132,N16]Result[15, 34, 34, 34]
select * from t1;
y  ¦  a  ¦  b
1980-12-17 00:00:00  ¦  1  ¦  ab
1981-02-20 00:00:00  ¦  2  ¦  ac
1981-02-22 00:00:00  ¦  3  ¦  ad

#SQL[@134,N23]Result[]
drop table if exists t1;

#SQL[@135,N92]Result[]
CREATE TABLE t1(a INTEGER PRIMARY KEY, b CHAR(10), c date, d decimal(7,2), UNIQUE KEY(a, b));

#SQL[@136,N7]Result[71, 53, 52, 51, 56]
desc t1;
Field  ¦  Type  ¦  Null  ¦  Key  ¦  Default  ¦  Extra  ¦  Comment
a  ¦  INT(32)  ¦  NO  ¦  PRI  ¦  null  ¦    ¦  
b  ¦  CHAR(10)  ¦  YES  ¦    ¦  null  ¦    ¦  
c  ¦  DATE(0)  ¦  YES  ¦    ¦  null  ¦    ¦  
d  ¦  DECIMAL(7,2)  ¦  YES  ¦    ¦  null  ¦    ¦  

#SQL[@138,N49]Result[]
insert into t1 values(1, 'ab', '1980-12-17', 800);

#SQL[@139,N50]Result[]
insert into t1 values(2, 'ac', '1981-02-20', 1600);

#SQL[@140,N49]Result[]
insert into t1 values(3, 'ad', '1981-02-22', 500);

#SQL[@141,N16]Result[22, 37, 38, 37]
select * from t1;
a  ¦  b  ¦  c  ¦  d
1  ¦  ab  ¦  1980-12-17  ¦  800.00
2  ¦  ac  ¦  1981-02-20  ¦  1600.00
3  ¦  ad  ¦  1981-02-22  ¦  500.00

#SQL[@143,N37]Result[]
alter table t1 change b x VARCHAR(20);

#SQL[@144,N18]Result[233, 110, 113, 116]
show index from t1;
Table  ¦  Non_unique  ¦  Key_name  ¦  Seq_in_index  ¦  Column_name  ¦  Collation  ¦  Cardinality  ¦  Sub_part  ¦  Packed  ¦  Null  ¦  Index_type  ¦  Comment  ¦  Index_comment  ¦  Index_params  ¦  Visible  ¦  Expression
t1  ¦  0  ¦  a  ¦  1  ¦  a  ¦  A  ¦  0  ¦  NULL  ¦  NULL  ¦    ¦    ¦    ¦    ¦    ¦  YES  ¦  a
t1  ¦  0  ¦  a  ¦  2  ¦  x  ¦  A  ¦  0  ¦  NULL  ¦  NULL  ¦  YES  ¦    ¦    ¦    ¦    ¦  YES  ¦  x
t1  ¦  0  ¦  PRIMARY  ¦  1  ¦  a  ¦  A  ¦  0  ¦  NULL  ¦  NULL  ¦    ¦    ¦    ¦    ¦    ¦  YES  ¦  a

#SQL[@145,N7]Result[71, 53, 55, 51, 56]
desc t1;
Field  ¦  Type  ¦  Null  ¦  Key  ¦  Default  ¦  Extra  ¦  Comment
a  ¦  INT(32)  ¦  NO  ¦  PRI  ¦  null  ¦    ¦  
x  ¦  VARCHAR(20)  ¦  YES  ¦    ¦  null  ¦    ¦  
c  ¦  DATE(0)  ¦  YES  ¦    ¦  null  ¦    ¦  
d  ¦  DECIMAL(7,2)  ¦  YES  ¦    ¦  null  ¦    ¦  

#SQL[@146,N16]Result[22, 37, 38, 37]
select * from t1;
a  ¦  x  ¦  c  ¦  d
1  ¦  ab  ¦  1980-12-17  ¦  800.00
2  ¦  ac  ¦  1981-02-20  ¦  1600.00
3  ¦  ad  ¦  1981-02-22  ¦  500.00

#SQL[@148,N48]Result[]
alter table t1 change x y VARCHAR(20) UNIQUE KEY;

#SQL[@149,N18]Result[233, 110, 113, 113, 116]
show index from t1;
Table  ¦  Non_unique  ¦  Key_name  ¦  Seq_in_index  ¦  Column_name  ¦  Collation  ¦  Cardinality  ¦  Sub_part  ¦  Packed  ¦  Null  ¦  Index_type  ¦  Comment  ¦  Index_comment  ¦  Index_params  ¦  Visible  ¦  Expression
t1  ¦  0  ¦  a  ¦  1  ¦  a  ¦  A  ¦  0  ¦  NULL  ¦  NULL  ¦    ¦    ¦    ¦    ¦    ¦  YES  ¦  a
t1  ¦  0  ¦  a  ¦  2  ¦  y  ¦  A  ¦  0  ¦  NULL  ¦  NULL  ¦  YES  ¦    ¦    ¦    ¦    ¦  YES  ¦  y
t1  ¦  0  ¦  y  ¦  1  ¦  y  ¦  A  ¦  0  ¦  NULL  ¦  NULL  ¦  YES  ¦    ¦    ¦    ¦    ¦  YES  ¦  y
t1  ¦  0  ¦  PRIMARY  ¦  1  ¦  a  ¦  A  ¦  0  ¦  NULL  ¦  NULL  ¦    ¦    ¦    ¦    ¦    ¦  YES  ¦  a

#SQL[@150,N7]Result[71, 53, 58, 51, 56]
desc t1;
Field  ¦  Type  ¦  Null  ¦  Key  ¦  Default  ¦  Extra  ¦  Comment
a  ¦  INT(32)  ¦  NO  ¦  PRI  ¦  null  ¦    ¦  
y  ¦  VARCHAR(20)  ¦  YES  ¦  UNI  ¦  null  ¦    ¦  
c  ¦  DATE(0)  ¦  YES  ¦    ¦  null  ¦    ¦  
d  ¦  DECIMAL(7,2)  ¦  YES  ¦    ¦  null  ¦    ¦  

#SQL[@151,N16]Result[22, 37, 38, 37]
select * from t1;
a  ¦  y  ¦  c  ¦  d
1  ¦  ab  ¦  1980-12-17  ¦  800.00
2  ¦  ac  ¦  1981-02-20  ¦  1600.00
3  ¦  ad  ¦  1981-02-22  ¦  500.00

#SQL[@153,N48]Result[]
alter table t1 change y z VARCHAR(20) UNIQUE KEY;

#SQL[@154,N18]Result[233, 110, 113, 113, 113, 116]
show index from t1;
Table  ¦  Non_unique  ¦  Key_name  ¦  Seq_in_index  ¦  Column_name  ¦  Collation  ¦  Cardinality  ¦  Sub_part  ¦  Packed  ¦  Null  ¦  Index_type  ¦  Comment  ¦  Index_comment  ¦  Index_params  ¦  Visible  ¦  Expression
t1  ¦  0  ¦  a  ¦  1  ¦  a  ¦  A  ¦  0  ¦  NULL  ¦  NULL  ¦    ¦    ¦    ¦    ¦    ¦  YES  ¦  a
t1  ¦  0  ¦  a  ¦  2  ¦  z  ¦  A  ¦  0  ¦  NULL  ¦  NULL  ¦  YES  ¦    ¦    ¦    ¦    ¦  YES  ¦  z
t1  ¦  0  ¦  y  ¦  1  ¦  z  ¦  A  ¦  0  ¦  NULL  ¦  NULL  ¦  YES  ¦    ¦    ¦    ¦    ¦  YES  ¦  z
t1  ¦  0  ¦  z  ¦  1  ¦  z  ¦  A  ¦  0  ¦  NULL  ¦  NULL  ¦  YES  ¦    ¦    ¦    ¦    ¦  YES  ¦  z
t1  ¦  0  ¦  PRIMARY  ¦  1  ¦  a  ¦  A  ¦  0  ¦  NULL  ¦  NULL  ¦    ¦    ¦    ¦    ¦    ¦  YES  ¦  a

#SQL[@155,N7]Result[71, 53, 58, 51, 56]
desc t1;
Field  ¦  Type  ¦  Null  ¦  Key  ¦  Default  ¦  Extra  ¦  Comment
a  ¦  INT(32)  ¦  NO  ¦  PRI  ¦  null  ¦    ¦  
z  ¦  VARCHAR(20)  ¦  YES  ¦  UNI  ¦  null  ¦    ¦  
c  ¦  DATE(0)  ¦  YES  ¦    ¦  null  ¦    ¦  
d  ¦  DECIMAL(7,2)  ¦  YES  ¦    ¦  null  ¦    ¦  

#SQL[@156,N16]Result[22, 37, 38, 37]
select * from t1;
a  ¦  z  ¦  c  ¦  d
1  ¦  ab  ¦  1980-12-17  ¦  800.00
2  ¦  ac  ¦  1981-02-20  ¦  1600.00
3  ¦  ad  ¦  1981-02-22  ¦  500.00

#SQL[@158,N23]Result[]
drop table if exists t1;

#SQL[@159,N92]Result[]
CREATE TABLE t1(a INTEGER PRIMARY KEY, b CHAR(10), c date, d decimal(7,2), UNIQUE KEY(a, b));

#SQL[@160,N7]Result[71, 53, 52, 51, 56]
desc t1;
Field  ¦  Type  ¦  Null  ¦  Key  ¦  Default  ¦  Extra  ¦  Comment
a  ¦  INT(32)  ¦  NO  ¦  PRI  ¦  null  ¦    ¦  
b  ¦  CHAR(10)  ¦  YES  ¦    ¦  null  ¦    ¦  
c  ¦  DATE(0)  ¦  YES  ¦    ¦  null  ¦    ¦  
d  ¦  DECIMAL(7,2)  ¦  YES  ¦    ¦  null  ¦    ¦  

#SQL[@162,N49]Result[]
insert into t1 values(1, 'ab', '1980-12-17', 800);

#SQL[@163,N50]Result[]
insert into t1 values(2, 'ac', '1981-02-20', 1600);

#SQL[@164,N49]Result[]
insert into t1 values(3, 'ad', '1981-02-22', 500);

#SQL[@165,N16]Result[22, 37, 38, 37]
select * from t1;
a  ¦  b  ¦  c  ¦  d
1  ¦  ab  ¦  1980-12-17  ¦  800.00
2  ¦  ac  ¦  1981-02-20  ¦  1600.00
3  ¦  ad  ¦  1981-02-22  ¦  500.00

#SQL[@167,N35]Result[]
alter table t1 rename column a to x;

#SQL[@168,N18]Result[233, 113, 110, 116]
show index from t1;
Table  ¦  Non_unique  ¦  Key_name  ¦  Seq_in_index  ¦  Column_name  ¦  Collation  ¦  Cardinality  ¦  Sub_part  ¦  Packed  ¦  Null  ¦  Index_type  ¦  Comment  ¦  Index_comment  ¦  Index_params  ¦  Visible  ¦  Expression
t1  ¦  0  ¦  a  ¦  2  ¦  b  ¦  A  ¦  0  ¦  NULL  ¦  NULL  ¦  YES  ¦    ¦    ¦    ¦    ¦  YES  ¦  b
t1  ¦  0  ¦  a  ¦  1  ¦  x  ¦  A  ¦  0  ¦  NULL  ¦  NULL  ¦    ¦    ¦    ¦    ¦    ¦  YES  ¦  x
t1  ¦  0  ¦  PRIMARY  ¦  1  ¦  x  ¦  A  ¦  0  ¦  NULL  ¦  NULL  ¦    ¦    ¦    ¦    ¦    ¦  YES  ¦  x

#SQL[@169,N7]Result[71, 53, 52, 51, 56]
desc t1;
Field  ¦  Type  ¦  Null  ¦  Key  ¦  Default  ¦  Extra  ¦  Comment
x  ¦  INT(32)  ¦  NO  ¦  PRI  ¦  null  ¦    ¦  
b  ¦  CHAR(10)  ¦  YES  ¦    ¦  null  ¦    ¦  
c  ¦  DATE(0)  ¦  YES  ¦    ¦  null  ¦    ¦  
d  ¦  DECIMAL(7,2)  ¦  YES  ¦    ¦  null  ¦    ¦  

#SQL[@170,N16]Result[22, 37, 38, 37]
select * from t1;
x  ¦  b  ¦  c  ¦  d
1  ¦  ab  ¦  1980-12-17  ¦  800.00
2  ¦  ac  ¦  1981-02-20  ¦  1600.00
3  ¦  ad  ¦  1981-02-22  ¦  500.00

#SQL[@172,N35]Result[]
alter table t1 rename column b to y;

#SQL[@173,N18]Result[233, 110, 116, 113]
show index from t1;
Table  ¦  Non_unique  ¦  Key_name  ¦  Seq_in_index  ¦  Column_name  ¦  Collation  ¦  Cardinality  ¦  Sub_part  ¦  Packed  ¦  Null  ¦  Index_type  ¦  Comment  ¦  Index_comment  ¦  Index_params  ¦  Visible  ¦  Expression
t1  ¦  0  ¦  a  ¦  1  ¦  x  ¦  A  ¦  0  ¦  NULL  ¦  NULL  ¦    ¦    ¦    ¦    ¦    ¦  YES  ¦  x
t1  ¦  0  ¦  PRIMARY  ¦  1  ¦  x  ¦  A  ¦  0  ¦  NULL  ¦  NULL  ¦    ¦    ¦    ¦    ¦    ¦  YES  ¦  x
t1  ¦  0  ¦  a  ¦  2  ¦  y  ¦  A  ¦  0  ¦  NULL  ¦  NULL  ¦  YES  ¦    ¦    ¦    ¦    ¦  YES  ¦  y

#SQL[@174,N7]Result[71, 53, 52, 51, 56]
desc t1;
Field  ¦  Type  ¦  Null  ¦  Key  ¦  Default  ¦  Extra  ¦  Comment
x  ¦  INT(32)  ¦  NO  ¦  PRI  ¦  null  ¦    ¦  
y  ¦  CHAR(10)  ¦  YES  ¦    ¦  null  ¦    ¦  
c  ¦  DATE(0)  ¦  YES  ¦    ¦  null  ¦    ¦  
d  ¦  DECIMAL(7,2)  ¦  YES  ¦    ¦  null  ¦    ¦  

#SQL[@175,N16]Result[22, 37, 38, 37]
select * from t1;
x  ¦  y  ¦  c  ¦  d
1  ¦  ab  ¦  1980-12-17  ¦  800.00
2  ¦  ac  ¦  1981-02-20  ¦  1600.00
3  ¦  ad  ¦  1981-02-22  ¦  500.00

#SQL[@177,N23]Result[]
drop table if exists t1;

#SQL[@178,N95]Result[]
CREATE TABLE t1(a INTEGER PRIMARY KEY, b CHAR(10), c date, d decimal(7,2), INDEX(a, b), KEY(c));

#SQL[@179,N7]Result[71, 53, 52, 54, 56]
desc t1;
Field  ¦  Type  ¦  Null  ¦  Key  ¦  Default  ¦  Extra  ¦  Comment
a  ¦  INT(32)  ¦  NO  ¦  PRI  ¦  null  ¦    ¦  
b  ¦  CHAR(10)  ¦  YES  ¦    ¦  null  ¦    ¦  
c  ¦  DATE(0)  ¦  YES  ¦  MUL  ¦  null  ¦    ¦  
d  ¦  DECIMAL(7,2)  ¦  YES  ¦    ¦  null  ¦    ¦  

#SQL[@181,N49]Result[]
insert into t1 values(1, 'ab', '1980-12-17', 800);

#SQL[@182,N50]Result[]
insert into t1 values(2, 'ac', '1981-02-20', 1600);

#SQL[@183,N49]Result[]
insert into t1 values(3, 'ad', '1981-02-22', 500);

#SQL[@184,N16]Result[22, 37, 38, 37]
select * from t1;
a  ¦  b  ¦  c  ¦  d
1  ¦  ab  ¦  1980-12-17  ¦  800.00
2  ¦  ac  ¦  1981-02-20  ¦  1600.00
3  ¦  ad  ¦  1981-02-22  ¦  500.00

#SQL[@186,N34]Result[]
alter table t1 change c x datetime;

#SQL[@187,N18]Result[233, 110, 113, 113, 116]
show index from t1;
Table  ¦  Non_unique  ¦  Key_name  ¦  Seq_in_index  ¦  Column_name  ¦  Collation  ¦  Cardinality  ¦  Sub_part  ¦  Packed  ¦  Null  ¦  Index_type  ¦  Comment  ¦  Index_comment  ¦  Index_params  ¦  Visible  ¦  Expression
t1  ¦  1  ¦  a  ¦  1  ¦  a  ¦  A  ¦  0  ¦  NULL  ¦  NULL  ¦    ¦    ¦    ¦    ¦    ¦  YES  ¦  a
t1  ¦  1  ¦  a  ¦  2  ¦  b  ¦  A  ¦  0  ¦  NULL  ¦  NULL  ¦  YES  ¦    ¦    ¦    ¦    ¦  YES  ¦  b
t1  ¦  1  ¦  c  ¦  1  ¦  x  ¦  A  ¦  0  ¦  NULL  ¦  NULL  ¦  YES  ¦    ¦    ¦    ¦    ¦  YES  ¦  x
t1  ¦  0  ¦  PRIMARY  ¦  1  ¦  a  ¦  A  ¦  0  ¦  NULL  ¦  NULL  ¦    ¦    ¦    ¦    ¦    ¦  YES  ¦  a

#SQL[@188,N7]Result[71, 53, 52, 58, 56]
desc t1;
Field  ¦  Type  ¦  Null  ¦  Key  ¦  Default  ¦  Extra  ¦  Comment
a  ¦  INT(32)  ¦  NO  ¦  PRI  ¦  null  ¦    ¦  
b  ¦  CHAR(10)  ¦  YES  ¦    ¦  null  ¦    ¦  
x  ¦  DATETIME(0)  ¦  YES  ¦  MUL  ¦  null  ¦    ¦  
d  ¦  DECIMAL(7,2)  ¦  YES  ¦    ¦  null  ¦    ¦  

#SQL[@189,N16]Result[22, 46, 47, 46]
select * from t1;
a  ¦  b  ¦  x  ¦  d
1  ¦  ab  ¦  1980-12-17 00:00:00  ¦  800.00
2  ¦  ac  ¦  1981-02-20 00:00:00  ¦  1600.00
3  ¦  ad  ¦  1981-02-22 00:00:00  ¦  500.00

#SQL[@192,N41]Error[28]
alter table t1 change x y VARCHAR(20) KEY;
Multiple primary key defined

#SQL[@194,N48]Result[]
alter table t1 change x y VARCHAR(20) UNIQUE KEY;

#SQL[@195,N18]Result[233, 113, 110, 113, 113, 116]
show index from t1;
Table  ¦  Non_unique  ¦  Key_name  ¦  Seq_in_index  ¦  Column_name  ¦  Collation  ¦  Cardinality  ¦  Sub_part  ¦  Packed  ¦  Null  ¦  Index_type  ¦  Comment  ¦  Index_comment  ¦  Index_params  ¦  Visible  ¦  Expression
t1  ¦  0  ¦  y  ¦  1  ¦  y  ¦  A  ¦  0  ¦  NULL  ¦  NULL  ¦  YES  ¦    ¦    ¦    ¦    ¦  YES  ¦  y
t1  ¦  1  ¦  a  ¦  1  ¦  a  ¦  A  ¦  0  ¦  NULL  ¦  NULL  ¦    ¦    ¦    ¦    ¦    ¦  YES  ¦  a
t1  ¦  1  ¦  a  ¦  2  ¦  b  ¦  A  ¦  0  ¦  NULL  ¦  NULL  ¦  YES  ¦    ¦    ¦    ¦    ¦  YES  ¦  b
t1  ¦  1  ¦  c  ¦  1  ¦  y  ¦  A  ¦  0  ¦  NULL  ¦  NULL  ¦  YES  ¦    ¦    ¦    ¦    ¦  YES  ¦  y
t1  ¦  0  ¦  PRIMARY  ¦  1  ¦  a  ¦  A  ¦  0  ¦  NULL  ¦  NULL  ¦    ¦    ¦    ¦    ¦    ¦  YES  ¦  a

#SQL[@196,N7]Result[71, 53, 52, 58, 56]
desc t1;
Field  ¦  Type  ¦  Null  ¦  Key  ¦  Default  ¦  Extra  ¦  Comment
a  ¦  INT(32)  ¦  NO  ¦  PRI  ¦  null  ¦    ¦  
b  ¦  CHAR(10)  ¦  YES  ¦    ¦  null  ¦    ¦  
y  ¦  VARCHAR(20)  ¦  YES  ¦  UNI  ¦  null  ¦    ¦  
d  ¦  DECIMAL(7,2)  ¦  YES  ¦    ¦  null  ¦    ¦  

#SQL[@197,N16]Result[22, 46, 47, 46]
select * from t1;
a  ¦  b  ¦  y  ¦  d
1  ¦  ab  ¦  1980-12-17 00:00:00  ¦  800.00
2  ¦  ac  ¦  1981-02-20 00:00:00  ¦  1600.00
3  ¦  ad  ¦  1981-02-22 00:00:00  ¦  500.00

#SQL[@199,N23]Result[]
drop table if exists t1;

#SQL[@200,N95]Result[]
create table t1(a int unsigned, b varchar(15) NOT NULL, c date, d decimal(7,2), primary key(a));

#SQL[@201,N7]Result[71, 62, 54, 51, 56]
desc t1;
Field  ¦  Type  ¦  Null  ¦  Key  ¦  Default  ¦  Extra  ¦  Comment
a  ¦  INT UNSIGNED(32)  ¦  NO  ¦  PRI  ¦  null  ¦    ¦  
b  ¦  VARCHAR(15)  ¦  NO  ¦    ¦  null  ¦    ¦  
c  ¦  DATE(0)  ¦  YES  ¦    ¦  null  ¦    ¦  
d  ¦  DECIMAL(7,2)  ¦  YES  ¦    ¦  null  ¦    ¦  

#SQL[@203,N53]Result[]
insert into t1 values (7369,'SMITH','1980-12-17',800);

#SQL[@204,N55]Result[]
insert into t1 values  (7499,'ALLEN','1981-02-20',1600);

#SQL[@205,N53]Result[]
insert into t1 values (7521,'WARD','1981-02-22',1250);

#SQL[@206,N55]Result[]
insert into t1 values  (7566,'JONES','1981-04-02',2975);

#SQL[@207,N56]Result[]
insert into t1 values  (7654,'MARTIN','1981-09-28',1250);

#SQL[@208,N16]Result[22, 43, 44, 43, 44, 45]
select * from t1;
a  ¦  b  ¦  c  ¦  d
7369  ¦  SMITH  ¦  1980-12-17  ¦  800.00
7499  ¦  ALLEN  ¦  1981-02-20  ¦  1600.00
7521  ¦  WARD  ¦  1981-02-22  ¦  1250.00
7566  ¦  JONES  ¦  1981-04-02  ¦  2975.00
7654  ¦  MARTIN  ¦  1981-09-28  ¦  1250.00

#SQL[@211,N44]Result[]
alter table t1 change a x int auto_increment;

#SQL[@212,N7]Result[71, 67, 54, 51, 56]
desc t1;
Field  ¦  Type  ¦  Null  ¦  Key  ¦  Default  ¦  Extra  ¦  Comment
x  ¦  INT(32)  ¦  NO  ¦  PRI  ¦  null  ¦  auto_increment  ¦  
b  ¦  VARCHAR(15)  ¦  NO  ¦    ¦  null  ¦    ¦  
c  ¦  DATE(0)  ¦  YES  ¦    ¦  null  ¦    ¦  
d  ¦  DECIMAL(7,2)  ¦  YES  ¦    ¦  null  ¦    ¦  

#SQL[@213,N16]Result[22, 43, 44, 43, 44, 45]
select * from t1;
x  ¦  b  ¦  c  ¦  d
7369  ¦  SMITH  ¦  1980-12-17  ¦  800.00
7499  ¦  ALLEN  ¦  1981-02-20  ¦  1600.00
7521  ¦  WARD  ¦  1981-02-22  ¦  1250.00
7566  ¦  JONES  ¦  1981-04-02  ¦  2975.00
7654  ¦  MARTIN  ¦  1981-09-28  ¦  1250.00

#SQL[@215,N38]Result[]
alter table t1 change d y decimal(6,2);

#SQL[@216,N7]Result[71, 67, 54, 51, 56]
desc t1;
Field  ¦  Type  ¦  Null  ¦  Key  ¦  Default  ¦  Extra  ¦  Comment
x  ¦  INT(32)  ¦  NO  ¦  PRI  ¦  null  ¦  auto_increment  ¦  
b  ¦  VARCHAR(15)  ¦  NO  ¦    ¦  null  ¦    ¦  
c  ¦  DATE(0)  ¦  YES  ¦    ¦  null  ¦    ¦  
y  ¦  DECIMAL(6,2)  ¦  YES  ¦    ¦  null  ¦    ¦  

#SQL[@217,N16]Result[22, 43, 44, 43, 44, 45]
select * from t1;
x  ¦  b  ¦  c  ¦  y
7369  ¦  SMITH  ¦  1980-12-17  ¦  800.00
7499  ¦  ALLEN  ¦  1981-02-20  ¦  1600.00
7521  ¦  WARD  ¦  1981-02-22  ¦  1250.00
7566  ¦  JONES  ¦  1981-04-02  ¦  2975.00
7654  ¦  MARTIN  ¦  1981-09-28  ¦  1250.00

#SQL[@219,N23]Result[]
drop table if exists t1;

#SQL[@220,N85]Result[]
CREATE TABLE t1(a INTEGER, b CHAR(10), c datetime, d decimal(7,2), PRIMARY KEY(a, b));

#SQL[@221,N7]Result[71, 53, 54, 55, 56]
desc t1;
Field  ¦  Type  ¦  Null  ¦  Key  ¦  Default  ¦  Extra  ¦  Comment
a  ¦  INT(32)  ¦  NO  ¦  PRI  ¦  null  ¦    ¦  
b  ¦  CHAR(10)  ¦  NO  ¦  PRI  ¦  null  ¦    ¦  
c  ¦  DATETIME(0)  ¦  YES  ¦    ¦  null  ¦    ¦  
d  ¦  DECIMAL(7,2)  ¦  YES  ¦    ¦  null  ¦    ¦  

#SQL[@223,N58]Result[]
insert into t1 values(1, 'ab', '1980-12-17 11:34:45', 800);

#SQL[@224,N59]Result[]
insert into t1 values(2, 'ac', '1981-02-20 10:34:45', 1600);

#SQL[@225,N58]Result[]
insert into t1 values(3, 'ad', '1981-02-22 09:34:45', 500);

#SQL[@226,N16]Result[22, 46, 47, 46]
select * from t1;
a  ¦  b  ¦  c  ¦  d
1  ¦  ab  ¦  1980-12-17 11:34:45  ¦  800.00
2  ¦  ac  ¦  1981-02-20 10:34:45  ¦  1600.00
3  ¦  ad  ¦  1981-02-22 09:34:45  ¦  500.00

#SQL[@228,N38]Result[]
alter table t1 change a x decimal(7,2);

#SQL[@229,N7]Result[71, 58, 54, 55, 56]
desc t1;
Field  ¦  Type  ¦  Null  ¦  Key  ¦  Default  ¦  Extra  ¦  Comment
x  ¦  DECIMAL(7,2)  ¦  NO  ¦  PRI  ¦  null  ¦    ¦  
b  ¦  CHAR(10)  ¦  NO  ¦  PRI  ¦  null  ¦    ¦  
c  ¦  DATETIME(0)  ¦  YES  ¦    ¦  null  ¦    ¦  
d  ¦  DECIMAL(7,2)  ¦  YES  ¦    ¦  null  ¦    ¦  

#SQL[@230,N16]Result[22, 49, 50, 49]
select * from t1;
x  ¦  b  ¦  c  ¦  d
1.00  ¦  ab  ¦  1980-12-17 11:34:45  ¦  800.00
2.00  ¦  ac  ¦  1981-02-20 10:34:45  ¦  1600.00
3.00  ¦  ad  ¦  1981-02-22 09:34:45  ¦  500.00

#SQL[@232,N35]Result[]
alter table t1 rename column b to y;

#SQL[@233,N7]Result[71, 58, 54, 55, 56]
desc t1;
Field  ¦  Type  ¦  Null  ¦  Key  ¦  Default  ¦  Extra  ¦  Comment
x  ¦  DECIMAL(7,2)  ¦  NO  ¦  PRI  ¦  null  ¦    ¦  
y  ¦  CHAR(10)  ¦  NO  ¦  PRI  ¦  null  ¦    ¦  
c  ¦  DATETIME(0)  ¦  YES  ¦    ¦  null  ¦    ¦  
d  ¦  DECIMAL(7,2)  ¦  YES  ¦    ¦  null  ¦    ¦  

#SQL[@234,N16]Result[22, 49, 50, 49]
select * from t1;
x  ¦  y  ¦  c  ¦  d
1.00  ¦  ab  ¦  1980-12-17 11:34:45  ¦  800.00
2.00  ¦  ac  ¦  1981-02-20 10:34:45  ¦  1600.00
3.00  ¦  ad  ¦  1981-02-22 09:34:45  ¦  500.00

#SQL[@236,N35]Result[]
alter table t1 rename column c to z;

#SQL[@237,N7]Result[71, 58, 54, 55, 56]
desc t1;
Field  ¦  Type  ¦  Null  ¦  Key  ¦  Default  ¦  Extra  ¦  Comment
x  ¦  DECIMAL(7,2)  ¦  NO  ¦  PRI  ¦  null  ¦    ¦  
y  ¦  CHAR(10)  ¦  NO  ¦  PRI  ¦  null  ¦    ¦  
z  ¦  DATETIME(0)  ¦  YES  ¦    ¦  null  ¦    ¦  
d  ¦  DECIMAL(7,2)  ¦  YES  ¦    ¦  null  ¦    ¦  

#SQL[@238,N16]Result[22, 49, 50, 49]
select * from t1;
x  ¦  y  ¦  z  ¦  d
1.00  ¦  ab  ¦  1980-12-17 11:34:45  ¦  800.00
2.00  ¦  ac  ¦  1981-02-20 10:34:45  ¦  1600.00
3.00  ¦  ad  ¦  1981-02-22 09:34:45  ¦  500.00

#SQL[@240,N25]Result[]
drop table if exists dept;

#SQL[@241,N180]Result[]
create table dept(
                     deptno varchar(20),
                     dname varchar(15),
                     loc varchar(50),
                     primary key(deptno)
);

#SQL[@248,N52]Result[]
INSERT INTO dept VALUES (10,'ACCOUNTING','NEW YORK');

#SQL[@249,N48]Result[]
INSERT INTO dept VALUES (20,'RESEARCH','DALLAS');

#SQL[@250,N46]Result[]
INSERT INTO dept VALUES (30,'SALES','CHICAGO');

#SQL[@251,N50]Result[]
INSERT INTO dept VALUES (40,'OPERATIONS','BOSTON');

#SQL[@253,N24]Result[]
drop table if exists emp;

#SQL[@254,N461]Result[]
create table emp(
                    empno int unsigned auto_increment,
                    ename varchar(15),
                    job varchar(10),
                    mgr int unsigned,
                    hiredate date,
                    sal decimal(7,2),
                    comm decimal(7,2),
                    deptno varchar(20),
                    primary key(empno),
                    constraint `c1` FOREIGN KEY (deptno) REFERENCES dept(deptno)
);

#SQL[@267,N75]Result[]
INSERT INTO emp VALUES (7369,'SMITH','CLERK',7902,'1980-12-17',800,NULL,20);

#SQL[@268,N78]Result[]
INSERT INTO emp VALUES (7499,'ALLEN','SALESMAN',7698,'1981-02-20',1600,300,30);

#SQL[@269,N77]Result[]
INSERT INTO emp VALUES (7521,'WARD','SALESMAN',7698,'1981-02-22',1250,500,30);

#SQL[@270,N78]Result[]
INSERT INTO emp VALUES (7566,'JONES','MANAGER',7839,'1981-04-02',2975,NULL,20);

#SQL[@271,N80]Result[]
INSERT INTO emp VALUES (7654,'MARTIN','SALESMAN',7698,'1981-09-28',1250,1400,30);

#SQL[@272,N78]Result[]
INSERT INTO emp VALUES (7698,'BLAKE','MANAGER',7839,'1981-05-01',2850,NULL,30);

#SQL[@273,N78]Result[]
INSERT INTO emp VALUES (7782,'CLARK','MANAGER',7839,'1981-06-09',2450,NULL,10);

#SQL[@274,N78]Result[]
INSERT INTO emp VALUES (7788,'SCOTT','ANALYST',7566,'0087-07-13',3000,NULL,20);

#SQL[@275,N79]Result[]
INSERT INTO emp VALUES (7839,'KING','PRESIDENT',NULL,'1981-11-17',5000,NULL,10);

#SQL[@276,N77]Result[]
INSERT INTO emp VALUES (7844,'TURNER','SALESMAN',7698,'1981-09-08',1500,0,30);

#SQL[@277,N76]Result[]
INSERT INTO emp VALUES (7876,'ADAMS','CLERK',7788,'0087-07-13',1100,NULL,20);

#SQL[@278,N75]Result[]
INSERT INTO emp VALUES (7900,'JAMES','CLERK',7698,'1981-12-03',950,NULL,30);

#SQL[@279,N77]Result[]
INSERT INTO emp VALUES (7902,'FORD','ANALYST',7566,'1981-12-03',3000,NULL,20);

#SQL[@280,N77]Result[]
INSERT INTO emp VALUES (7934,'MILLER','CLERK',7782,'1982-01-23',1300,NULL,10);

#SQL[@283,N45]Error[68]
alter table emp change deptno deptno char(20);
Cannot change column 'deptno': used in a foreign key constraint 'c1'

#SQL[@285,N40]Error[68]
alter table emp change deptno deptno int;
Cannot change column 'deptno': used in a foreign key constraint 'c1'

#SQL[@288,N48]Error[68]
alter table emp change deptno deptno varchar(10);
Cannot change column 'deptno': used in a foreign key constraint 'c1'

#SQL[@289,N48]Result[]
alter table emp change deptno deptno varchar(25);

#SQL[@290,N8]Result[71, 80, 59, 57, 62, 58, 58, 59, 63]
desc emp;
Field  ¦  Type  ¦  Null  ¦  Key  ¦  Default  ¦  Extra  ¦  Comment
empno  ¦  INT UNSIGNED(32)  ¦  NO  ¦  PRI  ¦  null  ¦  auto_increment  ¦  
ename  ¦  VARCHAR(15)  ¦  YES  ¦    ¦  null  ¦    ¦  
job  ¦  VARCHAR(10)  ¦  YES  ¦    ¦  null  ¦    ¦  
mgr  ¦  INT UNSIGNED(32)  ¦  YES  ¦    ¦  null  ¦    ¦  
hiredate  ¦  DATE(0)  ¦  YES  ¦    ¦  null  ¦    ¦  
sal  ¦  DECIMAL(7,2)  ¦  YES  ¦    ¦  null  ¦    ¦  
comm  ¦  DECIMAL(7,2)  ¦  YES  ¦    ¦  null  ¦    ¦  
deptno  ¦  VARCHAR(25)  ¦  YES  ¦  MUL  ¦  null  ¦    ¦  

#SQL[@291,N17]Result[79, 82, 88, 87, 85, 90, 85, 85, 85, 86, 87, 83, 82, 84, 84]
select * from emp;
empno  ¦  ename  ¦  job  ¦  mgr  ¦  hiredate  ¦  sal  ¦  comm  ¦  deptno
7369  ¦  SMITH  ¦  CLERK  ¦  7902  ¦  1980-12-17  ¦  800.00  ¦  null  ¦  20
7499  ¦  ALLEN  ¦  SALESMAN  ¦  7698  ¦  1981-02-20  ¦  1600.00  ¦  300.00  ¦  30
7521  ¦  WARD  ¦  SALESMAN  ¦  7698  ¦  1981-02-22  ¦  1250.00  ¦  500.00  ¦  30
7566  ¦  JONES  ¦  MANAGER  ¦  7839  ¦  1981-04-02  ¦  2975.00  ¦  null  ¦  20
7654  ¦  MARTIN  ¦  SALESMAN  ¦  7698  ¦  1981-09-28  ¦  1250.00  ¦  1400.00  ¦  30
7698  ¦  BLAKE  ¦  MANAGER  ¦  7839  ¦  1981-05-01  ¦  2850.00  ¦  null  ¦  30
7782  ¦  CLARK  ¦  MANAGER  ¦  7839  ¦  1981-06-09  ¦  2450.00  ¦  null  ¦  10
7788  ¦  SCOTT  ¦  ANALYST  ¦  7566  ¦  0087-07-13  ¦  3000.00  ¦  null  ¦  20
7839  ¦  KING  ¦  PRESIDENT  ¦  null  ¦  1981-11-17  ¦  5000.00  ¦  null  ¦  10
7844  ¦  TURNER  ¦  SALESMAN  ¦  7698  ¦  1981-09-08  ¦  1500.00  ¦  0.00  ¦  30
7876  ¦  ADAMS  ¦  CLERK  ¦  7788  ¦  0087-07-13  ¦  1100.00  ¦  null  ¦  20
7900  ¦  JAMES  ¦  CLERK  ¦  7698  ¦  1981-12-03  ¦  950.00  ¦  null  ¦  30
7902  ¦  FORD  ¦  ANALYST  ¦  7566  ¦  1981-12-03  ¦  3000.00  ¦  null  ¦  20
7934  ¦  MILLER  ¦  CLERK  ¦  7782  ¦  1982-01-23  ¦  1300.00  ¦  null  ¦  10

#SQL[@293,N48]Result[]
alter table emp change deptno deptId varchar(25);

#SQL[@294,N8]Result[71, 80, 59, 57, 62, 58, 58, 59, 63]
desc emp;
Field  ¦  Type  ¦  Null  ¦  Key  ¦  Default  ¦  Extra  ¦  Comment
empno  ¦  INT UNSIGNED(32)  ¦  NO  ¦  PRI  ¦  null  ¦  auto_increment  ¦  
ename  ¦  VARCHAR(15)  ¦  YES  ¦    ¦  null  ¦    ¦  
job  ¦  VARCHAR(10)  ¦  YES  ¦    ¦  null  ¦    ¦  
mgr  ¦  INT UNSIGNED(32)  ¦  YES  ¦    ¦  null  ¦    ¦  
hiredate  ¦  DATE(0)  ¦  YES  ¦    ¦  null  ¦    ¦  
sal  ¦  DECIMAL(7,2)  ¦  YES  ¦    ¦  null  ¦    ¦  
comm  ¦  DECIMAL(7,2)  ¦  YES  ¦    ¦  null  ¦    ¦  
deptId  ¦  VARCHAR(25)  ¦  YES  ¦  MUL  ¦  null  ¦    ¦  

#SQL[@295,N17]Result[79, 82, 88, 87, 85, 90, 85, 85, 85, 86, 87, 83, 82, 84, 84]
select * from emp;
empno  ¦  ename  ¦  job  ¦  mgr  ¦  hiredate  ¦  sal  ¦  comm  ¦  deptid
7369  ¦  SMITH  ¦  CLERK  ¦  7902  ¦  1980-12-17  ¦  800.00  ¦  null  ¦  20
7499  ¦  ALLEN  ¦  SALESMAN  ¦  7698  ¦  1981-02-20  ¦  1600.00  ¦  300.00  ¦  30
7521  ¦  WARD  ¦  SALESMAN  ¦  7698  ¦  1981-02-22  ¦  1250.00  ¦  500.00  ¦  30
7566  ¦  JONES  ¦  MANAGER  ¦  7839  ¦  1981-04-02  ¦  2975.00  ¦  null  ¦  20
7654  ¦  MARTIN  ¦  SALESMAN  ¦  7698  ¦  1981-09-28  ¦  1250.00  ¦  1400.00  ¦  30
7698  ¦  BLAKE  ¦  MANAGER  ¦  7839  ¦  1981-05-01  ¦  2850.00  ¦  null  ¦  30
7782  ¦  CLARK  ¦  MANAGER  ¦  7839  ¦  1981-06-09  ¦  2450.00  ¦  null  ¦  10
7788  ¦  SCOTT  ¦  ANALYST  ¦  7566  ¦  0087-07-13  ¦  3000.00  ¦  null  ¦  20
7839  ¦  KING  ¦  PRESIDENT  ¦  null  ¦  1981-11-17  ¦  5000.00  ¦  null  ¦  10
7844  ¦  TURNER  ¦  SALESMAN  ¦  7698  ¦  1981-09-08  ¦  1500.00  ¦  0.00  ¦  30
7876  ¦  ADAMS  ¦  CLERK  ¦  7788  ¦  0087-07-13  ¦  1100.00  ¦  null  ¦  20
7900  ¦  JAMES  ¦  CLERK  ¦  7698  ¦  1981-12-03  ¦  950.00  ¦  null  ¦  30
7902  ¦  FORD  ¦  ANALYST  ¦  7566  ¦  1981-12-03  ¦  3000.00  ¦  null  ¦  20
7934  ¦  MILLER  ¦  CLERK  ¦  7782  ¦  1982-01-23  ¦  1300.00  ¦  null  ¦  10

#SQL[@297,N23]Result[]
drop table if exists t1;

#SQL[@298,N92]Result[]
CREATE TABLE t1(a INTEGER PRIMARY KEY, b CHAR(10), c date, d decimal(7,2), UNIQUE KEY(a, b));

#SQL[@299,N7]Result[71, 53, 52, 51, 56]
desc t1;
Field  ¦  Type  ¦  Null  ¦  Key  ¦  Default  ¦  Extra  ¦  Comment
a  ¦  INT(32)  ¦  NO  ¦  PRI  ¦  null  ¦    ¦  
b  ¦  CHAR(10)  ¦  YES  ¦    ¦  null  ¦    ¦  
c  ¦  DATE(0)  ¦  YES  ¦    ¦  null  ¦    ¦  
d  ¦  DECIMAL(7,2)  ¦  YES  ¦    ¦  null  ¦    ¦  

#SQL[@301,N49]Result[]
insert into t1 values(1, 'ab', '1980-12-17', 800);

#SQL[@302,N50]Result[]
insert into t1 values(2, 'ac', '1981-02-20', 1600);

#SQL[@303,N49]Result[]
insert into t1 values(3, 'ad', '1981-02-22', 500);

#SQL[@304,N16]Result[22, 37, 38, 37]
select * from t1;
a  ¦  b  ¦  c  ¦  d
1  ¦  ab  ¦  1980-12-17  ¦  800.00
2  ¦  ac  ¦  1981-02-20  ¦  1600.00
3  ¦  ad  ¦  1981-02-22  ¦  500.00

#SQL[@306,N45]Result[]
alter table t1 alter column a set default 100;

#SQL[@307,N18]Result[233, 110, 113, 116]
show index from t1;
Table  ¦  Non_unique  ¦  Key_name  ¦  Seq_in_index  ¦  Column_name  ¦  Collation  ¦  Cardinality  ¦  Sub_part  ¦  Packed  ¦  Null  ¦  Index_type  ¦  Comment  ¦  Index_comment  ¦  Index_params  ¦  Visible  ¦  Expression
t1  ¦  0  ¦  a  ¦  1  ¦  a  ¦  A  ¦  0  ¦  NULL  ¦  NULL  ¦    ¦    ¦    ¦    ¦    ¦  YES  ¦  a
t1  ¦  0  ¦  a  ¦  2  ¦  b  ¦  A  ¦  0  ¦  NULL  ¦  NULL  ¦  YES  ¦    ¦    ¦    ¦    ¦  YES  ¦  b
t1  ¦  0  ¦  PRIMARY  ¦  1  ¦  a  ¦  A  ¦  0  ¦  NULL  ¦  NULL  ¦    ¦    ¦    ¦    ¦    ¦  YES  ¦  a

#SQL[@308,N7]Result[71, 52, 52, 51, 56]
desc t1;
Field  ¦  Type  ¦  Null  ¦  Key  ¦  Default  ¦  Extra  ¦  Comment
a  ¦  INT(32)  ¦  NO  ¦  PRI  ¦  100  ¦    ¦  
b  ¦  CHAR(10)  ¦  YES  ¦    ¦  null  ¦    ¦  
c  ¦  DATE(0)  ¦  YES  ¦    ¦  null  ¦    ¦  
d  ¦  DECIMAL(7,2)  ¦  YES  ¦    ¦  null  ¦    ¦  

#SQL[@309,N16]Result[22, 37, 38, 37]
select * from t1;
a  ¦  b  ¦  c  ¦  d
1  ¦  ab  ¦  1980-12-17  ¦  800.00
2  ¦  ac  ¦  1981-02-20  ¦  1600.00
3  ¦  ad  ¦  1981-02-22  ¦  500.00

#SQL[@311,N42]Result[]
alter table t1 alter column a drop default;

#SQL[@312,N18]Result[233, 110, 113, 116]
show index from t1;
Table  ¦  Non_unique  ¦  Key_name  ¦  Seq_in_index  ¦  Column_name  ¦  Collation  ¦  Cardinality  ¦  Sub_part  ¦  Packed  ¦  Null  ¦  Index_type  ¦  Comment  ¦  Index_comment  ¦  Index_params  ¦  Visible  ¦  Expression
t1  ¦  0  ¦  a  ¦  1  ¦  a  ¦  A  ¦  0  ¦  NULL  ¦  NULL  ¦    ¦    ¦    ¦    ¦    ¦  YES  ¦  a
t1  ¦  0  ¦  a  ¦  2  ¦  b  ¦  A  ¦  0  ¦  NULL  ¦  NULL  ¦  YES  ¦    ¦    ¦    ¦    ¦  YES  ¦  b
t1  ¦  0  ¦  PRIMARY  ¦  1  ¦  a  ¦  A  ¦  0  ¦  NULL  ¦  NULL  ¦    ¦    ¦    ¦    ¦    ¦  YES  ¦  a

#SQL[@313,N7]Result[71, 53, 52, 51, 56]
desc t1;
Field  ¦  Type  ¦  Null  ¦  Key  ¦  Default  ¦  Extra  ¦  Comment
a  ¦  INT(32)  ¦  NO  ¦  PRI  ¦  null  ¦    ¦  
b  ¦  CHAR(10)  ¦  YES  ¦    ¦  null  ¦    ¦  
c  ¦  DATE(0)  ¦  YES  ¦    ¦  null  ¦    ¦  
d  ¦  DECIMAL(7,2)  ¦  YES  ¦    ¦  null  ¦    ¦  

#SQL[@314,N16]Result[22, 37, 38, 37]
select * from t1;
a  ¦  b  ¦  c  ¦  d
1  ¦  ab  ¦  1980-12-17  ¦  800.00
2  ¦  ac  ¦  1981-02-20  ¦  1600.00
3  ¦  ad  ¦  1981-02-22  ¦  500.00

#SQL[@316,N41]Result[]
alter table t1 alter column b set visible;

#SQL[@317,N18]Result[233, 110, 113, 116]
show index from t1;
Table  ¦  Non_unique  ¦  Key_name  ¦  Seq_in_index  ¦  Column_name  ¦  Collation  ¦  Cardinality  ¦  Sub_part  ¦  Packed  ¦  Null  ¦  Index_type  ¦  Comment  ¦  Index_comment  ¦  Index_params  ¦  Visible  ¦  Expression
t1  ¦  0  ¦  a  ¦  1  ¦  a  ¦  A  ¦  0  ¦  NULL  ¦  NULL  ¦    ¦    ¦    ¦    ¦    ¦  YES  ¦  a
t1  ¦  0  ¦  a  ¦  2  ¦  b  ¦  A  ¦  0  ¦  NULL  ¦  NULL  ¦  YES  ¦    ¦    ¦    ¦    ¦  YES  ¦  b
t1  ¦  0  ¦  PRIMARY  ¦  1  ¦  a  ¦  A  ¦  0  ¦  NULL  ¦  NULL  ¦    ¦    ¦    ¦    ¦    ¦  YES  ¦  a

#SQL[@318,N7]Result[71, 53, 52, 51, 56]
desc t1;
Field  ¦  Type  ¦  Null  ¦  Key  ¦  Default  ¦  Extra  ¦  Comment
a  ¦  INT(32)  ¦  NO  ¦  PRI  ¦  null  ¦    ¦  
b  ¦  CHAR(10)  ¦  YES  ¦    ¦  null  ¦    ¦  
c  ¦  DATE(0)  ¦  YES  ¦    ¦  null  ¦    ¦  
d  ¦  DECIMAL(7,2)  ¦  YES  ¦    ¦  null  ¦    ¦  

#SQL[@319,N16]Result[22, 37, 38, 37]
select * from t1;
a  ¦  b  ¦  c  ¦  d
1  ¦  ab  ¦  1980-12-17  ¦  800.00
2  ¦  ac  ¦  1981-02-20  ¦  1600.00
3  ¦  ad  ¦  1981-02-22  ¦  500.00

#SQL[@321,N23]Result[]
drop table if exists t1;

#SQL[@322,N113]Result[]
CREATE TABLE t1(a INTEGER PRIMARY KEY, b CHAR(10), c date default '1990-12-17', d decimal(7,2), UNIQUE KEY(a, b));

#SQL[@323,N7]Result[71, 53, 52, 57, 56]
desc t1;
Field  ¦  Type  ¦  Null  ¦  Key  ¦  Default  ¦  Extra  ¦  Comment
a  ¦  INT(32)  ¦  NO  ¦  PRI  ¦  null  ¦    ¦  
b  ¦  CHAR(10)  ¦  YES  ¦    ¦  null  ¦    ¦  
c  ¦  DATE(0)  ¦  YES  ¦    ¦  1990-12-17  ¦    ¦  
d  ¦  DECIMAL(7,2)  ¦  YES  ¦    ¦  null  ¦    ¦  

#SQL[@325,N49]Result[]
insert into t1 values(1, 'ab', '1980-12-17', 800);

#SQL[@326,N50]Result[]
insert into t1 values(2, 'ac', '1981-02-20', 1600);

#SQL[@327,N49]Result[]
insert into t1 values(3, 'ad', '1981-02-22', 500);

#SQL[@328,N16]Result[22, 37, 38, 37]
select * from t1;
a  ¦  b  ¦  c  ¦  d
1  ¦  ab  ¦  1980-12-17  ¦  800.00
2  ¦  ac  ¦  1981-02-20  ¦  1600.00
3  ¦  ad  ¦  1981-02-22  ¦  500.00

#SQL[@330,N54]Result[]
alter table t1 alter column c set default '2003-12-17';

#SQL[@331,N18]Result[233, 110, 113, 116]
show index from t1;
Table  ¦  Non_unique  ¦  Key_name  ¦  Seq_in_index  ¦  Column_name  ¦  Collation  ¦  Cardinality  ¦  Sub_part  ¦  Packed  ¦  Null  ¦  Index_type  ¦  Comment  ¦  Index_comment  ¦  Index_params  ¦  Visible  ¦  Expression
t1  ¦  0  ¦  a  ¦  1  ¦  a  ¦  A  ¦  0  ¦  NULL  ¦  NULL  ¦    ¦    ¦    ¦    ¦    ¦  YES  ¦  a
t1  ¦  0  ¦  a  ¦  2  ¦  b  ¦  A  ¦  0  ¦  NULL  ¦  NULL  ¦  YES  ¦    ¦    ¦    ¦    ¦  YES  ¦  b
t1  ¦  0  ¦  PRIMARY  ¦  1  ¦  a  ¦  A  ¦  0  ¦  NULL  ¦  NULL  ¦    ¦    ¦    ¦    ¦    ¦  YES  ¦  a

#SQL[@332,N7]Result[71, 53, 52, 57, 56]
desc t1;
Field  ¦  Type  ¦  Null  ¦  Key  ¦  Default  ¦  Extra  ¦  Comment
a  ¦  INT(32)  ¦  NO  ¦  PRI  ¦  null  ¦    ¦  
b  ¦  CHAR(10)  ¦  YES  ¦    ¦  null  ¦    ¦  
c  ¦  DATE(0)  ¦  YES  ¦    ¦  2003-12-17  ¦    ¦  
d  ¦  DECIMAL(7,2)  ¦  YES  ¦    ¦  null  ¦    ¦  

#SQL[@333,N16]Result[22, 37, 38, 37]
select * from t1;
a  ¦  b  ¦  c  ¦  d
1  ¦  ab  ¦  1980-12-17  ¦  800.00
2  ¦  ac  ¦  1981-02-20  ¦  1600.00
3  ¦  ad  ¦  1981-02-22  ¦  500.00

#SQL[@335,N42]Result[]
alter table t1 alter column c drop default;

#SQL[@336,N18]Result[233, 110, 113, 116]
show index from t1;
Table  ¦  Non_unique  ¦  Key_name  ¦  Seq_in_index  ¦  Column_name  ¦  Collation  ¦  Cardinality  ¦  Sub_part  ¦  Packed  ¦  Null  ¦  Index_type  ¦  Comment  ¦  Index_comment  ¦  Index_params  ¦  Visible  ¦  Expression
t1  ¦  0  ¦  a  ¦  1  ¦  a  ¦  A  ¦  0  ¦  NULL  ¦  NULL  ¦    ¦    ¦    ¦    ¦    ¦  YES  ¦  a
t1  ¦  0  ¦  a  ¦  2  ¦  b  ¦  A  ¦  0  ¦  NULL  ¦  NULL  ¦  YES  ¦    ¦    ¦    ¦    ¦  YES  ¦  b
t1  ¦  0  ¦  PRIMARY  ¦  1  ¦  a  ¦  A  ¦  0  ¦  NULL  ¦  NULL  ¦    ¦    ¦    ¦    ¦    ¦  YES  ¦  a

#SQL[@337,N7]Result[71, 53, 52, 51, 56]
desc t1;
Field  ¦  Type  ¦  Null  ¦  Key  ¦  Default  ¦  Extra  ¦  Comment
a  ¦  INT(32)  ¦  NO  ¦  PRI  ¦  null  ¦    ¦  
b  ¦  CHAR(10)  ¦  YES  ¦    ¦  null  ¦    ¦  
c  ¦  DATE(0)  ¦  YES  ¦    ¦  null  ¦    ¦  
d  ¦  DECIMAL(7,2)  ¦  YES  ¦    ¦  null  ¦    ¦  

#SQL[@338,N16]Result[22, 37, 38, 37]
select * from t1;
a  ¦  b  ¦  c  ¦  d
1  ¦  ab  ¦  1980-12-17  ¦  800.00
2  ¦  ac  ¦  1981-02-20  ¦  1600.00
3  ¦  ad  ¦  1981-02-22  ¦  500.00

#SQL[@340,N43]Result[]
alter table t1 alter column b set invisible;

#SQL[@341,N18]Result[233, 110, 113, 116]
show index from t1;
Table  ¦  Non_unique  ¦  Key_name  ¦  Seq_in_index  ¦  Column_name  ¦  Collation  ¦  Cardinality  ¦  Sub_part  ¦  Packed  ¦  Null  ¦  Index_type  ¦  Comment  ¦  Index_comment  ¦  Index_params  ¦  Visible  ¦  Expression
t1  ¦  0  ¦  a  ¦  1  ¦  a  ¦  A  ¦  0  ¦  NULL  ¦  NULL  ¦    ¦    ¦    ¦    ¦    ¦  YES  ¦  a
t1  ¦  0  ¦  a  ¦  2  ¦  b  ¦  A  ¦  0  ¦  NULL  ¦  NULL  ¦  YES  ¦    ¦    ¦    ¦    ¦  YES  ¦  b
t1  ¦  0  ¦  PRIMARY  ¦  1  ¦  a  ¦  A  ¦  0  ¦  NULL  ¦  NULL  ¦    ¦    ¦    ¦    ¦    ¦  YES  ¦  a

#SQL[@342,N7]Result[71, 53, 52, 51, 56]
desc t1;
Field  ¦  Type  ¦  Null  ¦  Key  ¦  Default  ¦  Extra  ¦  Comment
a  ¦  INT(32)  ¦  NO  ¦  PRI  ¦  null  ¦    ¦  
b  ¦  CHAR(10)  ¦  YES  ¦    ¦  null  ¦    ¦  
c  ¦  DATE(0)  ¦  YES  ¦    ¦  null  ¦    ¦  
d  ¦  DECIMAL(7,2)  ¦  YES  ¦    ¦  null  ¦    ¦  

#SQL[@343,N16]Result[22, 37, 38, 37]
select * from t1;
a  ¦  b  ¦  c  ¦  d
1  ¦  ab  ¦  1980-12-17  ¦  800.00
2  ¦  ac  ¦  1981-02-20  ¦  1600.00
3  ¦  ad  ¦  1981-02-22  ¦  500.00

#SQL[@345,N23]Result[]
drop table if exists t1;

#SQL[@346,N92]Result[]
CREATE TABLE t1(a INTEGER PRIMARY KEY, b CHAR(10), c date, d decimal(7,2), UNIQUE KEY(a, b));

#SQL[@347,N7]Result[71, 53, 52, 51, 56]
desc t1;
Field  ¦  Type  ¦  Null  ¦  Key  ¦  Default  ¦  Extra  ¦  Comment
a  ¦  INT(32)  ¦  NO  ¦  PRI  ¦  null  ¦    ¦  
b  ¦  CHAR(10)  ¦  YES  ¦    ¦  null  ¦    ¦  
c  ¦  DATE(0)  ¦  YES  ¦    ¦  null  ¦    ¦  
d  ¦  DECIMAL(7,2)  ¦  YES  ¦    ¦  null  ¦    ¦  

#SQL[@349,N49]Result[]
insert into t1 values(1, 'ab', '1980-12-17', 800);

#SQL[@350,N50]Result[]
insert into t1 values(2, 'ac', '1981-02-20', 1600);

#SQL[@351,N49]Result[]
insert into t1 values(3, 'ad', '1981-02-22', 500);

#SQL[@352,N16]Result[22, 37, 38, 37]
select * from t1;
a  ¦  b  ¦  c  ¦  d
1  ¦  ab  ¦  1980-12-17  ¦  800.00
2  ¦  ac  ¦  1981-02-20  ¦  1600.00
3  ¦  ad  ¦  1981-02-22  ¦  500.00

#SQL[@354,N37]Result[]
alter table t1 order by a DESC, b ASC;

#SQL[@355,N7]Result[71, 53, 52, 51, 56]
desc t1;
Field  ¦  Type  ¦  Null  ¦  Key  ¦  Default  ¦  Extra  ¦  Comment
a  ¦  INT(32)  ¦  NO  ¦  PRI  ¦  null  ¦    ¦  
b  ¦  CHAR(10)  ¦  YES  ¦    ¦  null  ¦    ¦  
c  ¦  DATE(0)  ¦  YES  ¦    ¦  null  ¦    ¦  
d  ¦  DECIMAL(7,2)  ¦  YES  ¦    ¦  null  ¦    ¦  

#SQL[@356,N16]Result[22, 37, 38, 37]
select * from t1;
a  ¦  b  ¦  c  ¦  d
1  ¦  ab  ¦  1980-12-17  ¦  800.00
2  ¦  ac  ¦  1981-02-20  ¦  1600.00
3  ¦  ad  ¦  1981-02-22  ¦  500.00

#SQL[@358,N33]Result[]
alter table t1 order by a DESC, c;

#SQL[@359,N7]Result[71, 53, 52, 51, 56]
desc t1;
Field  ¦  Type  ¦  Null  ¦  Key  ¦  Default  ¦  Extra  ¦  Comment
a  ¦  INT(32)  ¦  NO  ¦  PRI  ¦  null  ¦    ¦  
b  ¦  CHAR(10)  ¦  YES  ¦    ¦  null  ¦    ¦  
c  ¦  DATE(0)  ¦  YES  ¦    ¦  null  ¦    ¦  
d  ¦  DECIMAL(7,2)  ¦  YES  ¦    ¦  null  ¦    ¦  

#SQL[@360,N16]Result[22, 37, 38, 37]
select * from t1;
a  ¦  b  ¦  c  ¦  d
1  ¦  ab  ¦  1980-12-17  ¦  800.00
2  ¦  ac  ¦  1981-02-20  ¦  1600.00
3  ¦  ad  ¦  1981-02-22  ¦  500.00

#SQL[@362,N13]Result[]
drop table t1;

#SQL[@364,N23]Result[]
drop table if exists t1;

#SQL[@365,N52]Result[]
CREATE TABLE t1(col1 int not null, col2 varchar(10));

#SQL[@366,N35]Result[]
insert into t1 values (1, '137iu2');

#SQL[@367,N37]Result[]
insert into t1 values (1, '73ujf34f');

#SQL[@368,N16]Result[14, 13, 15]
select * from t1;
col1  ¦  col2
1  ¦  137iu2
1  ¦  73ujf34f

#SQL[@370,N47]Error[34]
alter table t1 change col1 col1 int primary key;
Duplicate entry '1' for key 'col1'

#SQL[@372,N7]Result[71, 53, 58]
desc t1;
Field  ¦  Type  ¦  Null  ¦  Key  ¦  Default  ¦  Extra  ¦  Comment
col1  ¦  INT(32)  ¦  NO  ¦    ¦  null  ¦    ¦  
col2  ¦  VARCHAR(10)  ¦  YES  ¦    ¦  null  ¦    ¦  

#SQL[@374,N55]Result[]
alter table t1 change col2 col2 varchar(10) primary key;

#SQL[@375,N7]Result[71, 53, 60]
desc t1;
Field  ¦  Type  ¦  Null  ¦  Key  ¦  Default  ¦  Extra  ¦  Comment
col1  ¦  INT(32)  ¦  NO  ¦    ¦  null  ¦    ¦  
col2  ¦  VARCHAR(10)  ¦  NO  ¦  PRI  ¦  null  ¦    ¦  

#SQL[@377,N35]Result[]
insert into t1 values (1, 'cdsdsa');

#SQL[@378,N16]Result[14, 13, 15, 13]
select * from t1;
col1  ¦  col2
1  ¦  137iu2
1  ¦  73ujf34f
1  ¦  cdsdsa

#SQL[@379,N13]Result[]
drop table t1;

#SQL[@387,N27]Result[]
drop table if exists name01;

#SQL[@388,N44]Result[]
create table name01 (col1 int, col2 decimal);

#SQL[@389,N37]Result[]
insert into name01 values (1, 378292);

#SQL[@390,N42]Result[]
insert into name01 values (2, 3289.111111);

#SQL[@391,N110]Result[]
alter table name01 change column col1 `数据库管理系统数据库操作系统数据库系统数据库` int;

#SQL[@392,N24]Result[23, 162]
show create table name01;
Table  ¦  Create Table
name01  ¦  CREATE TABLE `name01` (
  `数据库管理系统数据库操作系统数据库系统数据库` int DEFAULT NULL,
  `col2` decimal(38,0) DEFAULT NULL
)

#SQL[@393,N17]Result[]
drop table name01;

#SQL[@396,N27]Result[]
drop table if exists name02;

#SQL[@397,N44]Result[]
create table name02 (col1 int, col2 decimal);

#SQL[@398,N37]Result[]
insert into name02 values (1, 378292);

#SQL[@399,N42]Result[]
insert into name02 values (2, 3289.111111);

#SQL[@400,N64]Result[]
alter table name02 change column col1  `cwhueh   3u2j4kfker` int;

#SQL[@401,N24]Result[23, 115]
show create table name02;
Table  ¦  Create Table
name02  ¦  CREATE TABLE `name02` (
  `cwhueh   3u2j4kfker` int DEFAULT NULL,
  `col2` decimal(38,0) DEFAULT NULL
)

#SQL[@402,N17]Result[]
drop table name02;

#SQL[@405,N27]Result[]
drop table if exists name03;

#SQL[@406,N44]Result[]
create table name03 (col1 int, col2 decimal);

#SQL[@407,N37]Result[]
insert into name03 values (1, 378292);

#SQL[@408,N42]Result[]
insert into name03 values (2, 3289.111111);

#SQL[@409,N83]Result[]
alter table name03 change column col1 `RAVHJBWUIHNJCDW****&&*((()(*&^&^%^^&^*&` int;

#SQL[@410,N24]Result[23, 135]
show create table name03;
Table  ¦  Create Table
name03  ¦  CREATE TABLE `name03` (
  `RAVHJBWUIHNJCDW****&&*((()(*&^&^%^^&^*&` int DEFAULT NULL,
  `col2` decimal(38,0) DEFAULT NULL
)

#SQL[@411,N17]Result[]
drop table name03;

#SQL[@415,N27]Result[]
drop table if exists name04;

#SQL[@416,N48]Result[]
create table name04 (col1 int, col2 varchar(10));

#SQL[@417,N57]Result[]
alter table name04 change column col1 col1New varchar(10);

#SQL[@418,N24]Result[23, 109]
show create table name04;
Table  ¦  Create Table
name04  ¦  CREATE TABLE `name04` (
  `col1New` varchar(10) DEFAULT NULL,
  `col2` varchar(10) DEFAULT NULL
)

#SQL[@419,N54]Result[]
alter table name04 change column col2 col2New char(20);

#SQL[@420,N24]Result[23, 109]
show create table name04;
Table  ¦  Create Table
name04  ¦  CREATE TABLE `name04` (
  `col1New` varchar(10) DEFAULT NULL,
  `col2New` char(20) DEFAULT NULL
)

#SQL[@421,N17]Result[]
drop table name04;

#SQL[@425,N27]Result[]
drop table if exists name05;

#SQL[@426,N44]Result[]
create table name05 (col1 int, col2 decimal);

#SQL[@427,N39]Result[]
insert into name05 values (1, 37829734);

#SQL[@428,N42]Result[]
insert into name05 values (2, 3289.111111);

#SQL[@429,N20]Result[14, 15, 11]
select * from name05;
col1  ¦  col2
1  ¦  37829734
2  ¦  3289

#SQL[@430,N48]Result[]
alter table name05 change column col1 col1 float;

#SQL[@431,N24]Result[23, 102]
show create table name05;
Table  ¦  Create Table
name05  ¦  CREATE TABLE `name05` (
  `col1` float DEFAULT NULL,
  `col2` decimal(38,0) DEFAULT NULL
)

#SQL[@432,N36]Result[]
delete from name05 where col2 = 3289;

#SQL[@433,N20]Result[14, 15]
select * from name05;
col1  ¦  col2
1  ¦  37829734

#SQL[@434,N46]Result[]
alter table name05 change column col1 col1 int;

#SQL[@435,N24]Result[23, 100]
show create table name05;
Table  ¦  Create Table
name05  ¦  CREATE TABLE `name05` (
  `col1` int DEFAULT NULL,
  `col2` decimal(38,0) DEFAULT NULL
)

#SQL[@436,N17]Result[]
drop table name05;

#SQL[@440,N27]Result[]
drop table if exists bool01;

#SQL[@441,N41]Result[]
create table bool01 (col1 int, col2 char);

#SQL[@442,N34]Result[]
insert into bool01 values (1, 'q');

#SQL[@443,N34]Result[]
insert into bool01 values (2, 'a');

#SQL[@444,N35]Result[]
insert into bool01 values (10, '3');

#SQL[@445,N20]Result[14, 8, 8, 9]
select * from bool01;
col1  ¦  col2
1  ¦  q
2  ¦  a
10  ¦  3

#SQL[@446,N54]Error[49]
alter table bool01 change col2 col2New bool after col1;
invalid input: 'q' is not a valid bool expression

#SQL[@447,N24]Result[23, 94]
show create table bool01;
Table  ¦  Create Table
bool01  ¦  CREATE TABLE `bool01` (
  `col1` int DEFAULT NULL,
  `col2` char(1) DEFAULT NULL
)

#SQL[@448,N24]Result[71, 54, 54]
show columns from bool01;
Field  ¦  Type  ¦  Null  ¦  Key  ¦  Default  ¦  Extra  ¦  Comment
col1  ¦  INT(32)  ¦  YES  ¦    ¦  null  ¦    ¦  
col2  ¦  CHAR(1)  ¦  YES  ¦    ¦  null  ¦    ¦  

#SQL[@449,N148]Result[59, 34, 35]
select table_name,COLUMN_NAME, data_type,is_nullable from information_schema.columns where table_name like 'bool01' and COLUMN_NAME not like '__mo%';
table_name  ¦  COLUMN_NAME  ¦  data_type  ¦  is_nullable
bool01  ¦  col1  ¦  INT  ¦  YES
bool01  ¦  col2  ¦  CHAR  ¦  YES

#SQL[@450,N17]Result[]
drop table bool01;

#SQL[@454,N27]Result[]
drop table if exists char01;

#SQL[@455,N41]Result[]
create table char01 (col1 int, col2 char);

#SQL[@456,N34]Result[]
insert into char01 values (1, 'q');

#SQL[@457,N34]Result[]
insert into char01 values (2, '*');

#SQL[@458,N35]Result[]
insert into char01 values (10, '3');

#SQL[@459,N37]Result[]
insert into char01 values (20, '数');

#SQL[@460,N20]Result[14, 8, 8, 9, 11]
select * from char01;
col1  ¦  col2
1  ¦  q
2  ¦  *
10  ¦  3
20  ¦  数

#SQL[@461,N61]Result[]
alter table char01 change col2 col2New varchar(20) after col1;

#SQL[@462,N24]Result[23, 101]
show create table char01;
Table  ¦  Create Table
char01  ¦  CREATE TABLE `char01` (
  `col1` int DEFAULT NULL,
  `col2New` varchar(20) DEFAULT NULL
)

#SQL[@463,N47]Result[]
insert into char01 values (100, '**(*(&(*UJHI');

#SQL[@464,N21]Result[]
truncate table char01;

#SQL[@465,N20]Result[]
select * from char01;

#SQL[@466,N24]Result[71, 54, 61]
show columns from char01;
Field  ¦  Type  ¦  Null  ¦  Key  ¦  Default  ¦  Extra  ¦  Comment
col1  ¦  INT(32)  ¦  YES  ¦    ¦  null  ¦    ¦  
col2New  ¦  VARCHAR(20)  ¦  YES  ¦    ¦  null  ¦    ¦  

#SQL[@467,N148]Result[59, 34, 41]
select table_name,COLUMN_NAME, data_type,is_nullable from information_schema.columns where table_name like 'char01' and COLUMN_NAME not like '__mo%';
table_name  ¦  COLUMN_NAME  ¦  data_type  ¦  is_nullable
char01  ¦  col1  ¦  INT  ¦  YES
char01  ¦  col2New  ¦  VARCHAR  ¦  YES

#SQL[@468,N17]Result[]
drop table char01;

#SQL[@472,N27]Result[]
drop table if exists char02;

#SQL[@473,N48]Result[]
create table char02 (col1 int, col2 varchar(10));

#SQL[@474,N42]Result[]
insert into char02 values (1, 'w43234rfq');

#SQL[@475,N38]Result[]
insert into char02 values (2, 'a32f4');

#SQL[@476,N44]Result[]
insert into char02 values (10, '3432t43r4f');

#SQL[@477,N20]Result[14, 16, 12, 18]
select * from char02;
col1  ¦  col2
1  ¦  w43234rfq
2  ¦  a32f4
10  ¦  3432t43r4f

#SQL[@478,N53]Result[]
alter table char02 change col2 col2New char(20) first;

#SQL[@479,N24]Result[23, 98]
show create table char02;
Table  ¦  Create Table
char02  ¦  CREATE TABLE `char02` (
  `col2New` char(20) DEFAULT NULL,
  `col1` int DEFAULT NULL
)

#SQL[@480,N48]Result[]
insert into char02 values ('738fewhu&^YUH', 100);

#SQL[@481,N20]Result[17, 16, 12, 18, 22]
select * from char02;
col2new  ¦  col1
w43234rfq  ¦  1
a32f4  ¦  2
3432t43r4f  ¦  10
738fewhu&^YUH  ¦  100

#SQL[@482,N56]Result[]
update char02 set col1 = 100 where col2New = 'w43234rfq';

#SQL[@483,N20]Result[17, 12, 18, 22, 18]
select * from char02;
col2new  ¦  col1
a32f4  ¦  2
3432t43r4f  ¦  10
738fewhu&^YUH  ¦  100
w43234rfq  ¦  100

#SQL[@484,N42]Result[]
delete from char02 where col2New = 'a32f4';

#SQL[@485,N20]Result[17, 18, 22, 18]
select * from char02;
col2new  ¦  col1
3432t43r4f  ¦  10
738fewhu&^YUH  ¦  100
w43234rfq  ¦  100

#SQL[@486,N24]Result[71, 58, 54]
show columns from char02;
Field  ¦  Type  ¦  Null  ¦  Key  ¦  Default  ¦  Extra  ¦  Comment
col2New  ¦  CHAR(20)  ¦  YES  ¦    ¦  null  ¦    ¦  
col1  ¦  INT(32)  ¦  YES  ¦    ¦  null  ¦    ¦  

#SQL[@487,N148]Result[59, 34, 38]
select table_name,COLUMN_NAME, data_type,is_nullable from information_schema.columns where table_name like 'char02' and COLUMN_NAME not like '__mo%';
table_name  ¦  COLUMN_NAME  ¦  data_type  ¦  is_nullable
char02  ¦  col1  ¦  INT  ¦  YES
char02  ¦  col2New  ¦  CHAR  ¦  YES

#SQL[@488,N17]Result[]
drop table char02;

#SQL[@492,N27]Result[]
drop table if exists char03;

#SQL[@493,N45]Result[]
create table char03 (col1 int, col2 char(10));

#SQL[@494,N43]Result[]
insert into char03 values (1, 'ahu323ew32');

#SQL[@495,N43]Result[]
insert into char03 values (2, '367283r343');

#SQL[@496,N35]Result[]
insert into char03 values (3, null);

#SQL[@497,N20]Result[14, 17, 17, 11]
select * from char03;
col1  ¦  col2
1  ¦  ahu323ew32
2  ¦  367283r343
3  ¦  null

#SQL[@498,N49]Error[153]
alter table char03 change col2 col2New varchar(5);
internal error: Can't cast column from CHAR type to VARCHAR type because of one or more values in that column. Src length 10 is larger than Dest length 5

#SQL[@499,N24]Result[23, 95]
show create table char03;
Table  ¦  Create Table
char03  ¦  CREATE TABLE `char03` (
  `col1` int DEFAULT NULL,
  `col2` char(10) DEFAULT NULL
)

#SQL[@500,N24]Result[71, 54, 55]
show columns from char03;
Field  ¦  Type  ¦  Null  ¦  Key  ¦  Default  ¦  Extra  ¦  Comment
col1  ¦  INT(32)  ¦  YES  ¦    ¦  null  ¦    ¦  
col2  ¦  CHAR(10)  ¦  YES  ¦    ¦  null  ¦    ¦  

#SQL[@501,N148]Result[59, 34, 35]
select table_name,COLUMN_NAME, data_type,is_nullable from information_schema.columns where table_name like 'char03' and COLUMN_NAME not like '__mo%';
table_name  ¦  COLUMN_NAME  ¦  data_type  ¦  is_nullable
char03  ¦  col1  ¦  INT  ¦  YES
char03  ¦  col2  ¦  CHAR  ¦  YES

#SQL[@502,N17]Result[]
drop table char03;

#SQL[@506,N27]Result[]
drop table if exists char04;

#SQL[@507,N54]Result[]
create table char04 (col1 varchar(200), col2 char(10));

#SQL[@508,N46]Result[]
insert into char04 values (null, 'ahu323ew32');

#SQL[@509,N109]Result[]
insert into char04 values ('23789178942u1uj3ridjfh2d28u49u4ueji32jf2f32ef32894rjk32nv432f432f', '367283r343');

#SQL[@510,N76]Result[]
insert into char04 values ('32jhbfchjecmwd%^&^(*&)UJHFRE%^T&YUHIJKNM', null);

#SQL[@511,N20]Result[14, 20, 81, 50]
select * from char04;
col1  ¦  col2
null  ¦  ahu323ew32
23789178942u1uj3ridjfh2d28u49u4ueji32jf2f32ef32894rjk32nv432f432f  ¦  367283r343
32jhbfchjecmwd%^&^(*&)UJHFRE%^T&YUHIJKNM  ¦  null

#SQL[@512,N60]Error[53]
alter table char04 change col1 col1New varchar(100) not null;
constraint violation: Column 'col1New' cannot be null

#SQL[@513,N56]Error[53]
alter table char04 change col2 col2New char(10) not null;
constraint violation: Column 'col2New' cannot be null

#SQL[@514,N24]Result[23, 104]
show create table char04;
Table  ¦  Create Table
char04  ¦  CREATE TABLE `char04` (
  `col1` varchar(200) DEFAULT NULL,
  `col2` char(10) DEFAULT NULL
)

#SQL[@515,N43]Result[]
insert into char04 values (4, 'eyuiwqewq3');

#SQL[@516,N20]Result[14, 20, 81, 50, 17]
select * from char04;
col1  ¦  col2
null  ¦  ahu323ew32
23789178942u1uj3ridjfh2d28u49u4ueji32jf2f32ef32894rjk32nv432f432f  ¦  367283r343
32jhbfchjecmwd%^&^(*&)UJHFRE%^T&YUHIJKNM  ¦  null
4  ¦  eyuiwqewq3

#SQL[@517,N24]Result[71, 59, 55]
show columns from char04;
Field  ¦  Type  ¦  Null  ¦  Key  ¦  Default  ¦  Extra  ¦  Comment
col1  ¦  VARCHAR(200)  ¦  YES  ¦    ¦  null  ¦    ¦  
col2  ¦  CHAR(10)  ¦  YES  ¦    ¦  null  ¦    ¦  

#SQL[@518,N148]Result[59, 38, 35]
select table_name,COLUMN_NAME, data_type,is_nullable from information_schema.columns where table_name like 'char04' and COLUMN_NAME not like '__mo%';
table_name  ¦  COLUMN_NAME  ¦  data_type  ¦  is_nullable
char04  ¦  col1  ¦  VARCHAR  ¦  YES
char04  ¦  col2  ¦  CHAR  ¦  YES

#SQL[@519,N17]Result[]
drop table char04;

#SQL[@522,N27]Result[]
drop table if exists text01;

#SQL[@523,N89]Error[217]
create table text01 (col1 text primary key , col2 mediumtext unique index, col3 longtext);
SQL parser error: You have an error in your SQL syntax; check the manual that corresponds to your MatrixOne server version for the right syntax to use. syntax error at line 1 column 73 near \" index, col3 longtext)\";

#SQL[@524,N97]Error[24]
insert into text01 values ('37268434','32718hcuwh432fr234f34g4f34e4','&*&YHRE%^&*YUIHGT^&Y*UIJK');
no such table db2.text01

#SQL[@525,N83]Error[24]
insert into text01 values ('jefwyq3uih2r321fr3', '38eu4jfc3w4e3dcewcevewcve', null);
no such table db2.text01

#SQL[@526,N76]Error[24]
insert into text01 values (null, '2789378u2uifj4234r23', '32r43frecdrfedwq');
no such table db2.text01

#SQL[@527,N43]Error[24]
alter table text01 change col1 col1New text;
no such table db2.text01

#SQL[@528,N20]Error[49]
select * from text01;
SQL parser error: table \"text01\" does not exist

#SQL[@529,N24]Error[24]
show columns from text01;
no such table db2.text01

#SQL[@530,N148]Result[]
select table_name,COLUMN_NAME, data_type,is_nullable from information_schema.columns where table_name like 'text01' and COLUMN_NAME not like '__mo%';

#SQL[@531,N17]Error[24]
drop table text01;
no such table db2.text01

#SQL[@535,N28]Result[]
drop table if exists alter03;

#SQL[@536,N58]Result[]
create table alter03 (col1 int, col2 binary, col3 decimal);

#SQL[@537,N51]Result[]
insert into alter03 values (1, 'e', 324214.2134123);

#SQL[@538,N52]Result[]
insert into alter03 values (2, '4', -242134.3231432);

#SQL[@539,N21]Result[24, 20, 21]
select * from alter03;
col1  ¦  col2  ¦  col3
1  ¦  e  ¦  324214
2  ¦  4  ¦  -242134

#SQL[@540,N93]Result[]
alter table alter03 change col1 col1New decimal after col3, change col2 col2New varbinary(20);

#SQL[@541,N25]Result[23, 155]
show create table alter03;
Table  ¦  Create Table
alter03  ¦  CREATE TABLE `alter03` (
  `col2New` varbinary(20) DEFAULT NULL,
  `col3` decimal(38,0) DEFAULT NULL,
  `col1New` decimal(38,0) DEFAULT NULL
)

#SQL[@542,N68]Result[]
insert into alter03 values ('32143124', 42432321.000, 132432.214234);

#SQL[@543,N21]Result[30, 20, 21, 34]
select * from alter03;
col2new  ¦  col3  ¦  col1new
e  ¦  324214  ¦  1
4  ¦  -242134  ¦  2
32143124  ¦  42432321  ¦  132432

#SQL[@544,N25]Result[71, 63, 60, 63]
show columns from alter03;
Field  ¦  Type  ¦  Null  ¦  Key  ¦  Default  ¦  Extra  ¦  Comment
col2New  ¦  VARBINARY(20)  ¦  YES  ¦    ¦  null  ¦    ¦  
col3  ¦  DECIMAL(38,0)  ¦  YES  ¦    ¦  null  ¦    ¦  
col1New  ¦  DECIMAL(38,0)  ¦  YES  ¦    ¦  null  ¦    ¦  

#SQL[@545,N149]Result[59, 42, 44, 39]
select table_name,COLUMN_NAME, data_type,is_nullable from information_schema.columns where table_name like 'alter03' and COLUMN_NAME not like '__mo%';
table_name  ¦  COLUMN_NAME  ¦  data_type  ¦  is_nullable
alter03  ¦  col1New  ¦  DECIMAL  ¦  YES
alter03  ¦  col2New  ¦  VARBINARY  ¦  YES
alter03  ¦  col3  ¦  DECIMAL  ¦  YES

#SQL[@546,N18]Result[]
drop table alter03;

#SQL[@550,N28]Result[]
drop table if exists alter04;

#SQL[@551,N65]Result[]
create table alter04 (col1 int not null default 100 primary key );

#SQL[@552,N29]Result[]
insert into alter04 values ();

#SQL[@553,N32]Result[]
insert into alter04 values (101);

#SQL[@554,N58]Result[]
alter table alter04 change col1 col1New int auto_increment;

#SQL[@555,N25]Result[23, 106]
show create table alter04;
Table  ¦  Create Table
alter04  ¦  CREATE TABLE `alter04` (
  `col1New` int NOT NULL AUTO_INCREMENT,
  PRIMARY KEY (`col1New`)
)

#SQL[@556,N29]Result[]
insert into alter04 values ();

#SQL[@557,N29]Result[]
insert into alter04 values ();

#SQL[@558,N21]Result[7, 3, 3, 3, 3]
select * from alter04;
col1new
100
101
102
103

#SQL[@559,N149]Result[59, 37]
select table_name,COLUMN_NAME, data_type,is_nullable from information_schema.columns where table_name like 'alter04' and COLUMN_NAME not like '__mo%';
table_name  ¦  COLUMN_NAME  ¦  data_type  ¦  is_nullable
alter04  ¦  col1New  ¦  INT  ¦  NO

#SQL[@560,N18]Result[]
drop table alter04;

#SQL[@564,N28]Result[]
drop table if exists alter05;

#SQL[@565,N58]Result[]
create table alter05 (col1 int primary key auto_increment);

#SQL[@566,N29]Result[]
insert into alter05 values ();

#SQL[@567,N29]Result[]
insert into alter05 values ();

#SQL[@568,N21]Result[4, 1, 1]
select * from alter05;
col1
1
2

#SQL[@569,N54]Result[]
alter table alter05 change col1 col1New int unique key;

#SQL[@570,N25]Result[23, 127]
show create table alter05;
Table  ¦  Create Table
alter05  ¦  CREATE TABLE `alter05` (
  `col1New` int NOT NULL,
  PRIMARY KEY (`col1New`),
  UNIQUE KEY `col1new` (`col1New`)
)

#SQL[@571,N25]Result[71, 59]
show columns from alter05;
Field  ¦  Type  ¦  Null  ¦  Key  ¦  Default  ¦  Extra  ¦  Comment
col1New  ¦  INT(32)  ¦  NO  ¦  PRI  ¦  null  ¦    ¦  

#SQL[@572,N21]Result[7, 1, 1]
select * from alter05;
col1new
1
2

#SQL[@573,N149]Result[59, 37]
select table_name,COLUMN_NAME, data_type,is_nullable from information_schema.columns where table_name like 'alter05' and COLUMN_NAME not like '__mo%';
table_name  ¦  COLUMN_NAME  ¦  data_type  ¦  is_nullable
alter05  ¦  col1New  ¦  INT  ¦  NO

#SQL[@574,N18]Result[]
drop table alter05;

#SQL[@578,N30]Result[]
drop table if exists primary01;

#SQL[@579,N44]Result[]
create table primary01 (col1 int, col2 text);

#SQL[@580,N74]Result[]
insert into primary01 values (1, 'wq432r43rf32y2493821ijfk2env3ui4y33i24');

#SQL[@581,N56]Result[]
insert into primary01 values (2, '243ewfvefreverewfcwr');

#SQL[@582,N59]Result[]
alter table primary01 change col1 col1New float primary key;

#SQL[@583,N27]Result[23, 125]
show create table primary01;
Table  ¦  Create Table
primary01  ¦  CREATE TABLE `primary01` (
  `col1New` float NOT NULL,
  `col2` text DEFAULT NULL,
  PRIMARY KEY (`col1New`)
)

#SQL[@584,N59]Error[37]
insert into primary01 values (1, '432r2f234day89ujfw42342');
Duplicate entry '1' for key 'col1new'

#SQL[@586,N57]Result[]
insert into primary01 values (2378.32423, '234242))())_');

#SQL[@587,N23]Result[17, 45, 27, 27]
select * from primary01;
col1new  ¦  col2
1  ¦  wq432r43rf32y2493821ijfk2env3ui4y33i24
2  ¦  243ewfvefreverewfcwr
2378.3242  ¦  234242))())_

#SQL[@588,N27]Result[71, 60, 54]
show columns from primary01;
Field  ¦  Type  ¦  Null  ¦  Key  ¦  Default  ¦  Extra  ¦  Comment
col1New  ¦  FLOAT(0)  ¦  NO  ¦  PRI  ¦  null  ¦    ¦  
col2  ¦  TEXT(0)  ¦  YES  ¦    ¦  null  ¦    ¦  

#SQL[@589,N59]Error[41]
update primary01 set col2 = 'whuihedjwqncew' where col1 = 1;
invalid input: column col1 does not exist

#SQL[@590,N62]Result[]
update primary01 set col2 = 'whuihedjwqncew' where col1New = 1;

#SQL[@591,N23]Result[17, 27, 27, 21]
select * from primary01;
col1new  ¦  col2
2  ¦  243ewfvefreverewfcwr
2378.3242  ¦  234242))())_
1  ¦  whuihedjwqncew

#SQL[@592,N36]Error[41]
delete from primary01 where col1 = 1;
invalid input: column col1 does not exist

#SQL[@593,N39]Result[]
delete from primary01 where col1New = 1;

#SQL[@594,N23]Result[17, 27, 27]
select * from primary01;
col1new  ¦  col2
2  ¦  243ewfvefreverewfcwr
2378.3242  ¦  234242))())_

#SQL[@595,N151]Result[59, 41, 38]
select table_name,COLUMN_NAME, data_type,is_nullable from information_schema.columns where table_name like 'primary01' and COLUMN_NAME not like '__mo%';
table_name  ¦  COLUMN_NAME  ¦  data_type  ¦  is_nullable
primary01  ¦  col1New  ¦  FLOAT  ¦  NO
primary01  ¦  col2  ¦  TEXT  ¦  YES

#SQL[@596,N20]Result[]
drop table primary01;

#SQL[@600,N30]Result[]
drop table if exists primary02;

#SQL[@601,N49]Result[]
create table primary02(col1 int, col2 binary(10));

#SQL[@602,N41]Result[]
insert into primary02 values (1, '32143');

#SQL[@603,N38]Result[]
insert into primary02 values (2, '3e');

#SQL[@604,N23]Result[14, 17, 17]
select * from primary02;
col1  ¦  col2
1  ¦  32143     
2  ¦  3e        

#SQL[@605,N57]Result[]
alter table primary02 change col1 col1New int primary key;

#SQL[@606,N27]Result[23, 129]
show create table primary02;
Table  ¦  Create Table
primary02  ¦  CREATE TABLE `primary02` (
  `col1New` int NOT NULL,
  `col2` binary(10) DEFAULT NULL,
  PRIMARY KEY (`col1New`)
)

#SQL[@607,N27]Result[71, 59, 57]
show columns from primary02;
Field  ¦  Type  ¦  Null  ¦  Key  ¦  Default  ¦  Extra  ¦  Comment
col1New  ¦  INT(32)  ¦  NO  ¦  PRI  ¦  null  ¦    ¦  
col2  ¦  BINARY(10)  ¦  YES  ¦    ¦  null  ¦    ¦  

#SQL[@608,N56]Error[36]
insert into primary02 (col1, col2) VALUES (3, 'ehuwu32');
Unknown column 'col1' in 'primary02'

#SQL[@609,N36]Error[41]
delete from primary02 where col1 = 1;
invalid input: column col1 does not exist

#SQL[@610,N39]Result[]
delete from primary02 where col1New = 1;

#SQL[@611,N52]Result[]
update primary02 set col1New = 100 where col1New = 1;

#SQL[@612,N23]Result[17, 17]
select * from primary02;
col1new  ¦  col2
2  ¦  3e        

#SQL[@613,N151]Result[59, 39, 40]
select table_name,COLUMN_NAME, data_type,is_nullable from information_schema.columns where table_name like 'primary02' and COLUMN_NAME not like '__mo%';
table_name  ¦  COLUMN_NAME  ¦  data_type  ¦  is_nullable
primary02  ¦  col1New  ¦  INT  ¦  NO
primary02  ¦  col2  ¦  BINARY  ¦  YES

#SQL[@614,N20]Result[]
drop table primary02;

#SQL[@618,N30]Result[]
drop table if exists primary03;

#SQL[@619,N49]Result[]
create table primary03(col1 int, col2 binary(10));

#SQL[@620,N41]Result[]
insert into primary03 values (1, '32143');

#SQL[@621,N38]Result[]
insert into primary03 values (2, '3e');

#SQL[@622,N57]Result[]
alter table primary03 change col1 col1New int primary key;

#SQL[@623,N27]Result[23, 129]
show create table primary03;
Table  ¦  Create Table
primary03  ¦  CREATE TABLE `primary03` (
  `col1New` int NOT NULL,
  `col2` binary(10) DEFAULT NULL,
  PRIMARY KEY (`col1New`)
)

#SQL[@624,N53]Result[]
insert into primary03 (col1New, col2) values (3, '*');

#SQL[@625,N41]Error[37]
insert into primary03 values (3, 'assad');
Duplicate entry '3' for key 'col1new'

#SQL[@626,N61]Error[250]
update from primary03 set col2 = 'database' where col1New = 3;
SQL parser error: You have an error in your SQL syntax; check the manual that corresponds to your MatrixOne server version for the right syntax to use. syntax error at line 1 column 11 near \" from primary03 set col2 = 'database' where col1New = 3\";

#SQL[@627,N23]Result[17, 17, 17, 17]
select * from primary03;
col1new  ¦  col2
1  ¦  32143     
2  ¦  3e        
3  ¦  *         

#SQL[@628,N27]Result[71, 59, 57]
show columns from primary03;
Field  ¦  Type  ¦  Null  ¦  Key  ¦  Default  ¦  Extra  ¦  Comment
col1New  ¦  INT(32)  ¦  NO  ¦  PRI  ¦  null  ¦    ¦  
col2  ¦  BINARY(10)  ¦  YES  ¦    ¦  null  ¦    ¦  

#SQL[@629,N151]Result[59, 39, 40]
select table_name,COLUMN_NAME, data_type,is_nullable from information_schema.columns where table_name like 'primary03' and COLUMN_NAME not like '__mo%';
table_name  ¦  COLUMN_NAME  ¦  data_type  ¦  is_nullable
primary03  ¦  col1New  ¦  INT  ¦  NO
primary03  ¦  col2  ¦  BINARY  ¦  YES

#SQL[@630,N20]Result[]
drop table primary03;

#SQL[@634,N30]Result[]
drop table if exists primary04;

#SQL[@635,N64]Result[]
create table primary04(col1 int primary key ,col2 varbinary(20));

#SQL[@636,N45]Result[]
insert into primary04 values (1, 'qfreqvreq');

#SQL[@637,N44]Result[]
insert into primary04 values (2, '324543##');

#SQL[@638,N47]Result[]
alter table primary04 change col1 col1New float;

#SQL[@639,N55]Result[]
alter table primary04 change col2 col2New varbinary(50);

#SQL[@640,N27]Result[23, 137]
show create table primary04;
Table  ¦  Create Table
primary04  ¦  CREATE TABLE `primary04` (
  `col1New` float NOT NULL,
  `col2New` varbinary(50) DEFAULT NULL,
  PRIMARY KEY (`col1New`)
)

#SQL[@641,N44]Error[37]
insert into primary04 values (1, '324342__');
Duplicate entry '1' for key 'col1new'

#SQL[@642,N38]Result[]
insert into primary04 values (3, 'qw');

#SQL[@643,N46]Error[41]
delete from primary04 where col2 = 'qfreqvreq';
invalid input: column col2 does not exist

#SQL[@644,N49]Result[]
delete from primary04 where col2New = 'qfreqvreq';

#SQL[@645,N70]Result[]
update primary04 set col2New = 'ewhueifjnweknd3242e' where col1New = 1;

#SQL[@646,N23]Result[20, 15, 9]
select * from primary04;
col1new  ¦  col2new
2  ¦  324543##
3  ¦  qw

#SQL[@647,N27]Result[71, 60, 63]
show columns from primary04;
Field  ¦  Type  ¦  Null  ¦  Key  ¦  Default  ¦  Extra  ¦  Comment
col1New  ¦  FLOAT(0)  ¦  NO  ¦  PRI  ¦  null  ¦    ¦  
col2New  ¦  VARBINARY(50)  ¦  YES  ¦    ¦  null  ¦    ¦  

#SQL[@648,N151]Result[59, 41, 46]
select table_name,COLUMN_NAME, data_type,is_nullable from information_schema.columns where table_name like 'primary04' and COLUMN_NAME not like '__mo%';
table_name  ¦  COLUMN_NAME  ¦  data_type  ¦  is_nullable
primary04  ¦  col1New  ¦  FLOAT  ¦  NO
primary04  ¦  col2New  ¦  VARBINARY  ¦  YES

#SQL[@649,N20]Result[]
drop table primary04;

#SQL[@653,N30]Result[]
drop table if exists primary05;

#SQL[@654,N64]Result[]
create table primary05(col1 int primary key ,col2 varbinary(20));

#SQL[@655,N45]Result[]
insert into primary05 values (1, 'qfreqvreq');

#SQL[@656,N44]Result[]
insert into primary05 values (2, '324543##');

#SQL[@657,N64]Error[28]
alter table primary05 change col2 col2New binary(30) primary key;
Multiple primary key defined

#SQL[@658,N27]Result[23, 126]
show create table primary05;
Table  ¦  Create Table
primary05  ¦  CREATE TABLE `primary05` (
  `col1` int NOT NULL,
  `col2` varbinary(20) DEFAULT NULL,
  PRIMARY KEY (`col1`)
)

#SQL[@659,N151]Result[59, 36, 43]
select table_name,COLUMN_NAME, data_type,is_nullable from information_schema.columns where table_name like 'primary05' and COLUMN_NAME not like '__mo%';
table_name  ¦  COLUMN_NAME  ¦  data_type  ¦  is_nullable
primary05  ¦  col1  ¦  INT  ¦  NO
primary05  ¦  col2  ¦  VARBINARY  ¦  YES

#SQL[@660,N20]Result[]
drop table primary05;

#SQL[@664,N30]Result[]
drop table if exists primary06;

#SQL[@665,N64]Result[]
create table primary06(col1 int primary key ,col2 varbinary(20));

#SQL[@666,N45]Result[]
insert into primary06 values (1, 'qfreqvreq');

#SQL[@667,N44]Result[]
insert into primary06 values (2, '324543##');

#SQL[@668,N66]Error[28]
alter table primary06 change col1 col1New int unsigned primary key;
Multiple primary key defined

#SQL[@669,N27]Result[23, 126]
show create table primary06;
Table  ¦  Create Table
primary06  ¦  CREATE TABLE `primary06` (
  `col1` int NOT NULL,
  `col2` varbinary(20) DEFAULT NULL,
  PRIMARY KEY (`col1`)
)

#SQL[@670,N151]Result[59, 36, 43]
select table_name,COLUMN_NAME, data_type,is_nullable from information_schema.columns where table_name like 'primary06' and COLUMN_NAME not like '__mo%';
table_name  ¦  COLUMN_NAME  ¦  data_type  ¦  is_nullable
primary06  ¦  col1  ¦  INT  ¦  NO
primary06  ¦  col2  ¦  VARBINARY  ¦  YES

#SQL[@671,N20]Result[]
drop table primary06;

#SQL[@675,N30]Result[]
drop table if exists primary07;

#SQL[@676,N84]Result[]
create table primary07(col1 int ,col2 float, col3 decimal, primary key (col1, col2));

#SQL[@677,N67]Result[]
insert into primary07 values (1, 213412.32143, 3214312.34243214242);

#SQL[@678,N68]Result[]
insert into primary07 values (2, -324.2342432423, -1243.42334234242);

#SQL[@679,N61]Error[90]
alter table primary07 change col1 col1New double default null;
All parts of a PRIMARY KEY must be NOT NULL; if you need NULL in a key, use UNIQUE instead

#SQL[@680,N58]Error[90]
alter table primary07 change col2 col2New int default null;
All parts of a PRIMARY KEY must be NOT NULL; if you need NULL in a key, use UNIQUE instead

#SQL[@681,N27]Result[23, 158]
show create table primary07;
Table  ¦  Create Table
primary07  ¦  CREATE TABLE `primary07` (
  `col1` int NOT NULL,
  `col2` float NOT NULL,
  `col3` decimal(38,0) DEFAULT NULL,
  PRIMARY KEY (`col1`,`col2`)
)

#SQL[@682,N151]Result[59, 36, 38, 41]
select table_name,COLUMN_NAME, data_type,is_nullable from information_schema.columns where table_name like 'primary07' and COLUMN_NAME not like '__mo%';
table_name  ¦  COLUMN_NAME  ¦  data_type  ¦  is_nullable
primary07  ¦  col1  ¦  INT  ¦  NO
primary07  ¦  col2  ¦  FLOAT  ¦  NO
primary07  ¦  col3  ¦  DECIMAL  ¦  YES

#SQL[@683,N20]Result[]
drop table primary07;

#SQL[@687,N30]Result[]
drop table if exists primary08;

#SQL[@688,N84]Result[]
create table primary08(col1 int ,col2 float, col3 decimal, primary key (col1, col2));

#SQL[@689,N67]Result[]
insert into primary08 values (1, 213412.32143, 3214312.34243214242);

#SQL[@690,N68]Result[]
insert into primary08 values (2, -324.2342432423, -1243.42334234242);

#SQL[@691,N57]Result[]
alter table primary08 change col1 col1New double not null;

#SQL[@692,N56]Result[]
alter table primary08 change col2 col2New decimal(28,10);

#SQL[@693,N27]Result[23, 182]
show create table primary08;
Table  ¦  Create Table
primary08  ¦  CREATE TABLE `primary08` (
  `col1New` double NOT NULL,
  `col2New` decimal(28,10) NOT NULL,
  `col3` decimal(38,0) DEFAULT NULL,
  PRIMARY KEY (`col1New`,`col2New`)
)

#SQL[@694,N73]Result[]
insert into primary08 values (3, 73829.273897298374823, 38298390.3242223);

#SQL[@695,N59]Error[48]
update primary08 set col2 = 32432.3242424242 where col1 = 1;
internal error: column 'col2' not found in table

#SQL[@696,N65]Result[]
update primary08 set col2New = 32432.3242424242 where col1New = 1;

#SQL[@697,N36]Error[41]
delete from primary08 where col1 = 1;
invalid input: column col1 does not exist

#SQL[@698,N39]Result[]
delete from primary08 where col1New = 2;

#SQL[@699,N23]Result[30, 37, 36]
select * from primary08;
col1new  ¦  col2new  ¦  col3
3  ¦  73829.2738972984  ¦  38298390
1  ¦  32432.3242424242  ¦  3214312

#SQL[@700,N20]Result[]
drop table primary08;

#SQL[@704,N30]Result[]
drop table if exists primary09;

#SQL[@705,N59]Result[]
create table primary09 (col1 int primary key, col2 decimal);

#SQL[@706,N27]Result[23, 126]
show create table primary09;
Table  ¦  Create Table
primary09  ¦  CREATE TABLE `primary09` (
  `col1` int NOT NULL,
  `col2` decimal(38,0) DEFAULT NULL,
  PRIMARY KEY (`col1`)
)

#SQL[@707,N41]Result[]
insert into primary09 values(1, 3412.324);

#SQL[@708,N47]Result[]
insert into primary09 values (-10, 323943.2343);

#SQL[@709,N60]Error[90]
alter table primary09 change col1 col1New float default null;
All parts of a PRIMARY KEY must be NOT NULL; if you need NULL in a key, use UNIQUE instead

#SQL[@710,N20]Result[]
drop table primary09;

#SQL[@714,N28]Result[]
drop table if exists index01;

#SQL[@715,N95]Result[]
CREATE TABLE index01(a INTEGER not null , b CHAR(10), c date, d decimal(7,2), UNIQUE KEY(a, b));

#SQL[@716,N25]Result[23, 173]
show create table index01;
Table  ¦  Create Table
index01  ¦  CREATE TABLE `index01` (
  `a` int NOT NULL,
  `b` char(10) DEFAULT NULL,
  `c` date DEFAULT NULL,
  `d` decimal(7,2) DEFAULT NULL,
  UNIQUE KEY `a` (`a`,`b`)
)

#SQL[@717,N54]Result[]
insert into index01 values(1, 'ab', '1980-12-17', 800);

#SQL[@718,N55]Result[]
insert into index01 values(2, 'ac', '1981-02-20', 1600);

#SQL[@719,N54]Result[]
insert into index01 values(3, 'ad', '1981-02-22', 500);

#SQL[@720,N21]Result[22, 37, 38, 37]
select * from index01;
a  ¦  b  ¦  c  ¦  d
1  ¦  ab  ¦  1980-12-17  ¦  800.00
2  ¦  ac  ¦  1981-02-20  ¦  1600.00
3  ¦  ad  ¦  1981-02-22  ¦  500.00

#SQL[@721,N45]Result[]
alter table index01 change b bNew VARCHAR(20);

#SQL[@722,N25]Result[23, 182]
show create table index01;
Table  ¦  Create Table
index01  ¦  CREATE TABLE `index01` (
  `a` int NOT NULL,
  `bNew` varchar(20) DEFAULT NULL,
  `c` date DEFAULT NULL,
  `d` decimal(7,2) DEFAULT NULL,
  UNIQUE KEY `a` (`a`,`bNew`)
)

#SQL[@723,N23]Result[233, 115, 124]
show index from index01;
Table  ¦  Non_unique  ¦  Key_name  ¦  Seq_in_index  ¦  Column_name  ¦  Collation  ¦  Cardinality  ¦  Sub_part  ¦  Packed  ¦  Null  ¦  Index_type  ¦  Comment  ¦  Index_comment  ¦  Index_params  ¦  Visible  ¦  Expression
index01  ¦  0  ¦  a  ¦  1  ¦  a  ¦  A  ¦  0  ¦  NULL  ¦  NULL  ¦    ¦    ¦    ¦    ¦    ¦  YES  ¦  a
index01  ¦  0  ¦  a  ¦  2  ¦  bNew  ¦  A  ¦  0  ¦  NULL  ¦  NULL  ¦  YES  ¦    ¦    ¦    ¦    ¦  YES  ¦  bNew

#SQL[@724,N62]Result[]
alter table index01 change bNew bNewNew VARCHAR(20) UNIQUE KEY;

#SQL[@725,N23]Result[233, 115, 130, 136]
show index from index01;
Table  ¦  Non_unique  ¦  Key_name  ¦  Seq_in_index  ¦  Column_name  ¦  Collation  ¦  Cardinality  ¦  Sub_part  ¦  Packed  ¦  Null  ¦  Index_type  ¦  Comment  ¦  Index_comment  ¦  Index_params  ¦  Visible  ¦  Expression
index01  ¦  0  ¦  a  ¦  1  ¦  a  ¦  A  ¦  0  ¦  NULL  ¦  NULL  ¦    ¦    ¦    ¦    ¦    ¦  YES  ¦  a
index01  ¦  0  ¦  a  ¦  2  ¦  bNewNew  ¦  A  ¦  0  ¦  NULL  ¦  NULL  ¦  YES  ¦    ¦    ¦    ¦    ¦  YES  ¦  bNewNew
index01  ¦  0  ¦  bnewnew  ¦  1  ¦  bNewNew  ¦  A  ¦  0  ¦  NULL  ¦  NULL  ¦  YES  ¦    ¦    ¦    ¦    ¦  YES  ¦  bNewNew

#SQL[@726,N25]Result[23, 224]
show create table index01;
Table  ¦  Create Table
index01  ¦  CREATE TABLE `index01` (
  `a` int NOT NULL,
  `bNewNew` varchar(20) DEFAULT NULL,
  `c` date DEFAULT NULL,
  `d` decimal(7,2) DEFAULT NULL,
  UNIQUE KEY `a` (`a`,`bNewNew`),
  UNIQUE KEY `bnewnew` (`bNewNew`)
)

#SQL[@727,N69]Error[31]
insert into index01 (a, b, c, d) values (5, 'bh', '1999-01-01', 3000);
Unknown column 'b' in 'index01'

#SQL[@728,N75]Result[]
insert into index01 (a, bnewNEW, c, d) values (5, 'bh', '1999-01-01', 3000);

#SQL[@729,N21]Result[28, 37, 38, 37, 38]
select * from index01;
a  ¦  bnewnew  ¦  c  ¦  d
1  ¦  ab  ¦  1980-12-17  ¦  800.00
2  ¦  ac  ¦  1981-02-20  ¦  1600.00
3  ¦  ad  ¦  1981-02-22  ¦  500.00
5  ¦  bh  ¦  1999-01-01  ¦  3000.00

#SQL[@730,N34]Error[38]
delete from index01 where b = 'ab';
invalid input: column b does not exist

#SQL[@731,N40]Result[]
delete from index01 where bnewNew = 'ab';

#SQL[@732,N21]Result[28, 38, 37, 38]
select * from index01;
a  ¦  bnewnew  ¦  c  ¦  d
2  ¦  ac  ¦  1981-02-20  ¦  1600.00
3  ¦  ad  ¦  1981-02-22  ¦  500.00
5  ¦  bh  ¦  1999-01-01  ¦  3000.00

#SQL[@733,N56]Result[]
update index01 set c = '2022-12-12' where bNewNeW = 'ac';

#SQL[@734,N21]Result[28, 37, 38, 38]
select * from index01;
a  ¦  bnewnew  ¦  c  ¦  d
3  ¦  ad  ¦  1981-02-22  ¦  500.00
5  ¦  bh  ¦  1999-01-01  ¦  3000.00
2  ¦  ac  ¦  2022-12-12  ¦  1600.00

#SQL[@735,N149]Result[59, 31, 42, 33, 36]
select table_name,COLUMN_NAME, data_type,is_nullable from information_schema.columns where table_name like 'index01' and COLUMN_NAME not like '__mo%';
table_name  ¦  COLUMN_NAME  ¦  data_type  ¦  is_nullable
index01  ¦  a  ¦  INT  ¦  NO
index01  ¦  bNewNew  ¦  VARCHAR  ¦  YES
index01  ¦  c  ¦  DATE  ¦  YES
index01  ¦  d  ¦  DECIMAL  ¦  YES

#SQL[@736,N18]Result[]
drop table index01;

#SQL[@740,N28]Result[]
drop table if exists index02;

#SQL[@741,N100]Result[]
CREATE TABLE index02(a INTEGER PRIMARY KEY, b CHAR(10), c date, d decimal(7,2), INDEX(a, b), KEY(c));

#SQL[@742,N54]Result[]
insert into index02 values(1, 'ab', '1980-12-17', 800);

#SQL[@743,N55]Result[]
insert into index02 values(2, 'ac', '1981-02-20', 1600);

#SQL[@744,N54]Result[]
insert into index02 values(3, 'ad', '1981-02-22', 500);

#SQL[@745,N21]Result[22, 37, 38, 37]
select * from index02;
a  ¦  b  ¦  c  ¦  d
1  ¦  ab  ¦  1980-12-17  ¦  800.00
2  ¦  ac  ¦  1981-02-20  ¦  1600.00
3  ¦  ad  ¦  1981-02-22  ¦  500.00

#SQL[@746,N52]Error[28]
alter table index02 change b bNewNew VARCHAR(20) KEY;
Multiple primary key defined

#SQL[@747,N25]Result[23, 204]
show create table index02;
Table  ¦  Create Table
index02  ¦  CREATE TABLE `index02` (
  `a` int NOT NULL,
  `b` char(10) DEFAULT NULL,
  `c` date DEFAULT NULL,
  `d` decimal(7,2) DEFAULT NULL,
  PRIMARY KEY (`a`),
  KEY `a` (`a`,`b`),
  KEY `c` (`c`)
)

#SQL[@748,N59]Result[]
alter table index02 change b bnewNew VARCHAR(20) UNIQUE KEY;

#SQL[@749,N23]Result[233, 136, 115, 130, 118, 121]
show index from index02;
Table  ¦  Non_unique  ¦  Key_name  ¦  Seq_in_index  ¦  Column_name  ¦  Collation  ¦  Cardinality  ¦  Sub_part  ¦  Packed  ¦  Null  ¦  Index_type  ¦  Comment  ¦  Index_comment  ¦  Index_params  ¦  Visible  ¦  Expression
index02  ¦  0  ¦  bnewnew  ¦  1  ¦  bnewNew  ¦  A  ¦  0  ¦  NULL  ¦  NULL  ¦  YES  ¦    ¦    ¦    ¦    ¦  YES  ¦  bnewNew
index02  ¦  1  ¦  a  ¦  1  ¦  a  ¦  A  ¦  0  ¦  NULL  ¦  NULL  ¦    ¦    ¦    ¦    ¦    ¦  YES  ¦  a
index02  ¦  1  ¦  a  ¦  2  ¦  bnewNew  ¦  A  ¦  0  ¦  NULL  ¦  NULL  ¦  YES  ¦    ¦    ¦    ¦    ¦  YES  ¦  bnewNew
index02  ¦  1  ¦  c  ¦  1  ¦  c  ¦  A  ¦  0  ¦  NULL  ¦  NULL  ¦  YES  ¦    ¦    ¦    ¦    ¦  YES  ¦  c
index02  ¦  0  ¦  PRIMARY  ¦  1  ¦  a  ¦  A  ¦  0  ¦  NULL  ¦  NULL  ¦    ¦    ¦    ¦    ¦    ¦  YES  ¦  a

#SQL[@750,N25]Result[23, 255]
show create table index02;
Table  ¦  Create Table
index02  ¦  CREATE TABLE `index02` (
  `a` int NOT NULL,
  `bnewNew` varchar(20) DEFAULT NULL,
  `c` date DEFAULT NULL,
  `d` decimal(7,2) DEFAULT NULL,
  PRIMARY KEY (`a`),
  UNIQUE KEY `bnewnew` (`bnewNew`),
  KEY `a` (`a`,`bnewNew`),
  KEY `c` (`c`)
)

#SQL[@751,N57]Error[38]
insert into index02 values (4, 'ab', '2000-10-10', 10000);
Duplicate entry 'ab' for key 'bnewnew'

#SQL[@752,N57]Result[]
insert into index02 values (5, 'gh', '1999-12-31', 20000);

#SQL[@753,N40]Result[]
delete from index02 where bnewnew = 'ab';

#SQL[@754,N60]Result[]
update index02 set bnewnew = 'database' where bnewnEW = 'ad';

#SQL[@755,N12]Result[71, 53, 64, 54, 56]
desc index02;
Field  ¦  Type  ¦  Null  ¦  Key  ¦  Default  ¦  Extra  ¦  Comment
a  ¦  INT(32)  ¦  NO  ¦  PRI  ¦  null  ¦    ¦  
bnewNew  ¦  VARCHAR(20)  ¦  YES  ¦  UNI  ¦  null  ¦    ¦  
c  ¦  DATE(0)  ¦  YES  ¦  MUL  ¦  null  ¦    ¦  
d  ¦  DECIMAL(7,2)  ¦  YES  ¦    ¦  null  ¦    ¦  

#SQL[@756,N149]Result[59, 31, 42, 33, 36]
select table_name,COLUMN_NAME, data_type,is_nullable from information_schema.columns where table_name like 'index02' and COLUMN_NAME not like '__mo%';
table_name  ¦  COLUMN_NAME  ¦  data_type  ¦  is_nullable
index02  ¦  a  ¦  INT  ¦  NO
index02  ¦  bnewNew  ¦  VARCHAR  ¦  YES
index02  ¦  c  ¦  DATE  ¦  YES
index02  ¦  d  ¦  DECIMAL  ¦  YES

#SQL[@757,N21]Result[28, 38, 39, 43]
select * from index02;
a  ¦  bnewnew  ¦  c  ¦  d
2  ¦  ac  ¦  1981-02-20  ¦  1600.00
5  ¦  gh  ¦  1999-12-31  ¦  20000.00
3  ¦  database  ¦  1981-02-22  ¦  500.00

#SQL[@761,N30]Result[]
drop table if exists foreign01;

#SQL[@762,N154]Result[]
create table foreign01(col1 int primary key,
                       col2 varchar(20),
                       col3 int,
                       col4 bigint);

#SQL[@766,N30]Result[]
drop table if exists foreign02;

#SQL[@767,N195]Result[]
create table foreign02(col1 int,
                       col2 int,
                       col3 int primary key,
                       constraint `c1` foreign key(col1) references foreign01(col1));

#SQL[@771,N27]Result[23, 181]
show create table foreign01;
Table  ¦  Create Table
foreign01  ¦  CREATE TABLE `foreign01` (
  `col1` int NOT NULL,
  `col2` varchar(20) DEFAULT NULL,
  `col3` int DEFAULT NULL,
  `col4` bigint DEFAULT NULL,
  PRIMARY KEY (`col1`)
)

#SQL[@772,N27]Result[23, 253]
show create table foreign02;
Table  ¦  Create Table
foreign02  ¦  CREATE TABLE `foreign02` (
  `col1` int DEFAULT NULL,
  `col2` int DEFAULT NULL,
  `col3` int NOT NULL,
  PRIMARY KEY (`col3`),
  CONSTRAINT `c1` FOREIGN KEY (`col1`) REFERENCES `foreign01` (`col1`) ON DELETE RESTRICT ON UPDATE RESTRICT
)

#SQL[@773,N44]Result[]
insert into foreign01 values(1,'sfhuwe',1,1);

#SQL[@774,N49]Result[]
insert into foreign01 values(2,'37829901k3d',2,2);

#SQL[@775,N35]Result[]
insert into foreign02 values(1,1,1);

#SQL[@776,N35]Result[]
insert into foreign02 values(2,2,2);

#SQL[@777,N23]Result[34, 27, 32]
select * from foreign01;
col1  ¦  col2  ¦  col3  ¦  col4
1  ¦  sfhuwe  ¦  1  ¦  1
2  ¦  37829901k3d  ¦  2  ¦  2

#SQL[@778,N23]Result[24, 15, 15]
select * from foreign02;
col1  ¦  col2  ¦  col3
1  ¦  1  ¦  1
2  ¦  2  ¦  2

#SQL[@779,N49]Error[50]
alter table foreign01 change col1 col1New decimal;
Columns participating in a foreign key are renamed

#SQL[@780,N58]Error[66]
alter table foreign02 change col1 col1New float after col3;
Cannot change column 'col1': used in a foreign key constraint 'c1'

#SQL[@781,N27]Result[23, 181]
show create table foreign01;
Table  ¦  Create Table
foreign01  ¦  CREATE TABLE `foreign01` (
  `col1` int NOT NULL,
  `col2` varchar(20) DEFAULT NULL,
  `col3` int DEFAULT NULL,
  `col4` bigint DEFAULT NULL,
  PRIMARY KEY (`col1`)
)

#SQL[@782,N27]Result[23, 253]
show create table foreign02;
Table  ¦  Create Table
foreign02  ¦  CREATE TABLE `foreign02` (
  `col1` int DEFAULT NULL,
  `col2` int DEFAULT NULL,
  `col3` int NOT NULL,
  PRIMARY KEY (`col3`),
  CONSTRAINT `c1` FOREIGN KEY (`col1`) REFERENCES `foreign01` (`col1`) ON DELETE RESTRICT ON UPDATE RESTRICT
)

#SQL[@783,N54]Result[]
alter table foreign01 change col2 col2New varchar(100);

#SQL[@784,N59]Result[]
alter table foreign02 change col2 col2new double after col3;

#SQL[@785,N57]Result[]
insert into foreign01 values(3,'bcguwgheinwqneku678',2,2);

#SQL[@786,N35]Error[80]
insert into foreign02 values(6,6,6);
internal error: Cannot add or update a child row: a foreign key constraint fails

#SQL[@787,N46]Error[84]
delete from foreign01 where col2New = 'sfhuwe';
internal error: Cannot delete or update a parent row: a foreign key constraint fails

#SQL[@788,N39]Result[]
delete from foreign02 where col2New = 2;

#SQL[@789,N60]Error[49]
update foreign01 set col2 = 'database ewueh ' where col1 = 1;
internal error: column 'col2' not found in table 

#SQL[@790,N63]Result[]
update foreign01 set col2New = 'database ewueh ' where col1 = 1;

#SQL[@791,N23]Result[37, 32, 40, 36]
select * from foreign01;
col1  ¦  col2new  ¦  col3  ¦  col4
2  ¦  37829901k3d  ¦  2  ¦  2
3  ¦  bcguwgheinwqneku678  ¦  2  ¦  2
1  ¦  database ewueh   ¦  1  ¦  1

#SQL[@792,N23]Result[27, 15]
select * from foreign02;
col1  ¦  col3  ¦  col2new
1  ¦  1  ¦  1

#SQL[@793,N27]Result[23, 185]
show create table foreign01;
Table  ¦  Create Table
foreign01  ¦  CREATE TABLE `foreign01` (
  `col1` int NOT NULL,
  `col2New` varchar(100) DEFAULT NULL,
  `col3` int DEFAULT NULL,
  `col4` bigint DEFAULT NULL,
  PRIMARY KEY (`col1`)
)

#SQL[@794,N27]Result[23, 259]
show create table foreign02;
Table  ¦  Create Table
foreign02  ¦  CREATE TABLE `foreign02` (
  `col1` int DEFAULT NULL,
  `col3` int NOT NULL,
  `col2new` double DEFAULT NULL,
  PRIMARY KEY (`col3`),
  CONSTRAINT `c1` FOREIGN KEY (`col1`) REFERENCES `foreign01` (`col1`) ON DELETE RESTRICT ON UPDATE RESTRICT
)

#SQL[@795,N151]Result[59, 36, 44, 37, 40]
select table_name,COLUMN_NAME, data_type,is_nullable from information_schema.columns where table_name like 'foreign01' and COLUMN_NAME not like '__mo%';
table_name  ¦  COLUMN_NAME  ¦  data_type  ¦  is_nullable
foreign01  ¦  col1  ¦  INT  ¦  NO
foreign01  ¦  col2New  ¦  VARCHAR  ¦  YES
foreign01  ¦  col3  ¦  INT  ¦  YES
foreign01  ¦  col4  ¦  BIGINT  ¦  YES

#SQL[@796,N151]Result[59, 37, 43, 36]
select table_name,COLUMN_NAME, data_type,is_nullable from information_schema.columns where table_name like 'foreign02' and COLUMN_NAME not like '__mo%';
table_name  ¦  COLUMN_NAME  ¦  data_type  ¦  is_nullable
foreign02  ¦  col1  ¦  INT  ¦  YES
foreign02  ¦  col2new  ¦  DOUBLE  ¦  YES
foreign02  ¦  col3  ¦  INT  ¦  NO

#SQL[@797,N20]Result[]
drop table foreign02;

#SQL[@798,N20]Result[]
drop table foreign01;

#SQL[@802,N30]Result[]
drop table if exists decimal01;

#SQL[@803,N57]Result[]
create table decimal01 (col1 decimal,col2 decimal(38,10));

#SQL[@804,N95]Result[]
insert into decimal01 values (23746723468723.242334243, 38208439024234.43242342423423423422342);

#SQL[@805,N93]Result[]
insert into decimal01 values (32487329847923424, -4324324324.3297932749028949373324242423424);

#SQL[@806,N62]Result[]
alter table decimal01 change column col1 col1New decimal(38,6);

#SQL[@807,N79]Result[]
alter table decimal01 change col2 col2New38782ufdhwg43o2uih4f32f4 decimal(38,9);

#SQL[@808,N27]Result[23, 146]
show create table decimal01;
Table  ¦  Create Table
decimal01  ¦  CREATE TABLE `decimal01` (
  `col1New` decimal(38,6) DEFAULT NULL,
  `col2New38782ufdhwg43o2uih4f32f4` decimal(38,9) DEFAULT NULL
)

#SQL[@809,N23]Result[44, 51, 51]
select * from decimal01;
col1new  ¦  col2new38782ufdhwg43o2uih4f32f4
23746723468723.000000  ¦  38208439024234.432423424
32487329847923424.000000  ¦  -4324324324.329793275

#SQL[@810,N24]Result[]
truncate table decimal01;

#SQL[@811,N57]Result[]
alter table decimal01 add column col3 decimal(19,0) first;

#SQL[@812,N27]Result[23, 183]
show create table decimal01;
Table  ¦  Create Table
decimal01  ¦  CREATE TABLE `decimal01` (
  `col3` decimal(19,0) DEFAULT NULL,
  `col1New` decimal(38,6) DEFAULT NULL,
  `col2New38782ufdhwg43o2uih4f32f4` decimal(38,9) DEFAULT NULL
)

#SQL[@813,N79]Result[]
insert into decimal01 values (37298342.123, -37829342.3244234, -283794324.2342);

#SQL[@814,N23]Result[54, 56]
select * from decimal01;
col3  ¦  col1new  ¦  col2new38782ufdhwg43o2uih4f32f4
37298342  ¦  -37829342.324423  ¦  -283794324.234200000

#SQL[@815,N20]Result[]
drop table decimal01;

#SQL[@819,N27]Result[]
drop table if exists null01;

#SQL[@820,N59]Result[]
create table null01(col1 int default null, col2 binary(10));

#SQL[@821,N38]Result[]
insert into null01 values (1, '32143');

#SQL[@822,N38]Result[]
insert into null01 values (null, '3e');

#SQL[@823,N56]Error[58]
alter table null01 change col1 col1hwjefewv int not null;
constraint violation: Column 'col1hwjefewv' cannot be null

#SQL[@824,N24]Result[23, 97]
show create table null01;
Table  ¦  Create Table
null01  ¦  CREATE TABLE `null01` (
  `col1` int DEFAULT NULL,
  `col2` binary(10) DEFAULT NULL
)

#SQL[@825,N20]Result[14, 17, 20]
select * from null01;
col1  ¦  col2
1  ¦  32143     
null  ¦  3e        

#SQL[@826,N148]Result[59, 34, 37]
select table_name,COLUMN_NAME, data_type,is_nullable from information_schema.columns where table_name like 'null01' and COLUMN_NAME not like '__mo%';
table_name  ¦  COLUMN_NAME  ¦  data_type  ¦  is_nullable
null01  ¦  col1  ¦  INT  ¦  YES
null01  ¦  col2  ¦  BINARY  ¦  YES

#SQL[@827,N17]Result[]
drop table null01;

#SQL[@831,N27]Result[]
drop table if exists null02;

#SQL[@832,N63]Result[]
create table null02(col1 int default null, col2 varbinary(100));

#SQL[@833,N38]Result[]
insert into null02 values (1, '32143');

#SQL[@834,N35]Result[]
insert into null02 values (2, '3e');

#SQL[@835,N51]Result[]
alter table null02 change col1 col1New int not null;

#SQL[@836,N24]Result[23, 100]
show create table null02;
Table  ¦  Create Table
null02  ¦  CREATE TABLE `null02` (
  `col1New` int NOT NULL,
  `col2` varbinary(100) DEFAULT NULL
)

#SQL[@837,N37]Error[53]
insert into null02 values (null, '1');
constraint violation: Column 'col1New' cannot be null

#SQL[@838,N39]Result[]
insert into null02 values (342, 'aesd');

#SQL[@839,N20]Result[17, 12, 9, 13]
select * from null02;
col1new  ¦  col2
1  ¦  32143
2  ¦  3e
342  ¦  aesd

#SQL[@840,N148]Result[59, 36, 40]
select table_name,COLUMN_NAME, data_type,is_nullable from information_schema.columns where table_name like 'null02' and COLUMN_NAME not like '__mo%';
table_name  ¦  COLUMN_NAME  ¦  data_type  ¦  is_nullable
null02  ¦  col1New  ¦  INT  ¦  NO
null02  ¦  col2  ¦  VARBINARY  ¦  YES

#SQL[@841,N17]Result[]
drop table null02;

#SQL[@845,N27]Result[]
drop table if exists cast01;

#SQL[@846,N90]Result[]
create table cast01 (col1 int, col2 smallint, col3 bigint unsigned, col4 tinyint unsigned);

#SQL[@847,N59]Result[]
insert into cast01 values (1, -32768, 12352314214243242, 0);

#SQL[@848,N57]Result[]
insert into cast01 values (329884234, 32767, 3828493, 21);

#SQL[@849,N59]Result[]
insert into cast01 values (-29302423, 32, 324242132321, 10);

#SQL[@850,N50]Result[]
insert into cast01 values (null, null, null, null);

#SQL[@851,N20]Result[34, 43, 41, 43, 34]
select * from cast01;
col1  ¦  col2  ¦  col3  ¦  col4
1  ¦  -32768  ¦  12352314214243242  ¦  0
329884234  ¦  32767  ¦  3828493  ¦  21
-29302423  ¦  32  ¦  324242132321  ¦  10
null  ¦  null  ¦  null  ¦  null

#SQL[@852,N44]Result[]
alter table cast01 change col1 col1New float;

#SQL[@853,N24]Result[23, 179]
show create table cast01;
Table  ¦  Create Table
cast01  ¦  CREATE TABLE `cast01` (
  `col1New` float DEFAULT NULL,
  `col2` smallint DEFAULT NULL,
  `col3` bigint unsigned DEFAULT NULL,
  `col4` tinyint unsigned DEFAULT NULL
)

#SQL[@854,N67]Result[]
insert into cast01 values (3271.312432, null, 323254324321432, 100);

#SQL[@855,N20]Result[37, 43, 41, 43, 34, 49]
select * from cast01;
col1new  ¦  col2  ¦  col3  ¦  col4
1  ¦  -32768  ¦  12352314214243242  ¦  0
329884220  ¦  32767  ¦  3828493  ¦  21
-29302424  ¦  32  ¦  324242132321  ¦  10
null  ¦  null  ¦  null  ¦  null
3271.3125  ¦  null  ¦  323254324321432  ¦  100

#SQL[@856,N51]Result[]
alter table cast01 change col2 col2New double first;

#SQL[@857,N24]Result[23, 180]
show create table cast01;
Table  ¦  Create Table
cast01  ¦  CREATE TABLE `cast01` (
  `col2New` double DEFAULT NULL,
  `col1New` float DEFAULT NULL,
  `col3` bigint unsigned DEFAULT NULL,
  `col4` tinyint unsigned DEFAULT NULL
)

#SQL[@858,N70]Result[]
insert into cast01 values (3271834.2134, -3892843.214, 328943232, 255);

#SQL[@859,N20]Result[40, 43, 41, 43, 34, 49, 52]
select * from cast01;
col2new  ¦  col1new  ¦  col3  ¦  col4
-32768  ¦  1  ¦  12352314214243242  ¦  0
32767  ¦  329884220  ¦  3828493  ¦  21
32  ¦  -29302424  ¦  324242132321  ¦  10
null  ¦  null  ¦  null  ¦  null
null  ¦  3271.3125  ¦  323254324321432  ¦  100
3271834.2134  ¦  -3892843.2  ¦  328943232  ¦  255

#SQL[@860,N45]Result[]
alter table cast01 change col3 col3New double;

#SQL[@861,N24]Result[23, 174]
show create table cast01;
Table  ¦  Create Table
cast01  ¦  CREATE TABLE `cast01` (
  `col2New` double DEFAULT NULL,
  `col1New` float DEFAULT NULL,
  `col3New` double DEFAULT NULL,
  `col4` tinyint unsigned DEFAULT NULL
)

#SQL[@862,N75]Result[]
insert into cast01 values (3271834.2134, -3892843.214, 328943232.3234, 255);

#SQL[@863,N20]Result[43, 43, 41, 43, 34, 49, 52, 57]
select * from cast01;
col2new  ¦  col1new  ¦  col3new  ¦  col4
-32768  ¦  1  ¦  12352314214243242  ¦  0
32767  ¦  329884220  ¦  3828493  ¦  21
32  ¦  -29302424  ¦  324242132321  ¦  10
null  ¦  null  ¦  null  ¦  null
null  ¦  3271.3125  ¦  323254324321432  ¦  100
3271834.2134  ¦  -3892843.2  ¦  328943232  ¦  255
3271834.2134  ¦  -3892843.2  ¦  328943232.3234  ¦  255

#SQL[@864,N67]Result[]
alter table cast01 change col4 col4New decimal(28,10) after col2New;

#SQL[@865,N24]Result[23, 175]
show create table cast01;
Table  ¦  Create Table
cast01  ¦  CREATE TABLE `cast01` (
  `col2New` double DEFAULT NULL,
  `col4New` decimal(28,10) DEFAULT NULL,
  `col1New` float DEFAULT NULL,
  `col3New` double DEFAULT NULL
)

#SQL[@866,N85]Result[]
insert into cast01 values (3271834.2134, -3823243.4324, 328943232.3234, -32423.43243);

#SQL[@867,N20]Result[46, 54, 52, 54, 34, 60, 63, 68, 70]
select * from cast01;
col2new  ¦  col4new  ¦  col1new  ¦  col3new
-32768  ¦  0.0000000000  ¦  1  ¦  12352314214243242
32767  ¦  21.0000000000  ¦  329884220  ¦  3828493
32  ¦  10.0000000000  ¦  -29302424  ¦  324242132321
null  ¦  null  ¦  null  ¦  null
null  ¦  100.0000000000  ¦  3271.3125  ¦  323254324321432
3271834.2134  ¦  255.0000000000  ¦  -3892843.2  ¦  328943232
3271834.2134  ¦  255.0000000000  ¦  -3892843.2  ¦  328943232.3234
3271834.2134  ¦  -3823243.4324000000  ¦  328943230  ¦  -32423.43243

#SQL[@868,N148]Result[59, 39, 40, 40, 41]
select table_name,COLUMN_NAME, data_type,is_nullable from information_schema.columns where table_name like 'cast01' and COLUMN_NAME not like '__mo%';
table_name  ¦  COLUMN_NAME  ¦  data_type  ¦  is_nullable
cast01  ¦  col1New  ¦  FLOAT  ¦  YES
cast01  ¦  col2New  ¦  DOUBLE  ¦  YES
cast01  ¦  col3New  ¦  DOUBLE  ¦  YES
cast01  ¦  col4New  ¦  DECIMAL  ¦  YES

#SQL[@869,N17]Result[]
drop table cast01;

#SQL[@873,N27]Result[]
drop table if exists cast02;

#SQL[@874,N85]Result[]
create table cast02 (col1 float, col2 double, col3 decimal(30,5), col4 decimal(37,1));

#SQL[@875,N104]Result[]
insert into cast02 values (1.321341, -32768.32142, 1235231421424.3214242134124324323, 12342.43243242121);

#SQL[@876,N61]Result[]
insert into cast02 values (329884234.3242, null, 3828493, 21);

#SQL[@877,N74]Result[]
insert into cast02 values (93024232.32324, -32.243142, 324242132321, null);

#SQL[@878,N20]Result[34, 64, 48, 58]
select * from cast02;
col1  ¦  col2  ¦  col3  ¦  col4
1.321341  ¦  -32768.32142  ¦  1235231421424.32142  ¦  12342.4
329884220  ¦  null  ¦  3828493.00000  ¦  21.0
93024230  ¦  -32.243142  ¦  324242132321.00000  ¦  null

#SQL[@879,N51]Result[]
alter table cast02 change col1 col1New int unsigned;

#SQL[@880,N24]Result[23, 179]
show create table cast02;
Table  ¦  Create Table
cast02  ¦  CREATE TABLE `cast02` (
  `col1New` int unsigned DEFAULT NULL,
  `col2` double DEFAULT NULL,
  `col3` decimal(30,5) DEFAULT NULL,
  `col4` decimal(37,1) DEFAULT NULL
)

#SQL[@881,N77]Result[]
insert into cast02 values (2724.327832, null, 32325432421432, 100.3322142142);

#SQL[@882,N20]Result[37, 57, 48, 58, 51]
select * from cast02;
col1new  ¦  col2  ¦  col3  ¦  col4
1  ¦  -32768.32142  ¦  1235231421424.32142  ¦  12342.4
329884224  ¦  null  ¦  3828493.00000  ¦  21.0
93024232  ¦  -32.243142  ¦  324242132321.00000  ¦  null
2724  ¦  null  ¦  32325432421432.00000  ¦  100.3

#SQL[@883,N61]Result[]
alter table cast02 change col2 col22361738278472874382 bigint;

#SQL[@884,N24]Result[23, 198]
show create table cast02;
Table  ¦  Create Table
cast02  ¦  CREATE TABLE `cast02` (
  `col1New` int unsigned DEFAULT NULL,
  `col22361738278472874382` bigint DEFAULT NULL,
  `col3` decimal(30,5) DEFAULT NULL,
  `col4` decimal(37,1) DEFAULT NULL
)

#SQL[@885,N83]Result[]
insert into cast02 values (1000, 323421423421342, 328943232.321424, -255.321151234);

#SQL[@886,N20]Result[56, 51, 48, 51, 51, 58]
select * from cast02;
col1new  ¦  col22361738278472874382  ¦  col3  ¦  col4
1  ¦  -32768  ¦  1235231421424.32142  ¦  12342.4
329884224  ¦  null  ¦  3828493.00000  ¦  21.0
93024232  ¦  -32  ¦  324242132321.00000  ¦  null
2724  ¦  null  ¦  32325432421432.00000  ¦  100.3
1000  ¦  323421423421342  ¦  328943232.32142  ¦  -255.3

#SQL[@887,N64]Result[]
alter table cast02 change col3 col3vhejwh4i3uh4r bigint unsigned;

#SQL[@888,N24]Result[23, 213]
show create table cast02;
Table  ¦  Create Table
cast02  ¦  CREATE TABLE `cast02` (
  `col1New` int unsigned DEFAULT NULL,
  `col22361738278472874382` bigint DEFAULT NULL,
  `col3vhejwh4i3uh4r` bigint unsigned DEFAULT NULL,
  `col4` decimal(37,1) DEFAULT NULL
)

#SQL[@889,N59]Result[]
insert into cast02 values (32718, 100, 32894323237289, 234);

#SQL[@890,N20]Result[69, 45, 42, 45, 45, 52, 45]
select * from cast02;
col1new  ¦  col22361738278472874382  ¦  col3vhejwh4i3uh4r  ¦  col4
1  ¦  -32768  ¦  1235231421424  ¦  12342.4
329884224  ¦  null  ¦  3828493  ¦  21.0
93024232  ¦  -32  ¦  324242132321  ¦  null
2724  ¦  null  ¦  32325432421432  ¦  100.3
1000  ¦  323421423421342  ¦  328943232  ¦  -255.3
32718  ¦  100  ¦  32894323237289  ¦  234.0

#SQL[@891,N64]Result[]
alter table cast02 change col4 col4cdhewjruekhwjf smallint first;

#SQL[@892,N24]Result[23, 222]
show create table cast02;
Table  ¦  Create Table
cast02  ¦  CREATE TABLE `cast02` (
  `col4cdhewjruekhwjf` smallint DEFAULT NULL,
  `col1New` int unsigned DEFAULT NULL,
  `col22361738278472874382` bigint DEFAULT NULL,
  `col3vhejwh4i3uh4r` bigint unsigned DEFAULT NULL
)

#SQL[@893,N59]Result[]
insert into cast02 values (234, 32718, 100, 32894323237289);

#SQL[@894,N20]Result[83, 43, 40, 45, 43, 50, 43, 43]
select * from cast02;
col4cdhewjruekhwjf  ¦  col1new  ¦  col22361738278472874382  ¦  col3vhejwh4i3uh4r
12342  ¦  1  ¦  -32768  ¦  1235231421424
21  ¦  329884224  ¦  null  ¦  3828493
null  ¦  93024232  ¦  -32  ¦  324242132321
100  ¦  2724  ¦  null  ¦  32325432421432
-255  ¦  1000  ¦  323421423421342  ¦  328943232
234  ¦  32718  ¦  100  ¦  32894323237289
234  ¦  32718  ¦  100  ¦  32894323237289

#SQL[@895,N148]Result[59, 46, 56, 59, 53]
select table_name,COLUMN_NAME, data_type,is_nullable from information_schema.columns where table_name like 'cast02' and COLUMN_NAME not like '__mo%';
table_name  ¦  COLUMN_NAME  ¦  data_type  ¦  is_nullable
cast02  ¦  col1New  ¦  INT UNSIGNED  ¦  YES
cast02  ¦  col22361738278472874382  ¦  BIGINT  ¦  YES
cast02  ¦  col3vhejwh4i3uh4r  ¦  BIGINT UNSIGNED  ¦  YES
cast02  ¦  col4cdhewjruekhwjf  ¦  SMALLINT  ¦  YES

#SQL[@896,N17]Result[]
drop table cast02;

#SQL[@900,N27]Result[]
drop table if exists cast03;

#SQL[@901,N83]Result[]
create table cast03 (col1 smallint unsigned, col2 float, col3 double, col4 decimal);

#SQL[@902,N82]Result[]
insert into cast03 values (1, 323242.34242, 23432.3242, 8329498352.32534242323432);

#SQL[@903,N83]Result[]
insert into cast03 values (200, -213443.321412, 32424.342424242, 0.382943424324234);

#SQL[@904,N75]Result[]
insert into cast03 (col1, col2, col3, col4) values (null, null, null, null);

#SQL[@905,N155]Result[]
alter table cast03 change col1 colNew  char(50), change col2 col2New char(100), change col3 col3New varchar(50), change col4 Newdwhjvb32v varchar(15) first;

#SQL[@906,N24]Result[23, 187]
show create table cast03;
Table  ¦  Create Table
cast03  ¦  CREATE TABLE `cast03` (
  `Newdwhjvb32v` varchar(15) DEFAULT NULL,
  `colNew` char(50) DEFAULT NULL,
  `col2New` char(100) DEFAULT NULL,
  `col3New` varchar(50) DEFAULT NULL
)

#SQL[@907,N108]Result[]
insert into cast03 values ('3243342', '3242f()', '4728947234342,', '457328990r3if943i4u9owiuo4ewfr3w4r3fre');

#SQL[@908,N148]Result[59, 46, 38, 41, 37]
select table_name,COLUMN_NAME, data_type,is_nullable from information_schema.columns where table_name like 'cast03' and COLUMN_NAME not like '__mo%';
table_name  ¦  COLUMN_NAME  ¦  data_type  ¦  is_nullable
cast03  ¦  Newdwhjvb32v  ¦  VARCHAR  ¦  YES
cast03  ¦  col2New  ¦  CHAR  ¦  YES
cast03  ¦  col3New  ¦  VARCHAR  ¦  YES
cast03  ¦  colNew  ¦  CHAR  ¦  YES

#SQL[@909,N20]Result[50, 48, 47, 34, 84]
select * from cast03;
newdwhjvb32v  ¦  colnew  ¦  col2new  ¦  col3new
8329498352  ¦  1  ¦  323242.34  ¦  23432.3242
0  ¦  200  ¦  -213443.33  ¦  32424.342424242
null  ¦  null  ¦  null  ¦  null
3243342  ¦  3242f()  ¦  4728947234342,  ¦  457328990r3if943i4u9owiuo4ewfr3w4r3fre

#SQL[@910,N17]Result[]
drop table cast03;

#SQL[@914,N27]Result[]
drop table if exists cast04;

#SQL[@915,N67]Result[]
create table cast04 (col1 char, col2 varchar, col3 text, col4 blob);

#SQL[@916,N74]Result[]
insert into cast04 values ('1', '-281321.21312', '328', '327482739.32413');

#SQL[@917,N90]Result[]
insert into cast04 values ('0', '3412234321', '-332134324.2432423423423', '-1032412.4324');

#SQL[@918,N50]Result[]
insert into cast04 values (null, null, null, null);

#SQL[@919,N62]Result[]
alter table cast04 change col1 col1hwejnejfwdewfr int unsigned;

#SQL[@920,N99]Result[]
alter table cast04 change col2 col237289738yiuhckehvjnkehifewjdhwenbvrferf decimal(34,4) after col4;

#SQL[@921,N24]Result[23, 218]
show create table cast04;
Table  ¦  Create Table
cast04  ¦  CREATE TABLE `cast04` (
  `col1hwejnejfwdewfr` int unsigned DEFAULT NULL,
  `col3` text DEFAULT NULL,
  `col4` blob DEFAULT NULL,
  `col237289738yiuhckehvjnkehifewjdhwenbvrferf` decimal(34,4) DEFAULT NULL
)

#SQL[@922,N97]Error[60]
alter table cast04 change col3 col3njwkeyhuijre double, change col4 ewh3ui2ou3i2f4 float not null;
constraint violation: Column 'ewh3ui2ou3i2f4' cannot be null

#SQL[@923,N24]Result[23, 218]
show create table cast04;
Table  ¦  Create Table
cast04  ¦  CREATE TABLE `cast04` (
  `col1hwejnejfwdewfr` int unsigned DEFAULT NULL,
  `col3` text DEFAULT NULL,
  `col4` blob DEFAULT NULL,
  `col237289738yiuhckehvjnkehifewjdhwenbvrferf` decimal(34,4) DEFAULT NULL
)

#SQL[@924,N28]Result[]
insert into cast04 values ();

#SQL[@925,N20]Result[87, 49, 71, 34, 34]
select * from cast04;
col1hwejnejfwdewfr  ¦  col3  ¦  col4  ¦  col237289738yiuhckehvjnkehifewjdhwenbvrferf
1  ¦  328  ¦  327482739.32413  ¦  -281321.2131
0  ¦  -332134324.2432423423423  ¦  -1032412.4324  ¦  3412234321.0000
null  ¦  null  ¦  null  ¦  null
null  ¦  null  ¦  null  ¦  null

#SQL[@926,N148]Result[59, 57, 77, 35, 35]
select table_name,COLUMN_NAME, data_type,is_nullable from information_schema.columns where table_name like 'cast04' and COLUMN_NAME not like '__mo%';
table_name  ¦  COLUMN_NAME  ¦  data_type  ¦  is_nullable
cast04  ¦  col1hwejnejfwdewfr  ¦  INT UNSIGNED  ¦  YES
cast04  ¦  col237289738yiuhckehvjnkehifewjdhwenbvrferf  ¦  DECIMAL  ¦  YES
cast04  ¦  col3  ¦  TEXT  ¦  YES
cast04  ¦  col4  ¦  BLOB  ¦  YES

#SQL[@927,N17]Result[]
drop table cast04;

#SQL[@931,N27]Result[]
drop table if exists cast05;

#SQL[@932,N31]Result[]
create table cast05 (col1 date);

#SQL[@933,N40]Result[]
insert into cast05 values ('1997-01-13');

#SQL[@934,N40]Result[]
insert into cast05 values ('2023-12-12');

#SQL[@935,N32]Result[]
insert into cast05 values (null);

#SQL[@936,N20]Result[4, 10, 10, 4]
select * from cast05;
col1
1997-01-13
2023-12-12
null

#SQL[@937,N53]Result[]
alter table cast05 change col1 ahgedbjwq varchar(100);

#SQL[@938,N57]Result[]
alter table cast05 change ahgedbjwq YUYHJB datetime first;

#SQL[@939,N20]Result[6, 19, 19, 4]
select * from cast05;
yuyhjb
1997-01-13 00:00:00
2023-12-12 00:00:00
null

#SQL[@940,N24]Result[23, 70]
show create table cast05;
Table  ¦  Create Table
cast05  ¦  CREATE TABLE `cast05` (
  `YUYHJB` datetime DEFAULT NULL
)

#SQL[@941,N148]Result[59, 41]
select table_name,COLUMN_NAME, data_type,is_nullable from information_schema.columns where table_name like 'cast05' and COLUMN_NAME not like '__mo%';
table_name  ¦  COLUMN_NAME  ¦  data_type  ¦  is_nullable
cast05  ¦  YUYHJB  ¦  DATETIME  ¦  YES

#SQL[@942,N17]Result[]
drop table cast05;

#SQL[@946,N31]Result[]
drop table if exists abnormal02;

#SQL[@947,N76]Result[]
create table abnormal02 (col1 int unsigned not null, col2 smallint unsigned);

#SQL[@948,N47]Result[]
insert into abnormal02 values (2147483647, 255);

#SQL[@949,N43]Result[]
insert into abnormal02 values (3242334, 10);

#SQL[@950,N24]Result[14, 19, 15]
select * from abnormal02;
col1  ¦  col2
2147483647  ¦  255
3242334  ¦  10

#SQL[@951,N50]Error[206]
alter table abnormal02 change col1 YYYU&*&*&&& int;
SQL parser error: You have an error in your SQL syntax; check the manual that corresponds to your MatrixOne server version for the right syntax to use. syntax error at line 1 column 40 near \"&*&*&&& int\";

#SQL[@952,N58]Result[]
alter table abnormal02 change col2 ehwuh3YUUUHHHB smallint;

#SQL[@953,N24]Result[24, 19, 15]
select * from abnormal02;
col1  ¦  ehwuh3yuuuhhhb
2147483647  ¦  255
3242334  ¦  10

#SQL[@954,N28]Result[23, 118]
show create table abnormal02;
Table  ¦  Create Table
abnormal02  ¦  CREATE TABLE `abnormal02` (
  `col1` int unsigned NOT NULL,
  `ehwuh3YUUUHHHB` smallint DEFAULT NULL
)

#SQL[@955,N152]Result[59, 46, 53]
select table_name,COLUMN_NAME, data_type,is_nullable from information_schema.columns where table_name like 'abnormal02' and COLUMN_NAME not like '__mo%';
table_name  ¦  COLUMN_NAME  ¦  data_type  ¦  is_nullable
abnormal02  ¦  col1  ¦  INT UNSIGNED  ¦  NO
abnormal02  ¦  ehwuh3YUUUHHHB  ¦  SMALLINT  ¦  YES

#SQL[@956,N21]Result[]
drop table abnormal02;

#SQL[@960,N31]Result[]
drop table if exists abnormal01;

#SQL[@961,N61]Result[]
create table abnormal01 (col1 int, col2 bigint, col3 decimal);

#SQL[@962,N81]Result[]
insert into abnormal01 values (2147483647, 9223372036854775807, 3291843920.32783);

#SQL[@963,N79]Result[]
insert into abnormal01 values (-21843243, 832942343241999999, -2787343243.2343);

#SQL[@964,N48]Result[]
insert into abnormal01 values (null, null, null);

#SQL[@965,N24]Result[24, 51, 50, 24]
select * from abnormal01;
col1  ¦  col2  ¦  col3
2147483647  ¦  9223372036854775807  ¦  3291843920
-21843243  ¦  832942343241999999  ¦  -2787343243
null  ¦  null  ¦  null

#SQL[@966,N55]Error[63]
alter table abnormal01 change col2 col2COLLLHNNHHHH int;
data out of range: data type int32, value '9223372036854775807'

#SQL[@967,N64]Error[213]
alter table abnormal01 change col1 whu3hkjwedn&32783u2j smallint;
SQL parser error: You have an error in your SQL syntax; check the manual that corresponds to your MatrixOne server version for the right syntax to use. syntax error at line 1 column 47 near \"&32783u2j smallint\";

#SQL[@968,N48]Error[201]
alter table abnormal01 change col3 decimal(10,0);
SQL parser error: You have an error in your SQL syntax; check the manual that corresponds to your MatrixOne server version for the right syntax to use. syntax error at line 1 column 43 near \"(10,0)\";

#SQL[@969,N24]Result[24, 51, 50, 24]
select * from abnormal01;
col1  ¦  col2  ¦  col3
2147483647  ¦  9223372036854775807  ¦  3291843920
-21843243  ¦  832942343241999999  ¦  -2787343243
null  ¦  null  ¦  null

#SQL[@970,N28]Result[23, 138]
show create table abnormal01;
Table  ¦  Create Table
abnormal01  ¦  CREATE TABLE `abnormal01` (
  `col1` int DEFAULT NULL,
  `col2` bigint DEFAULT NULL,
  `col3` decimal(38,0) DEFAULT NULL
)

#SQL[@971,N152]Result[59, 38, 41, 42]
select table_name,COLUMN_NAME, data_type,is_nullable from information_schema.columns where table_name like 'abnormal01' and COLUMN_NAME not like '__mo%';
table_name  ¦  COLUMN_NAME  ¦  data_type  ¦  is_nullable
abnormal01  ¦  col1  ¦  INT  ¦  YES
abnormal01  ¦  col2  ¦  BIGINT  ¦  YES
abnormal01  ¦  col3  ¦  DECIMAL  ¦  YES

#SQL[@972,N21]Result[]
drop table abnormal01;

#SQL[@976,N31]Result[]
drop table if exists abnormal02;

#SQL[@977,N58]Result[]
create table abnormal02 (col1 int not null, col2 smallint);

#SQL[@978,N48]Result[]
insert into abnormal02 values (-2147483647, 255);

#SQL[@979,N44]Result[]
insert into abnormal02 values (3242334, -10);

#SQL[@980,N24]Result[14, 20, 16]
select * from abnormal02;
col1  ¦  col2
-2147483647  ¦  255
3242334  ¦  -10

#SQL[@981,N55]Error[54]
alter table abnormal02 change col1 col1New int unsigned;
data out of range: data type uint, value '-2147483647'

#SQL[@982,N69]Error[213]
alter table abnormal02 change col2 col2New smallint smallint unsigned;
SQL parser error: You have an error in your SQL syntax; check the manual that corresponds to your MatrixOne server version for the right syntax to use. syntax error at line 1 column 60 near \" smallint unsigned\";

#SQL[@983,N24]Result[14, 20, 16]
select * from abnormal02;
col1  ¦  col2
-2147483647  ¦  255
3242334  ¦  -10

#SQL[@984,N28]Result[23, 99]
show create table abnormal02;
Table  ¦  Create Table
abnormal02  ¦  CREATE TABLE `abnormal02` (
  `col1` int NOT NULL,
  `col2` smallint DEFAULT NULL
)

#SQL[@985,N152]Result[59, 37, 43]
select table_name,COLUMN_NAME, data_type,is_nullable from information_schema.columns where table_name like 'abnormal02' and COLUMN_NAME not like '__mo%';
table_name  ¦  COLUMN_NAME  ¦  data_type  ¦  is_nullable
abnormal02  ¦  col1  ¦  INT  ¦  NO
abnormal02  ¦  col2  ¦  SMALLINT  ¦  YES

#SQL[@986,N21]Result[]
drop table abnormal02;

#SQL[@990,N31]Result[]
drop table if exists abnormal03;

#SQL[@991,N50]Result[]
create table abnormal03 (col1 datetime, col2 blob);

#SQL[@992,N109]Result[]
insert into abnormal03 values ('1997-01-13 00:00:00', '342ewfyuehcdeiuopwu4jo3lekwdfhiu48woi3jrdnefrbwui34f');

#SQL[@993,N112]Result[]
insert into abnormal03 values ('2012-01-13 23:23:59', '63298ufh3jcweuiv4h32jhf432ouy4hu3enjwfnwje4n3bj24f34573');

#SQL[@994,N24]Result[14, 77, 80]
select * from abnormal03;
col1  ¦  col2
1997-01-13 00:00:00  ¦  342ewfyuehcdeiuopwu4jo3lekwdfhiu48woi3jrdnefrbwui34f
2012-01-13 23:23:59  ¦  63298ufh3jcweuiv4h32jhf432ouy4hu3enjwfnwje4n3bj24f34573

#SQL[@995,N56]Result[]
alter table abnormal03 change col1 col1time varchar(100);

#SQL[@996,N46]Error[92]
alter table abnormal03 change col2 col2int int;
invalid argument cast to int, bad value 342ewfyuehcdeiuopwu4jo3lekwdfhiu48woi3jrdnefrbwui34f

#SQL[@997,N24]Result[18, 77, 80]
select * from abnormal03;
col1time  ¦  col2
1997-01-13 00:00:00  ¦  342ewfyuehcdeiuopwu4jo3lekwdfhiu48woi3jrdnefrbwui34f
2012-01-13 23:23:59  ¦  63298ufh3jcweuiv4h32jhf432ouy4hu3enjwfnwje4n3bj24f34573

#SQL[@998,N28]Result[23, 112]
show create table abnormal03;
Table  ¦  Create Table
abnormal03  ¦  CREATE TABLE `abnormal03` (
  `col1time` varchar(100) DEFAULT NULL,
  `col2` blob DEFAULT NULL
)

#SQL[@999,N152]Result[59, 46, 39]
select table_name,COLUMN_NAME, data_type,is_nullable from information_schema.columns where table_name like 'abnormal03' and COLUMN_NAME not like '__mo%';
table_name  ¦  COLUMN_NAME  ¦  data_type  ¦  is_nullable
abnormal03  ¦  col1time  ¦  VARCHAR  ¦  YES
abnormal03  ¦  col2  ¦  BLOB  ¦  YES

#SQL[@1000,N21]Result[]
drop table abnormal03;

#SQL[@1004,N31]Result[]
drop table if exists abnormal04;

#SQL[@1005,N56]Result[]
create table abnormal04 (col1 json, col2 enum('a', 'b'));

#SQL[@1006,N61]Result[]
insert into abnormal04 values (('{"x": 17, "x": "red"}'),'a');

#SQL[@1007,N78]Result[]
insert into abnormal04 values (('{"x": 17, "x": "red", "x": [3, 5, 7]}'), 'b');

#SQL[@1008,N24]Result[14, 19, 23]
select * from abnormal04;
col1  ¦  col2
{"x": "red"}  ¦  a
{"x": [3, 5, 7]}  ¦  b

#SQL[@1009,N51]Error[75]
alter table abnormal04 change col1 col1NewCOl float;
not supported: currently unsupport change from original type JSON to FLOAT 

#SQL[@1010,N49]Error[41]
alter table abnormal04 change col2 col2NewCOL int;
invalid argument cast to int, bad value a

#SQL[@1011,N24]Result[14, 19, 23]
select * from abnormal04;
col1  ¦  col2
{"x": "red"}  ¦  a
{"x": [3, 5, 7]}  ¦  b

#SQL[@1012,N28]Result[23, 109]
show create table abnormal04;
Table  ¦  Create Table
abnormal04  ¦  CREATE TABLE `abnormal04` (
  `col1` json DEFAULT NULL,
  `col2` enum('a','b') DEFAULT NULL
)

#SQL[@1013,N152]Result[59, 39, 39]
select table_name,COLUMN_NAME, data_type,is_nullable from information_schema.columns where table_name like 'abnormal04' and COLUMN_NAME not like '__mo%';
table_name  ¦  COLUMN_NAME  ¦  data_type  ¦  is_nullable
abnormal04  ¦  col1  ¦  JSON  ¦  YES
abnormal04  ¦  col2  ¦  ENUM  ¦  YES

#SQL[@1014,N21]Result[]
drop table abnormal04;

#SQL[@1018,N31]Result[]
drop table if exists abnormal05;

#SQL[@1019,N60]Result[]
create temporary table abnormal05 (col1 datetime, col2 blob);

#SQL[@1020,N109]Result[]
insert into abnormal05 values ('1997-01-13 00:00:00', '342ewfyuehcdeiuopwu4jo3lekwdfhiu48woi3jrdnefrbwui34f');

#SQL[@1021,N112]Result[]
insert into abnormal05 values ('2012-01-13 23:23:59', '63298ufh3jcweuiv4h32jhf432ouy4hu3enjwfnwje4n3bj24f34573');

#SQL[@1022,N24]Result[14, 77, 80]
select * from abnormal05;
col1  ¦  col2
1997-01-13 00:00:00  ¦  342ewfyuehcdeiuopwu4jo3lekwdfhiu48woi3jrdnefrbwui34f
2012-01-13 23:23:59  ¦  63298ufh3jcweuiv4h32jhf432ouy4hu3enjwfnwje4n3bj24f34573

#SQL[@1023,N53]Error[54]
alter table abnormal05 change col1 col1_euwhnew float;
alter table for temporary table is not yet implemented

#SQL[@1024,N51]Error[54]
alter table abnormal05 change col2 col2_njkwhew int;
alter table for temporary table is not yet implemented

#SQL[@1025,N24]Result[14, 77, 80]
select * from abnormal05;
col1  ¦  col2
1997-01-13 00:00:00  ¦  342ewfyuehcdeiuopwu4jo3lekwdfhiu48woi3jrdnefrbwui34f
2012-01-13 23:23:59  ¦  63298ufh3jcweuiv4h32jhf432ouy4hu3enjwfnwje4n3bj24f34573

#SQL[@1026,N28]Result[23, 104]
show create table abnormal05;
Table  ¦  Create Table
abnormal05  ¦  CREATE TABLE `abnormal05` (
  `col1` datetime DEFAULT NULL,
  `col2` blob DEFAULT NULL
)

#SQL[@1027,N152]Result[]
select table_name,COLUMN_NAME, data_type,is_nullable from information_schema.columns where table_name like 'abnormal05' and COLUMN_NAME not like '__mo%';

#SQL[@1028,N21]Result[]
drop table abnormal05;

#SQL[@1032,N27]Result[]
drop table if exists view01;

#SQL[@1033,N27]Result[]
drop table if exists view02;

#SQL[@1034,N12]Error[21]
drop view v0;
invalid view 'db2.v0'

#SQL[@1035,N27]Result[]
create table view01 (a int);

#SQL[@1036,N33]Result[]
insert into view01 values (1),(2);

#SQL[@1037,N27]Result[]
create table view02 (a int);

#SQL[@1038,N29]Result[]
insert into view02 values (1);

#SQL[@1039,N86]Result[]
create view v0 as select view01.a, view02.a as b from view01 left join view02 using(a);

#SQL[@1040,N19]Result[73, 131]
show create view v0;
View  ¦  Create View  ¦  character_set_client  ¦  collation_connection
v0  ¦  create view v0 as select view01.a, view02.a as b from view01 left join view02 using(a)  ¦  utf8mb4  ¦  utf8mb4_general_ci

#SQL[@1041,N38]Result[]
alter table view01 change a aCOL float;

#SQL[@1042,N24]Result[23, 65]
show create table view01;
Table  ¦  Create Table
view01  ¦  CREATE TABLE `view01` (
  `aCOL` float DEFAULT NULL
)

#SQL[@1043,N19]Result[73, 131]
show create view v0;
View  ¦  Create View  ¦  character_set_client  ¦  collation_connection
v0  ¦  create view v0 as select view01.a, view02.a as b from view01 left join view02 using(a)  ¦  utf8mb4  ¦  utf8mb4_general_ci

#SQL[@1044,N17]Result[]
drop table view01;

#SQL[@1045,N17]Result[]
drop table view02;

#SQL[@1046,N12]Result[]
drop view v0;

#SQL[@1050,N30]Result[]
drop table if exists cluster01;

#SQL[@1051,N62]Result[]
create table cluster01(col1 int, col2 decimal) cluster by col1;

#SQL[@1052,N43]Result[]
insert into cluster01 values (1, 389234924);

#SQL[@1053,N42]Result[]
insert into cluster01 values (2, -2893428);

#SQL[@1054,N61]Result[]
alter table cluster01 change col2 col2worejnfenrororiri float;

#SQL[@1055,N89]Result[]
alter table cluster01 change col1 iwijwehfndatabasectm double after col2worejnfenrororiri;

#SQL[@1056,N27]Result[23, 170]
show create table cluster01;
Table  ¦  Create Table
cluster01  ¦  CREATE TABLE `cluster01` (
  `col2worejnfenrororiri` float DEFAULT NULL,
  `iwijwehfndatabasectm` double DEFAULT NULL
) CLUSTER BY (`iwijwehfndatabasectm`)

#SQL[@1057,N23]Result[47, 16, 15]
select * from cluster01;
col2worejnfenrororiri  ¦  iwijwehfndatabasectm
389234900  ¦  1
-2893428  ¦  2

#SQL[@1058,N151]Result[59, 56, 56]
select table_name,COLUMN_NAME, data_type,is_nullable from information_schema.columns where table_name like 'cluster01' and COLUMN_NAME not like '__mo%';
table_name  ¦  COLUMN_NAME  ¦  data_type  ¦  is_nullable
cluster01  ¦  col2worejnfenrororiri  ¦  FLOAT  ¦  YES
cluster01  ¦  iwijwehfndatabasectm  ¦  DOUBLE  ¦  YES

#SQL[@1059,N20]Result[]
drop table cluster01;

#SQL[@1063,N27]Result[]
drop table if exists time01;

#SQL[@1064,N73]Result[]
create table time01 (col1 date, col2 datetime, col3 timestamp, col4 time);

#SQL[@1065,N105]Result[]
insert into time01 values ('2020-01-01', '2000-10-10 12:12:12', '1970-01-01 12:23:59.323000', '01:01:29');

#SQL[@1066,N88]Result[]
insert into time01 values ('1997-01-13', null, '1989-01-01 23:23:59.100000', '23:23:59');

#SQL[@1067,N130]Result[]
insert into time01 (col1, col2, col3, col4) values ('2030-12-31', '2031-09-09 01:01:01', '2013-12-12 10:10:10.125000', '10:12:12');

#SQL[@1068,N20]Result[34, 74, 59, 74]
select * from time01;
col1  ¦  col2  ¦  col3  ¦  col4
2020-01-01  ¦  2000-10-10 12:12:12  ¦  1970-01-01 12:23:59  ¦  01:01:29
1997-01-13  ¦  null  ¦  1989-01-01 23:23:59  ¦  23:23:59
2030-12-31  ¦  2031-09-09 01:01:01  ¦  2013-12-12 10:10:10  ¦  10:12:12

#SQL[@1069,N174]Error[38]
alter table time01 change col1 col1sbavhehfiwuejn int, change col2 col2chwjvhejkwbhjgeh int first, change col3 col3cvwheuhjhjk int after col1, change col4 col4ushebjfevce int;
Unknown column 'col1' in 'Columns Set'

#SQL[@1070,N24]Result[23, 162]
show create table time01;
Table  ¦  Create Table
time01  ¦  CREATE TABLE `time01` (
  `col1` date DEFAULT NULL,
  `col2` datetime DEFAULT NULL,
  `col3` timestamp NULL DEFAULT NULL,
  `col4` time DEFAULT NULL
)

#SQL[@1071,N20]Result[34, 74, 59, 74]
select * from time01;
col1  ¦  col2  ¦  col3  ¦  col4
2020-01-01  ¦  2000-10-10 12:12:12  ¦  1970-01-01 12:23:59  ¦  01:01:29
1997-01-13  ¦  null  ¦  1989-01-01 23:23:59  ¦  23:23:59
2030-12-31  ¦  2031-09-09 01:01:01  ¦  2013-12-12 10:10:10  ¦  10:12:12

#SQL[@1072,N148]Result[59, 35, 39, 40, 35]
select table_name,COLUMN_NAME, data_type,is_nullable from information_schema.columns where table_name like 'time01' and COLUMN_NAME not like '__mo%';
table_name  ¦  COLUMN_NAME  ¦  data_type  ¦  is_nullable
time01  ¦  col1  ¦  DATE  ¦  YES
time01  ¦  col2  ¦  DATETIME  ¦  YES
time01  ¦  col3  ¦  TIMESTAMP  ¦  YES
time01  ¦  col4  ¦  TIME  ¦  YES

#SQL[@1073,N17]Result[]
drop table time01;

#SQL[@1077,N27]Result[]
drop table if exists time02;

#SQL[@1078,N62]Result[]
create table time02 (col2 datetime, col3 timestamp, col4 time);

#SQL[@1079,N91]Result[]
insert into time02 values ('2000-10-10 12:12:12', '1970-01-01 12:23:59.323000', '01:01:29');

#SQL[@1080,N75]Result[]
insert into time02 values ( null, '1889-01-01 23:23:59.125000', '23:23:59');

#SQL[@1081,N110]Result[]
insert into time02 (col2, col3, col4) values ('2031-09-09 01:01:01', '2013-12-12 10:10:10.125000', '10:12:12');

#SQL[@1082,N20]Result[24, 58, 43, 58]
select * from time02;
col2  ¦  col3  ¦  col4
2000-10-10 12:12:12  ¦  1970-01-01 12:23:59  ¦  01:01:29
null  ¦  1889-01-01 23:23:59  ¦  23:23:59
2031-09-09 01:01:01  ¦  2013-12-12 10:10:10  ¦  10:12:12

#SQL[@1083,N110]Error[267]
alter table time02 change col2 decimal(20,10) first, change col3 decimal after col2, change col4 decimal(38,0);
SQL parser error: You have an error in your SQL syntax; check the manual that corresponds to your MatrixOne server version for the right syntax to use. syntax error at line 1 column 39 near \"(20,10) first, change col3 decimal after col2, change col4 decimal(38,0)\";

#SQL[@1084,N24]Result[23, 134]
show create table time02;
Table  ¦  Create Table
time02  ¦  CREATE TABLE `time02` (
  `col2` datetime DEFAULT NULL,
  `col3` timestamp NULL DEFAULT NULL,
  `col4` time DEFAULT NULL
)

#SQL[@1085,N20]Result[24, 58, 43, 58]
select * from time02;
col2  ¦  col3  ¦  col4
2000-10-10 12:12:12  ¦  1970-01-01 12:23:59  ¦  01:01:29
null  ¦  1889-01-01 23:23:59  ¦  23:23:59
2031-09-09 01:01:01  ¦  2013-12-12 10:10:10  ¦  10:12:12

#SQL[@1086,N148]Result[59, 39, 40, 35]
select table_name,COLUMN_NAME, data_type,is_nullable from information_schema.columns where table_name like 'time02' and COLUMN_NAME not like '__mo%';
table_name  ¦  COLUMN_NAME  ¦  data_type  ¦  is_nullable
time02  ¦  col2  ¦  DATETIME  ¦  YES
time02  ¦  col3  ¦  TIMESTAMP  ¦  YES
time02  ¦  col4  ¦  TIME  ¦  YES

#SQL[@1087,N17]Result[]
drop table time02;

#SQL[@1091,N30]Result[]
drop table if exists prepare01;

#SQL[@1092,N43]Result[]
create table prepare01(col1 int, col2 char);

#SQL[@1093,N52]Result[]
insert into prepare01 values (1,'a'),(2,'b'),(3,'c');

#SQL[@1094,N86]Result[]
prepare s1 from 'alter table prepare01 change col1 col1dheuwhvcer decimal primary key';

#SQL[@1095,N10]Result[]
execute s1;

#SQL[@1096,N27]Result[23, 150]
show create table prepare01;
Table  ¦  Create Table
prepare01  ¦  CREATE TABLE `prepare01` (
  `col1dheuwhvcer` decimal(38,0) NOT NULL,
  `col2` char(1) DEFAULT NULL,
  PRIMARY KEY (`col1dheuwhvcer`)
)

#SQL[@1097,N84]Result[]
prepare s2 from 'alter table prepare01 change col2 col2chuwhe varchar(100) not null';

#SQL[@1098,N10]Result[]
execute s2;

#SQL[@1099,N27]Result[23, 157]
show create table prepare01;
Table  ¦  Create Table
prepare01  ¦  CREATE TABLE `prepare01` (
  `col1dheuwhvcer` decimal(38,0) NOT NULL,
  `col2chuwhe` varchar(100) NOT NULL,
  PRIMARY KEY (`col1dheuwhvcer`)
)

#SQL[@1100,N20]Result[]
drop table prepare01;

#SQL[@1104,N27]Result[]
drop role if exists role_r1;

#SQL[@1105,N27]Result[]
drop user if exists role_u1;

#SQL[@1106,N27]Result[]
drop table if exists test01;

#SQL[@1107,N19]Result[]
create role role_r1;

#SQL[@1108,N60]Result[]
create user role_u1 identified by '111' default role role_r1;

#SQL[@1109,N29]Result[]
create table test01(col1 int);

#SQL[@1110,N28]Result[]
insert into test01 values(1);

#SQL[@1111,N28]Result[]
insert into test01 values(2);

#SQL[@1112,N45]Result[]
grant create database on account * to role_r1;

#SQL[@1113,N44]Result[]
grant show databases on account * to role_r1;

#SQL[@1114,N37]Result[]
grant connect on account * to role_r1;

#SQL[@1115,N34]Result[]
grant select on table * to role_r1;

#SQL[@1116,N42]Result[]
grant show tables on database * to role_r1;

#SQL[@1118,N29]Result[]
use alter_table_change_column;

#SQL[@1119,N54]Error[62]
alter table test01 change col1 col1New int primary key;
internal error: do not have privilege to execute the statement

#SQL[@1121,N42]Result[]
grant alter table on database * to role_r1;

#SQL[@1123,N29]Result[]
use alter_table_change_column;

#SQL[@1124,N46]Error[207]
alter table test01 change col1 int primary key;
SQL parser error: You have an error in your SQL syntax; check the manual that corresponds to your MatrixOne server version for the right syntax to use. syntax error at line 1 column 42 near \" primary key\";

#SQL[@1125,N24]Error[46]
show create table test01;
no such table alter_table_change_column.test01

#SQL[@1127,N24]Result[23, 63]
show create table test01;
Table  ¦  Create Table
test01  ¦  CREATE TABLE `test01` (
  `col1` int DEFAULT NULL
)

#SQL[@1128,N17]Result[]
drop table test01;

#SQL[@1129,N17]Result[]
drop role role_r1;

#SQL[@1130,N17]Result[]
drop user role_u1;

#SQL[@1134,N26]Result[]
drop table if exists mix01;

#SQL[@1135,N83]Result[]
create table mix01 (col1 int not null , col2 decimal, col3 date, col4 varchar(100));

#SQL[@1136,N121]Result[]
insert into mix01 values (1, 23849234.324, '2100-01-01', 'qy83uhfbh234y78y&*%^&%$$$E%^&Y*UIJNHBGVFTY^&Y*UJHBGVTF^&*U(OK');

#SQL[@1137,N117]Result[]
insert into mix01 values (2, 773892.32748000000000, '1997-01-13', '38782yhbf3uhy4iendb32gefdc7y834uh2neujdr2h4f3v43');

#SQL[@1138,N56]Result[]
insert into mix01 values (3, -82913942.3434, null, null);

#SQL[@1139,N19]Result[34, 98, 83, 36]
select * from mix01;
col1  ¦  col2  ¦  col3  ¦  col4
1  ¦  23849234  ¦  2100-01-01  ¦  qy83uhfbh234y78y&*%^&%$$$E%^&Y*UIJNHBGVFTY^&Y*UJHBGVTF^&*U(OK
2  ¦  773892  ¦  1997-01-13  ¦  38782yhbf3uhy4iendb32gefdc7y834uh2neujdr2h4f3v43
3  ¦  -82913942  ¦  null  ¦  null

#SQL[@1140,N53]Result[]
alter table mix01 add column col1_2 binary after col1;

#SQL[@1141,N23]Result[23, 193]
show create table mix01;
Table  ¦  Create Table
mix01  ¦  CREATE TABLE `mix01` (
  `col1` int NOT NULL,
  `col1_2` binary(1) DEFAULT NULL,
  `col2` decimal(38,0) DEFAULT NULL,
  `col3` date DEFAULT NULL,
  `col4` varchar(100) DEFAULT NULL
)

#SQL[@1142,N147]Result[59, 32, 38, 37, 34, 37]
select table_name,COLUMN_NAME, data_type,is_nullable from information_schema.columns where table_name like 'mix01' and COLUMN_NAME not like '__mo%';
table_name  ¦  COLUMN_NAME  ¦  data_type  ¦  is_nullable
mix01  ¦  col1  ¦  INT  ¦  NO
mix01  ¦  col1_2  ¦  BINARY  ¦  YES
mix01  ¦  col2  ¦  DECIMAL  ¦  YES
mix01  ¦  col3  ¦  DATE  ¦  YES
mix01  ¦  col4  ¦  VARCHAR  ¦  YES

#SQL[@1143,N68]Result[]
alter table mix01 change column col1_2 col1_2New varbinary(10) first;

#SQL[@1144,N23]Result[23, 200]
show create table mix01;
Table  ¦  Create Table
mix01  ¦  CREATE TABLE `mix01` (
  `col1_2New` varbinary(10) DEFAULT NULL,
  `col1` int NOT NULL,
  `col2` decimal(38,0) DEFAULT NULL,
  `col3` date DEFAULT NULL,
  `col4` varchar(100) DEFAULT NULL
)

#SQL[@1145,N147]Result[59, 32, 44, 37, 34, 37]
select table_name,COLUMN_NAME, data_type,is_nullable from information_schema.columns where table_name like 'mix01' and COLUMN_NAME not like '__mo%';
table_name  ¦  COLUMN_NAME  ¦  data_type  ¦  is_nullable
mix01  ¦  col1  ¦  INT  ¦  NO
mix01  ¦  col1_2New  ¦  VARBINARY  ¦  YES
mix01  ¦  col2  ¦  DECIMAL  ¦  YES
mix01  ¦  col3  ¦  DATE  ¦  YES
mix01  ¦  col4  ¦  VARCHAR  ¦  YES

#SQL[@1146,N20]Result[]
truncate table mix01;

#SQL[@1147,N37]Result[]
alter table mix01 add column col5 int;

#SQL[@1148,N23]Result[23, 227]
show create table mix01;
Table  ¦  Create Table
mix01  ¦  CREATE TABLE `mix01` (
  `col1_2New` varbinary(10) DEFAULT NULL,
  `col1` int NOT NULL,
  `col2` decimal(38,0) DEFAULT NULL,
  `col3` date DEFAULT NULL,
  `col4` varchar(100) DEFAULT NULL,
  `col5` int DEFAULT NULL
)

#SQL[@1149,N147]Result[59, 32, 44, 37, 34, 37, 33]
select table_name,COLUMN_NAME, data_type,is_nullable from information_schema.columns where table_name like 'mix01' and COLUMN_NAME not like '__mo%';
table_name  ¦  COLUMN_NAME  ¦  data_type  ¦  is_nullable
mix01  ¦  col1  ¦  INT  ¦  NO
mix01  ¦  col1_2New  ¦  VARBINARY  ¦  YES
mix01  ¦  col2  ¦  DECIMAL  ¦  YES
mix01  ¦  col3  ¦  DATE  ¦  YES
mix01  ¦  col4  ¦  VARCHAR  ¦  YES
mix01  ¦  col5  ¦  INT  ¦  YES

#SQL[@1150,N16]Result[]
drop table mix01;

#SQL[@1153,N28]Result[]
drop table if exists table01;

#SQL[@1154,N5]Result[]
begin;

#SQL[@1155,N44]Result[]
create table table01(col1 int, col2 decimal);

#SQL[@1156,N35]Result[]
insert into table01 values(100,200);

#SQL[@1157,N52]Result[]
alter table table01 change column col1 NewCol1 float;

#SQL[@1158,N6]Result[]
commit;

#SQL[@1159,N21]Result[17, 12]
select * from table01;
newcol1  ¦  col2
100  ¦  200

#SQL[@1160,N27]Result[7, 3]
select newcol1 from table01;
newcol1
100

#SQL[@1161,N18]Result[]
drop table table01;

#SQL[@1164,N23]Result[]
drop table if exists t1;

#SQL[@1165,N33]Result[]
create table t1(name varchar(25));

#SQL[@1166,N39]Result[]
insert into t1 values ('A'),('B'),('C');

#SQL[@1167,N16]Result[4, 1, 1, 1]
select * from t1;
name
A
B
C

#SQL[@1168,N47]Error[73]
alter table t1 modify column name enum('A','B');
internal error: convert to MySQL enum failed: item C is not in enum [A B]

#SQL[@1169,N51]Result[]
alter table t1 modify column name enum('A','B','C');

#SQL[@1170,N75]Result[]
alter table t1 modify column name enum('A','B','C','D'), add column age int;

#SQL[@1171,N16]Result[13, 11, 11, 11]
select * from t1;
name  ¦  age
A  ¦  null
B  ¦  null
C  ¦  null

#SQL[@1172,N30]Result[]
insert into t1 values('D', 29);

#SQL[@1173,N20]Result[23, 99]
show create table t1;
Table  ¦  Create Table
t1  ¦  CREATE TABLE `t1` (
  `name` enum('A','B','C','D') DEFAULT NULL,
  `age` int DEFAULT NULL
)

#SQL[@1174,N7]Result[71, 68, 53]
desc t1;
Field  ¦  Type  ¦  Null  ¦  Key  ¦  Default  ¦  Extra  ¦  Comment
name  ¦  ENUM('A','B','C','D')  ¦  YES  ¦    ¦  null  ¦    ¦  
age  ¦  INT(32)  ¦  YES  ¦    ¦  null  ¦    ¦  

#SQL[@1175,N13]Result[]
drop table t1;

#SQL[@1177,N25]Result[]
drop table if exists tb_3;

#SQL[@1178,N131]Result[]
create table tb_3 (c1 varchar(25) not null, c2 varchar(25) not null, c3 varchar(25) not null, c4 int , primary key pk1(c1, c2, c3));

#SQL[@1179,N9]Result[71, 58, 58, 58, 52]
desc tb_3;
Field  ¦  Type  ¦  Null  ¦  Key  ¦  Default  ¦  Extra  ¦  Comment
c1  ¦  VARCHAR(25)  ¦  NO  ¦  PRI  ¦  null  ¦    ¦  
c2  ¦  VARCHAR(25)  ¦  NO  ¦  PRI  ¦  null  ¦    ¦  
c3  ¦  VARCHAR(25)  ¦  NO  ¦  PRI  ¦  null  ¦    ¦  
c4  ¦  INT(32)  ¦  YES  ¦    ¦  null  ¦    ¦  

#SQL[@1181,N47]Result[]
alter table tb_3 modify c1 VARCHAR(30) not null;

#SQL[@1182,N9]Result[71, 58, 58, 58, 52]
desc tb_3;
Field  ¦  Type  ¦  Null  ¦  Key  ¦  Default  ¦  Extra  ¦  Comment
c1  ¦  VARCHAR(30)  ¦  NO  ¦  PRI  ¦  null  ¦    ¦  
c2  ¦  VARCHAR(25)  ¦  NO  ¦  PRI  ¦  null  ¦    ¦  
c3  ¦  VARCHAR(25)  ¦  NO  ¦  PRI  ¦  null  ¦    ¦  
c4  ¦  INT(32)  ¦  YES  ¦    ¦  null  ¦    ¦  

#SQL[@1184,N38]Result[]
alter table tb_3 modify c1 VARCHAR(30);

#SQL[@1185,N9]Result[71, 58, 58, 58, 52]
desc tb_3;
Field  ¦  Type  ¦  Null  ¦  Key  ¦  Default  ¦  Extra  ¦  Comment
c1  ¦  VARCHAR(30)  ¦  NO  ¦  PRI  ¦  null  ¦    ¦  
c2  ¦  VARCHAR(25)  ¦  NO  ¦  PRI  ¦  null  ¦    ¦  
c3  ¦  VARCHAR(25)  ¦  NO  ¦  PRI  ¦  null  ¦    ¦  
c4  ¦  INT(32)  ¦  YES  ¦    ¦  null  ¦    ¦  

#SQL[@1187,N38]Result[]
alter table tb_3 modify c1 VARCHAR(40);

#SQL[@1188,N9]Result[71, 58, 58, 58, 52]
desc tb_3;
Field  ¦  Type  ¦  Null  ¦  Key  ¦  Default  ¦  Extra  ¦  Comment
c1  ¦  VARCHAR(40)  ¦  NO  ¦  PRI  ¦  null  ¦    ¦  
c2  ¦  VARCHAR(25)  ¦  NO  ¦  PRI  ¦  null  ¦    ¦  
c3  ¦  VARCHAR(25)  ¦  NO  ¦  PRI  ¦  null  ¦    ¦  
c4  ¦  INT(32)  ¦  YES  ¦    ¦  null  ¦    ¦  

#SQL[@1190,N38]Result[]
alter table tb_3 modify c4 VARCHAR(40);

#SQL[@1191,N9]Result[71, 58, 58, 58, 56]
desc tb_3;
Field  ¦  Type  ¦  Null  ¦  Key  ¦  Default  ¦  Extra  ¦  Comment
c1  ¦  VARCHAR(40)  ¦  NO  ¦  PRI  ¦  null  ¦    ¦  
c2  ¦  VARCHAR(25)  ¦  NO  ¦  PRI  ¦  null  ¦    ¦  
c3  ¦  VARCHAR(25)  ¦  NO  ¦  PRI  ¦  null  ¦    ¦  
c4  ¦  VARCHAR(40)  ¦  YES  ¦    ¦  null  ¦    ¦  

#SQL[@1193,N47]Result[]
alter table tb_3 modify c4 VARCHAR(40) NOT null;

#SQL[@1194,N9]Result[71, 58, 58, 58, 55]
desc tb_3;
Field  ¦  Type  ¦  Null  ¦  Key  ¦  Default  ¦  Extra  ¦  Comment
c1  ¦  VARCHAR(40)  ¦  NO  ¦  PRI  ¦  null  ¦    ¦  
c2  ¦  VARCHAR(25)  ¦  NO  ¦  PRI  ¦  null  ¦    ¦  
c3  ¦  VARCHAR(25)  ¦  NO  ¦  PRI  ¦  null  ¦    ¦  
c4  ¦  VARCHAR(40)  ¦  NO  ¦    ¦  null  ¦    ¦  

#SQL[@1195,N15]Result[]
drop table tb_3;

#SQL[@1197,N17]Result[]
drop database db2;

