#SQL[@3,N23]Result[]
drop table if exists t1;

#SQL[@4,N72]Result[]
create table t1(a varchar(30), b varchar(30), c varchar(30) primary key);

#SQL[@5,N45]Result[]
insert into t1 values("Congress","Lane", "1");

#SQL[@6,N43]Result[]
insert into t1 values("Juniper","Way", "2");

#SQL[@7,N48]Result[]
insert into t1 values("Nightingale","Lane", "3");

#SQL[@8,N16]Result[15, 25, 23, 28]
select * from t1;
a  ¦  b  ¦  c
Congress  ¦  Lane  ¦  1
Juniper  ¦  Way  ¦  2
Nightingale  ¦  Lane  ¦  3

#SQL[@9,N41]Result[]
create index idx1 using master on t1(a,b);

#SQL[@10,N48]Result[]
insert into t1 values("Changing","Expanse", "4");

#SQL[@11,N42]Result[]
update t1 set a = "Altering" where c = "4";

#SQL[@12,N28]Result[]
delete from t1 where c = "2";

#SQL[@13,N50]Result[15, 25]
select * from t1 where a = "Congress" and b="Lane";
a  ¦  b  ¦  c
Congress  ¦  Lane  ¦  1

#SQL[@16,N67]Result[]
create table t2(a varchar(30), b bigint, c varchar(30) primary key);

#SQL[@17,N40]Result[]
insert into t2 values("Congress",1, "1");

#SQL[@18,N39]Result[]
insert into t2 values("Juniper",2, "2");

#SQL[@19,N43]Result[]
insert into t2 values("Nightingale",3, "3");

#SQL[@20,N41]Error[46]
create index idx2 using master on t2(a,b);
not supported: column 'b' is not varchar type.

#SQL[@23,N23]Result[]
drop table if exists t1;

#SQL[@24,N72]Result[]
create table t1(a varchar(30), b varchar(30), c varchar(30) primary key);

#SQL[@25,N45]Result[]
insert into t1 values("Congress","Lane", "1");

#SQL[@26,N43]Result[]
insert into t1 values("Juniper","Way", "2");

#SQL[@27,N48]Result[]
insert into t1 values("Nightingale","Lane", "3");

#SQL[@28,N41]Result[]
create index idx1 using master on t1(a,b);

#SQL[@29,N44]Result[]
insert into t1 values("Alberta","Blvd", "4");

#SQL[@30,N49]Result[15, 24]
select * from t1 where a = "Alberta" and b="Blvd";
a  ¦  b  ¦  c
Alberta  ¦  Blvd  ¦  4

#SQL[@34,N48]Result[]
insert into t1 values("Nightingale","Lane", "5");

#SQL[@35,N53]Result[15, 28, 28]
select * from t1 where a = "Nightingale" and b="Lane";
a  ¦  b  ¦  c
Nightingale  ¦  Lane  ¦  3
Nightingale  ¦  Lane  ¦  5

#SQL[@38,N39]Result[]
insert into t1 values(NULL,"Lane", "6");

#SQL[@39,N31]Result[15, 25, 28, 28, 21]
select * from t1 where b="Lane";
a  ¦  b  ¦  c
Congress  ¦  Lane  ¦  1
Nightingale  ¦  Lane  ¦  3
Nightingale  ¦  Lane  ¦  5
null  ¦  Lane  ¦  6

#SQL[@42,N23]Result[]
drop table if exists t2;

#SQL[@43,N60]Result[]
create table t2(a varchar(30), b varchar(30), c varchar(30));

#SQL[@44,N41]Result[]
insert into t2 values("arjun", "sk", "7");

#SQL[@45,N43]Result[]
insert into t2 values("albin", "john", "8");

#SQL[@46,N31]Result[]
insert into t1 select * from t2;

#SQL[@47,N31]Result[15, 25, 28, 28, 21]
select * from t1 where b="Lane";
a  ¦  b  ¦  c
Congress  ¦  Lane  ¦  1
Nightingale  ¦  Lane  ¦  3
Nightingale  ¦  Lane  ¦  5
null  ¦  Lane  ¦  6

#SQL[@50,N45]Result[]
update t1 set a="albin" ,b="john" where c="7";

#SQL[@51,N32]Result[15, 22, 22]
select * from t1 where a="albin";
a  ¦  b  ¦  c
albin  ¦  john  ¦  7
albin  ¦  john  ¦  8

#SQL[@54,N42]Result[]
update t1 set a=NULL ,b="john" where c="7";

#SQL[@55,N31]Result[15, 21, 22]
select * from t1 where b="john";
a  ¦  b  ¦  c
null  ¦  john  ¦  7
albin  ¦  john  ¦  8

#SQL[@58,N26]Result[]
delete from t1 where c="7";

#SQL[@59,N31]Result[]
select * from t1 where a="john";

#SQL[@62,N17]Result[]
truncate table t1;

#SQL[@63,N16]Result[]
select * from t1;

#SQL[@66,N18]Result[233, 122, 122, 116]
show index from t1;
Table  ¦  Non_unique  ¦  Key_name  ¦  Seq_in_index  ¦  Column_name  ¦  Collation  ¦  Cardinality  ¦  Sub_part  ¦  Packed  ¦  Null  ¦  Index_type  ¦  Comment  ¦  Index_comment  ¦  Index_params  ¦  Visible  ¦  Expression
t1  ¦  1  ¦  idx1  ¦  1  ¦  a  ¦  A  ¦  0  ¦  NULL  ¦  NULL  ¦  YES  ¦  master  ¦    ¦    ¦    ¦  YES  ¦  a
t1  ¦  1  ¦  idx1  ¦  2  ¦  b  ¦  A  ¦  0  ¦  NULL  ¦  NULL  ¦  YES  ¦  master  ¦    ¦    ¦    ¦  YES  ¦  b
t1  ¦  0  ¦  PRIMARY  ¦  1  ¦  c  ¦  A  ¦  0  ¦  NULL  ¦  NULL  ¦    ¦    ¦    ¦    ¦    ¦  YES  ¦  c

#SQL[@67,N20]Result[23, 178]
show create table t1;
Table  ¦  Create Table
t1  ¦  CREATE TABLE `t1` (
  `a` varchar(30) DEFAULT NULL,
  `b` varchar(30) DEFAULT NULL,
  `c` varchar(30) NOT NULL,
  PRIMARY KEY (`c`),
  KEY `idx1` USING master (`a`,`b`)
)

#SQL[@68,N78]Result[31, 25, 25]
select name, type, column_name from mo_catalog.mo_indexes mi where name="idx1";
name  ¦  type  ¦  column_name
idx1  ¦  MULTIPLE  ¦  a
idx1  ¦  MULTIPLE  ¦  b

#SQL[@69,N13]Result[]
drop table t1;

#SQL[@70,N18]Error[39]
show index from t1;
no such table secondary_index_master.t1

#SQL[@71,N20]Error[39]
show create table t1;
no such table secondary_index_master.t1

#SQL[@72,N78]Result[]
select name, type, column_name from mo_catalog.mo_indexes mi where name="idx1";

#SQL[@75,N23]Result[]
drop table if exists t1;

#SQL[@76,N72]Result[]
create table t1(a varchar(30), b varchar(30), c varchar(30) primary key);

#SQL[@77,N45]Result[]
insert into t1 values("Congress","Lane", "1");

#SQL[@78,N43]Result[]
insert into t1 values("Juniper","Way", "2");

#SQL[@79,N48]Result[]
insert into t1 values("Nightingale","Lane", "3");

#SQL[@80,N39]Result[]
create index idx1 using master on t1(a);

#SQL[@81,N38]Result[]
insert into t1 values("Abi","Ma", "4");

#SQL[@82,N32]Result[15, 18]
select * from t1 where a = "Abi";
a  ¦  b  ¦  c
Abi  ¦  Ma  ¦  4

#SQL[@85,N23]Result[]
drop table if exists t1;

#SQL[@86,N72]Result[]
create table t1(a varchar(30), b varchar(30), c varchar(30) primary key);

#SQL[@87,N45]Result[]
insert into t1 values("Congress","Lane", "1");

#SQL[@88,N43]Result[]
insert into t1 values("Juniper","Way", "2");

#SQL[@89,N48]Result[]
insert into t1 values("Nightingale","Lane", "3");

#SQL[@90,N43]Result[]
create index idx1 using master on t1(a,b,c);

#SQL[@91,N41]Result[]
insert into t1 values("Abel","John", "4");

#SQL[@92,N41]Result[]
insert into t1 values("Amy","Brian", "5");

#SQL[@93,N60]Result[15, 25]
select * from t1 where a = "Congress" and b="Lane" and c="1";
a  ¦  b  ¦  c
Congress  ¦  Lane  ¦  1

#SQL[@97,N23]Result[]
drop table if exists t1;

#SQL[@98,N72]Result[]
create table t1(a varchar(30), b varchar(30), c varchar(30) primary key);

#SQL[@99,N41]Result[]
create index idx1 using master on t1(a,b);

#SQL[@100,N45]Result[]
insert into t1 values("Congress","Lane", "1");

#SQL[@101,N43]Result[]
insert into t1 values("Juniper","Way", "2");

#SQL[@102,N48]Result[]
insert into t1 values("Nightingale","Lane", "3");

#SQL[@103,N50]Result[15, 25]
select * from t1 where a = "Congress" and b="Lane";
a  ¦  b  ¦  c
Congress  ¦  Lane  ¦  1

#SQL[@106,N23]Result[]
drop table if exists t1;

#SQL[@107,N103]Result[]
create table t1(a varchar(30), b varchar(30), c varchar(30) primary key, index idx1 using master (a,b));

#SQL[@108,N45]Result[]
insert into t1 values("Congress","Lane", "1");

#SQL[@109,N43]Result[]
insert into t1 values("Juniper","Way", "2");

#SQL[@110,N48]Result[]
insert into t1 values("Nightingale","Lane", "3");

#SQL[@111,N50]Result[15, 25]
select * from t1 where a = "Congress" and b="Lane";
a  ¦  b  ¦  c
Congress  ¦  Lane  ¦  1

#SQL[@114,N23]Result[]
drop table if exists t1;

#SQL[@115,N72]Result[]
create table t1(a varchar(30), b varchar(30), c varchar(30) primary key);

#SQL[@116,N45]Result[]
insert into t1 values("Congress","Lane", "1");

#SQL[@117,N43]Result[]
insert into t1 values("Juniper","Way", "2");

#SQL[@118,N48]Result[]
insert into t1 values("Nightingale","Lane", "3");

#SQL[@119,N47]Result[]
alter table t1 add index idx1 using master(a,b);

#SQL[@120,N45]Result[]
insert into t1 values("Congress","Lane", "4");

#SQL[@121,N50]Result[15, 25, 25]
select * from t1 where a = "Congress" and b="Lane";
a  ¦  b  ¦  c
Congress  ¦  Lane  ¦  1
Congress  ¦  Lane  ¦  4

#SQL[@124,N23]Result[]
drop table if exists t1;

#SQL[@125,N60]Result[]
create table t1(a varchar(30), b varchar(30), c varchar(30));

#SQL[@126,N41]Result[]
create index idx1 using master on t1(a,b);

#SQL[@127,N45]Result[]
insert into t1 values("Congress","Lane", "1");

#SQL[@128,N43]Result[]
insert into t1 values("Juniper","Way", "2");

#SQL[@129,N48]Result[]
insert into t1 values("Nightingale","Lane", "3");

#SQL[@130,N48]Result[15, 25]
select * from t1 where a="Congress" and b="Lane";
a  ¦  b  ¦  c
Congress  ¦  Lane  ¦  1

#SQL[@133,N23]Result[]
drop table if exists t1;

#SQL[@134,N78]Result[]
create table t1(a varchar(30), b varchar(30), c varchar(30), primary key(a,b));

#SQL[@135,N41]Result[]
create index idx1 using master on t1(a,b);

#SQL[@136,N45]Result[]
insert into t1 values("Congress","Lane", "1");

#SQL[@137,N43]Result[]
insert into t1 values("Juniper","Way", "2");

#SQL[@138,N48]Result[]
insert into t1 values("Nightingale","Lane", "3");

#SQL[@139,N48]Result[15, 25]
select * from t1 where a="Congress" and b="Lane";
a  ¦  b  ¦  c
Congress  ¦  Lane  ¦  1

#SQL[@142,N23]Result[]
drop table if exists t1;

#SQL[@143,N72]Result[]
create table t1(a varchar(30), b varchar(30), c varchar(30) primary key);

#SQL[@144,N41]Result[]
create index idx1 using master on t1(a,b);

#SQL[@145,N45]Result[]
insert into t1 values("Congress","Lane", "1");

#SQL[@146,N43]Result[]
insert into t1 values("Juniper","Way", "2");

#SQL[@147,N48]Result[]
insert into t1 values("Nightingale","Lane", "3");

#SQL[@148,N28]Result[]
alter table t1 drop column b;

#SQL[@149,N38]Result[]
insert into t1 values("Congress", "4");

#SQL[@150,N35]Result[8, 15, 15]
select * from t1 where a="Congress";
a  ¦  c
Congress  ¦  1
Congress  ¦  4

#SQL[@153,N23]Result[]
drop table if exists t1;

#SQL[@154,N72]Result[]
create table t1(a varchar(30), b varchar(30), c varchar(30) primary key);

#SQL[@155,N39]Result[]
create index idx1 using master on t1(a);

#SQL[@156,N45]Result[]
insert into t1 values("Congress","Lane", "1");

#SQL[@157,N43]Result[]
insert into t1 values("Juniper","Way", "2");

#SQL[@158,N48]Result[]
insert into t1 values("Nightingale","Lane", "3");

#SQL[@159,N36]Result[]
alter table t1 rename column a to a1;

#SQL[@160,N45]Result[]
insert into t1 values("Congress","Lane", "4");

#SQL[@161,N36]Result[16, 25, 25]
select * from t1 where a1="Congress";
a1  ¦  b  ¦  c
Congress  ¦  Lane  ¦  1
Congress  ¦  Lane  ¦  4

#SQL[@164,N23]Result[]
drop table if exists t1;

#SQL[@165,N72]Result[]
create table t1(a varchar(30), b varchar(30), c varchar(30) primary key);

#SQL[@166,N39]Result[]
create index idx1 using master on t1(a);

#SQL[@167,N45]Result[]
insert into t1 values("Congress","Lane", "1");

#SQL[@168,N43]Result[]
insert into t1 values("Juniper","Way", "2");

#SQL[@169,N48]Result[]
insert into t1 values("Nightingale","Lane", "3");

#SQL[@170,N34]Result[]
alter table t1 modify column c int;

#SQL[@171,N43]Result[]
insert into t1 values("Congress","Lane", 4);

#SQL[@172,N35]Result[15, 25, 25]
select * from t1 where a="Congress";
a  ¦  b  ¦  c
Congress  ¦  Lane  ¦  1
Congress  ¦  Lane  ¦  4

#SQL[@175,N23]Result[]
drop table if exists t1;

#SQL[@176,N72]Result[]
create table t1(a varchar(30), b varchar(30), c varchar(30) primary key);

#SQL[@177,N39]Result[]
create index idx1 using master on t1(a);

#SQL[@178,N45]Result[]
insert into t1 values("Congress","Lane", "1");

#SQL[@179,N43]Result[]
insert into t1 values("Juniper","Way", "2");

#SQL[@180,N48]Result[]
insert into t1 values("Nightingale","Lane", "3");

#SQL[@181,N31]Result[]
alter table t1 drop primary key;

#SQL[@182,N36]Result[]
alter table t1 add primary key (a,b);

#SQL[@183,N46]Result[]
insert into t1 values("Congress","Lane2", "4");

#SQL[@184,N35]Result[15, 25, 26]
select * from t1 where a="Congress";
a  ¦  b  ¦  c
Congress  ¦  Lane  ¦  1
Congress  ¦  Lane2  ¦  4

#SQL[@187,N23]Result[]
drop table if exists t1;

#SQL[@188,N72]Result[]
create table t1(a varchar(30), b varchar(30), c varchar(30) primary key);

#SQL[@189,N39]Result[]
create index idx1 using master on t1(a);

#SQL[@190,N45]Result[]
insert into t1 values("Congress","Lane", "4");

#SQL[@191,N43]Result[]
insert into t1 values("Juniper","Way", "5");

#SQL[@192,N48]Result[]
insert into t1 values("Nightingale","Lane", "6");

#SQL[@193,N31]Result[]
alter table t1 drop primary key;

#SQL[@194,N45]Result[]
insert into t1 values("Congress","Lane", "7");

#SQL[@195,N35]Result[15, 25, 25]
select * from t1 where a="Congress";
a  ¦  b  ¦  c
Congress  ¦  Lane  ¦  4
Congress  ¦  Lane  ¦  7

#SQL[@198,N23]Result[]
drop table if exists t1;

#SQL[@199,N67]Result[]
create table t1(a varchar(30), b bigint, c varchar(30) primary key);

#SQL[@200,N41]Error[46]
create index idx1 using master on t1(a,b);
not supported: column 'b' is not varchar type.

#SQL[@205,N23]Result[]
drop table if exists t1;

#SQL[@206,N60]Result[]
create table t1(a varchar(30), b varchar(30), c varchar(30));

#SQL[@207,N41]Result[]
create index idx1 using master on t1(a,b);

#SQL[@208,N45]Result[]
insert into t1 values("Congress","Lane", "1");

#SQL[@209,N43]Result[]
insert into t1 values("Juniper","Way", "2");

#SQL[@210,N48]Result[]
insert into t1 values("Nightingale","Lane", "3");

#SQL[@229,N48]Result[15, 25]
select * from t1 where a="Congress" and b="Lane";
a  ¦  b  ¦  c
Congress  ¦  Lane  ¦  1

#SQL[@232,N23]Result[]
drop table if exists t1;

#SQL[@233,N72]Result[]
create table t1(a varchar(30), b varchar(30), c varchar(30) primary key);

#SQL[@234,N41]Result[]
create index idx1 using master on t1(a,b);

#SQL[@235,N45]Result[]
insert into t1 values("Congress","Lane", "1");

#SQL[@236,N43]Result[]
insert into t1 values("Juniper","Way", "2");

#SQL[@237,N48]Result[]
insert into t1 values("Nightingale","Lane", "3");

#SQL[@256,N51]Result[15, 28]
select * from t1 where a="Nightingale" and b="Lane";
a  ¦  b  ¦  c
Nightingale  ¦  Lane  ¦  3

#SQL[@260,N23]Result[]
drop table if exists t1;

#SQL[@261,N112]Result[]
create table t1(a varchar(30), b0 varchar(30), b1 varchar(30), c varchar(30), d varchar(30), primary key( c, d));

#SQL[@262,N42]Result[]
create index idx1 using master on t1(a,b0);

#SQL[@263,N57]Result[]
insert into t1 values("Congress","Lane", "ALane","1","0");

#SQL[@264,N54]Result[]
insert into t1 values("Juniper","Way","AWay", "2","0");

#SQL[@265,N60]Result[]
insert into t1 values("Nightingale","Lane","ALane", "3","0");

#SQL[@284,N52]Result[31, 46]
select * from t1 where a="Nightingale" and b0="Lane";
a  ¦  b0  ¦  b1  ¦  c  ¦  d
Nightingale  ¦  Lane  ¦  ALane  ¦  3  ¦  0

#SQL[@287,N23]Result[]
drop table if exists t1;

#SQL[@288,N72]Result[]
create table t1(a varchar(30), b varchar(30), c varchar(30) primary key);

#SQL[@289,N41]Result[]
create index idx1 using master on t1(a,b);

#SQL[@290,N45]Result[]
insert into t1 values("Congress","Lane", "1");

#SQL[@291,N43]Result[]
insert into t1 values("Juniper","Way", "2");

#SQL[@292,N48]Result[]
insert into t1 values("Nightingale","Lane", "3");

#SQL[@306,N31]Result[15, 25, 28]
select * from t1 where b="Lane";
a  ¦  b  ¦  c
Congress  ¦  Lane  ¦  1
Nightingale  ¦  Lane  ¦  3

#SQL[@327,N46]Result[15, 23]
select * from t1 where a="Juniper" and b="Way";
a  ¦  b  ¦  c
Juniper  ¦  Way  ¦  2

#SQL[@330,N23]Result[]
drop table if exists t1;

#SQL[@331,N60]Result[]
create table t1(a varchar(30), b varchar(30), c varchar(30));

#SQL[@332,N43]Result[]
create index idx1 using master on t1(a,b,c);

#SQL[@333,N45]Result[]
insert into t1 values("Congress","Lane", "1");

#SQL[@334,N43]Result[]
insert into t1 values("Juniper","Way", "2");

#SQL[@335,N48]Result[]
insert into t1 values("Nightingale","Lane", "3");

#SQL[@359,N58]Result[15, 25]
select * from t1 where a="Congress" and b="Lane" and c="1";
a  ¦  b  ¦  c
Congress  ¦  Lane  ¦  1

#SQL[@381,N64]Result[15, 28]
select * from t1 where a="Nightingale" and c between "2" and "3";
a  ¦  b  ¦  c
Nightingale  ¦  Lane  ¦  3

#SQL[@384,N23]Result[]
drop table if exists t1;

#SQL[@385,N60]Result[]
create table t1(a varchar(30), b varchar(30), c varchar(30));

#SQL[@386,N43]Result[]
create index idx1 using master on t1(a,b,c);

#SQL[@387,N45]Result[]
insert into t1 values("Congress","Lane", "1");

#SQL[@388,N43]Result[]
insert into t1 values("Juniper","Way", "2");

#SQL[@389,N48]Result[]
insert into t1 values("Nightingale","Lane", "3");

#SQL[@431,N89]Result[15, 25, 28]
select * from t1 where a in ("Congress","Nightingale") and b="Lane" and c in("1","2","3");
a  ¦  b  ¦  c
Congress  ¦  Lane  ¦  1
Nightingale  ¦  Lane  ¦  3

#SQL[@434,N23]Result[]
drop table if exists t1;

#SQL[@435,N60]Result[]
create table t1(a varchar(30), b varchar(30), c varchar(30));

#SQL[@436,N43]Result[]
create index idx1 using master on t1(a,b,c);

#SQL[@437,N45]Result[]
insert into t1 values("Congress","Lane", "1");

#SQL[@438,N43]Result[]
insert into t1 values("Juniper","Way", "2");

#SQL[@439,N48]Result[]
insert into t1 values("Nightingale","Lane", "3");

#SQL[@440,N100]Result[15, 25, 28]
select * from t1 where a between "Congress" and "Nightingale" and b="Lane" and c between "1" and "3";
a  ¦  b  ¦  c
Congress  ¦  Lane  ¦  1
Nightingale  ¦  Lane  ¦  3

#SQL[@441,N108]Result[15, 25]
select * from t1 where a between "Congress" and "Nightingale" and b="Lane" and c between "1" and "3" limit 1;
a  ¦  b  ¦  c
Congress  ¦  Lane  ¦  1

