#SQL[@1,N27]Result[]
drop database if exists db1;

#SQL[@2,N19]Result[]
create database db1;

#SQL[@3,N7]Result[]
use db1;

#SQL[@5,N23]Result[]
drop table if exists t1;

#SQL[@6,N51]Result[]
create table t1(a int, b int, c int, unique key(a));

#SQL[@7,N30]Result[]
insert into t1 values(1, 1, 1);

#SQL[@8,N30]Result[]
insert into t1 values(2, 2, 2);

#SQL[@9,N30]Result[]
insert into t1 values(3, 3, 3);

#SQL[@10,N30]Result[]
insert into t1 values(4, 4, 4);

#SQL[@11,N33]Result[]
insert into t1 values(NULL, 5, 5);

#SQL[@12,N16]Result[15, 15, 15, 15, 15, 18]
select * from t1;
a  ¦  b  ¦  c
1  ¦  1  ¦  1
2  ¦  2  ¦  2
3  ¦  3  ¦  3
4  ¦  4  ¦  4
null  ¦  5  ¦  5

#SQL[@13,N26]Result[]
delete from t1 where a = 1;

#SQL[@14,N16]Result[15, 15, 15, 15, 18]
select * from t1;
a  ¦  b  ¦  c
2  ¦  2  ¦  2
3  ¦  3  ¦  3
4  ¦  4  ¦  4
null  ¦  5  ¦  5

#SQL[@15,N30]Result[]
insert into t1 values(1, 1, 1);

#SQL[@16,N30]Result[]
delete from t1 where a is null;

#SQL[@17,N16]Result[15, 15, 15, 15, 15]
select * from t1;
a  ¦  b  ¦  c
2  ¦  2  ¦  2
3  ¦  3  ¦  3
4  ¦  4  ¦  4
1  ¦  1  ¦  1

#SQL[@18,N14]Result[]
delete from t1;

#SQL[@19,N16]Result[]
select * from t1;

#SQL[@21,N23]Result[]
drop table if exists t1;

#SQL[@22,N54]Result[]
create table t1(a int, b int, c int, unique key(a, b));

#SQL[@23,N30]Result[]
insert into t1 values(1, 1, 1);

#SQL[@24,N30]Result[]
insert into t1 values(2, 2, 2);

#SQL[@25,N30]Result[]
insert into t1 values(3, 3, 3);

#SQL[@26,N30]Result[]
insert into t1 values(4, 4, 4);

#SQL[@27,N33]Result[]
insert into t1 values(NULL, 5, 5);

#SQL[@28,N16]Result[15, 15, 15, 15, 15, 18]
select * from t1;
a  ¦  b  ¦  c
1  ¦  1  ¦  1
2  ¦  2  ¦  2
3  ¦  3  ¦  3
4  ¦  4  ¦  4
null  ¦  5  ¦  5

#SQL[@29,N26]Result[]
delete from t1 where a = 1;

#SQL[@30,N16]Result[15, 15, 15, 15, 18]
select * from t1;
a  ¦  b  ¦  c
2  ¦  2  ¦  2
3  ¦  3  ¦  3
4  ¦  4  ¦  4
null  ¦  5  ¦  5

#SQL[@31,N30]Result[]
insert into t1 values(1, 1, 1);

#SQL[@32,N30]Result[]
delete from t1 where a is null;

#SQL[@33,N16]Result[15, 15, 15, 15, 15]
select * from t1;
a  ¦  b  ¦  c
2  ¦  2  ¦  2
3  ¦  3  ¦  3
4  ¦  4  ¦  4
1  ¦  1  ¦  1

#SQL[@34,N14]Result[]
delete from t1;

#SQL[@35,N16]Result[]
select * from t1;

#SQL[@37,N23]Result[]
drop table if exists t1;

#SQL[@38,N66]Result[]
create table t1(a int, b int, c int, unique key(a), unique key(b));

#SQL[@39,N30]Result[]
insert into t1 values(1, 1, 1);

#SQL[@40,N30]Result[]
insert into t1 values(2, 2, 2);

#SQL[@41,N30]Result[]
insert into t1 values(3, 3, 3);

#SQL[@42,N30]Result[]
insert into t1 values(4, 4, 4);

#SQL[@43,N33]Result[]
insert into t1 values(NULL, 5, 5);

#SQL[@44,N16]Result[15, 15, 15, 15, 15, 18]
select * from t1;
a  ¦  b  ¦  c
1  ¦  1  ¦  1
2  ¦  2  ¦  2
3  ¦  3  ¦  3
4  ¦  4  ¦  4
null  ¦  5  ¦  5

#SQL[@45,N26]Result[]
delete from t1 where a = 1;

#SQL[@46,N16]Result[15, 15, 15, 15, 18]
select * from t1;
a  ¦  b  ¦  c
2  ¦  2  ¦  2
3  ¦  3  ¦  3
4  ¦  4  ¦  4
null  ¦  5  ¦  5

#SQL[@47,N30]Result[]
insert into t1 values(1, 1, 1);

#SQL[@48,N30]Result[]
delete from t1 where a is null;

#SQL[@49,N16]Result[15, 15, 15, 15, 15]
select * from t1;
a  ¦  b  ¦  c
2  ¦  2  ¦  2
3  ¦  3  ¦  3
4  ¦  4  ¦  4
1  ¦  1  ¦  1

#SQL[@50,N14]Result[]
delete from t1;

#SQL[@51,N16]Result[]
select * from t1;

#SQL[@53,N23]Result[]
drop table if exists t1;

#SQL[@54,N72]Result[]
create table t1(a int, b int, c int, unique key(a, b), unique key(b, c));

#SQL[@55,N30]Result[]
insert into t1 values(1, 1, 1);

#SQL[@56,N30]Result[]
insert into t1 values(2, 2, 2);

#SQL[@57,N30]Result[]
insert into t1 values(3, 3, 3);

#SQL[@58,N30]Result[]
insert into t1 values(4, 4, 4);

#SQL[@59,N33]Result[]
insert into t1 values(NULL, 5, 5);

#SQL[@60,N16]Result[15, 15, 15, 15, 15, 18]
select * from t1;
a  ¦  b  ¦  c
1  ¦  1  ¦  1
2  ¦  2  ¦  2
3  ¦  3  ¦  3
4  ¦  4  ¦  4
null  ¦  5  ¦  5

#SQL[@61,N26]Result[]
delete from t1 where a = 1;

#SQL[@62,N16]Result[15, 15, 15, 15, 18]
select * from t1;
a  ¦  b  ¦  c
2  ¦  2  ¦  2
3  ¦  3  ¦  3
4  ¦  4  ¦  4
null  ¦  5  ¦  5

#SQL[@63,N30]Result[]
insert into t1 values(1, 1, 1);

#SQL[@64,N30]Result[]
delete from t1 where a is null;

#SQL[@65,N16]Result[15, 15, 15, 15, 15]
select * from t1;
a  ¦  b  ¦  c
2  ¦  2  ¦  2
3  ¦  3  ¦  3
4  ¦  4  ¦  4
1  ¦  1  ¦  1

#SQL[@66,N14]Result[]
delete from t1;

#SQL[@67,N16]Result[]
select * from t1;

#SQL[@69,N23]Result[]
drop table if exists t1;

#SQL[@70,N69]Result[]
create table t1(a int, b int, c int, unique key(a, b), unique key(c));

#SQL[@71,N30]Result[]
insert into t1 values(1, 1, 1);

#SQL[@72,N30]Result[]
insert into t1 values(2, 2, 2);

#SQL[@73,N30]Result[]
insert into t1 values(3, 3, 3);

#SQL[@74,N30]Result[]
insert into t1 values(4, 4, 4);

#SQL[@75,N33]Result[]
insert into t1 values(NULL, 5, 5);

#SQL[@76,N16]Result[15, 15, 15, 15, 15, 18]
select * from t1;
a  ¦  b  ¦  c
1  ¦  1  ¦  1
2  ¦  2  ¦  2
3  ¦  3  ¦  3
4  ¦  4  ¦  4
null  ¦  5  ¦  5

#SQL[@77,N26]Result[]
delete from t1 where a = 1;

#SQL[@78,N16]Result[15, 15, 15, 15, 18]
select * from t1;
a  ¦  b  ¦  c
2  ¦  2  ¦  2
3  ¦  3  ¦  3
4  ¦  4  ¦  4
null  ¦  5  ¦  5

#SQL[@79,N30]Result[]
insert into t1 values(1, 1, 1);

#SQL[@80,N30]Result[]
delete from t1 where a is null;

#SQL[@81,N16]Result[15, 15, 15, 15, 15]
select * from t1;
a  ¦  b  ¦  c
2  ¦  2  ¦  2
3  ¦  3  ¦  3
4  ¦  4  ¦  4
1  ¦  1  ¦  1

#SQL[@82,N14]Result[]
delete from t1;

#SQL[@83,N16]Result[]
select * from t1;

#SQL[@85,N23]Result[]
drop table if exists t1;

#SQL[@86,N23]Result[]
drop table if exists t2;

#SQL[@87,N51]Result[]
create table t1(a int, b int, c int, unique key(a));

#SQL[@88,N30]Result[]
insert into t1 values(1, 1, 1);

#SQL[@89,N30]Result[]
insert into t1 values(2, 2, 2);

#SQL[@90,N30]Result[]
insert into t1 values(3, 3, 3);

#SQL[@91,N30]Result[]
insert into t1 values(4, 4, 4);

#SQL[@92,N33]Result[]
insert into t1 values(NULL, 5, 5);

#SQL[@93,N36]Result[]
create table t2(a int, b int, c int);

#SQL[@94,N30]Result[]
insert into t2 values(1, 1, 1);

#SQL[@95,N30]Result[]
insert into t2 values(2, 2, 2);

#SQL[@96,N30]Result[]
insert into t2 values(3, 3, 3);

#SQL[@97,N30]Result[]
insert into t2 values(4, 4, 4);

#SQL[@98,N33]Result[]
insert into t2 values(NULL, 5, 5);

#SQL[@99,N16]Result[15, 15, 15, 15, 15, 18]
select * from t1;
a  ¦  b  ¦  c
1  ¦  1  ¦  1
2  ¦  2  ¦  2
3  ¦  3  ¦  3
4  ¦  4  ¦  4
null  ¦  5  ¦  5

#SQL[@100,N16]Result[15, 15, 15, 15, 15, 18]
select * from t2;
a  ¦  b  ¦  c
1  ¦  1  ¦  1
2  ¦  2  ¦  2
3  ¦  3  ¦  3
4  ¦  4  ¦  4
null  ¦  5  ¦  5

#SQL[@101,N42]Result[]
delete t1, t2 from t1,t2 where t1.a = t2.a;

#SQL[@102,N16]Result[15, 18]
select * from t1;
a  ¦  b  ¦  c
null  ¦  5  ¦  5

#SQL[@103,N16]Result[15, 18]
select * from t2;
a  ¦  b  ¦  c
null  ¦  5  ¦  5

#SQL[@104,N30]Result[]
insert into t1 values(1, 1, 1);

#SQL[@105,N30]Result[]
insert into t1 values(2, 2, 2);

#SQL[@106,N30]Result[]
insert into t1 values(3, 3, 3);

#SQL[@107,N30]Result[]
insert into t1 values(4, 4, 4);

#SQL[@108,N33]Result[]
insert into t1 values(NULL, 5, 5);

#SQL[@110,N23]Result[]
drop table if exists t1;

#SQL[@111,N23]Result[]
drop table if exists t2;

#SQL[@112,N66]Result[]
create table t1(a int, b int, c int, unique key(a), unique key(b));

#SQL[@113,N30]Result[]
insert into t1 values(1, 1, 1);

#SQL[@114,N30]Result[]
insert into t1 values(2, 2, 2);

#SQL[@115,N30]Result[]
insert into t1 values(3, 3, 3);

#SQL[@116,N30]Result[]
insert into t1 values(4, 4, 4);

#SQL[@117,N33]Result[]
insert into t1 values(NULL, 5, 5);

#SQL[@118,N36]Result[]
create table t2(a int, b int, c int);

#SQL[@119,N30]Result[]
insert into t2 values(1, 1, 1);

#SQL[@120,N30]Result[]
insert into t2 values(2, 2, 2);

#SQL[@121,N30]Result[]
insert into t2 values(3, 3, 3);

#SQL[@122,N30]Result[]
insert into t2 values(4, 4, 4);

#SQL[@123,N33]Result[]
insert into t2 values(NULL, 5, 5);

#SQL[@124,N16]Result[15, 15, 15, 15, 15, 18]
select * from t1;
a  ¦  b  ¦  c
1  ¦  1  ¦  1
2  ¦  2  ¦  2
3  ¦  3  ¦  3
4  ¦  4  ¦  4
null  ¦  5  ¦  5

#SQL[@125,N16]Result[15, 15, 15, 15, 15, 18]
select * from t2;
a  ¦  b  ¦  c
1  ¦  1  ¦  1
2  ¦  2  ¦  2
3  ¦  3  ¦  3
4  ¦  4  ¦  4
null  ¦  5  ¦  5

#SQL[@126,N42]Result[]
delete t1, t2 from t1,t2 where t1.a = t2.a;

#SQL[@127,N16]Result[15, 18]
select * from t1;
a  ¦  b  ¦  c
null  ¦  5  ¦  5

#SQL[@128,N16]Result[15, 18]
select * from t2;
a  ¦  b  ¦  c
null  ¦  5  ¦  5

#SQL[@129,N30]Result[]
insert into t1 values(1, 1, 1);

#SQL[@130,N30]Result[]
insert into t1 values(2, 2, 2);

#SQL[@131,N30]Result[]
insert into t1 values(3, 3, 3);

#SQL[@132,N30]Result[]
insert into t1 values(4, 4, 4);

#SQL[@133,N33]Error[31]
insert into t1 values(NULL, 5, 5);
Duplicate entry '5' for key 'b'

#SQL[@135,N23]Result[]
drop table if exists t1;

#SQL[@136,N23]Result[]
drop table if exists t2;

#SQL[@137,N54]Result[]
create table t1(a int, b int, c int, unique key(a, b));

#SQL[@138,N30]Result[]
insert into t1 values(1, 1, 1);

#SQL[@139,N30]Result[]
insert into t1 values(2, 2, 2);

#SQL[@140,N30]Result[]
insert into t1 values(3, 3, 3);

#SQL[@141,N30]Result[]
insert into t1 values(4, 4, 4);

#SQL[@142,N33]Result[]
insert into t1 values(NULL, 5, 5);

#SQL[@143,N36]Result[]
create table t2(a int, b int, c int);

#SQL[@144,N30]Result[]
insert into t2 values(1, 1, 1);

#SQL[@145,N30]Result[]
insert into t2 values(2, 2, 2);

#SQL[@146,N30]Result[]
insert into t2 values(3, 3, 3);

#SQL[@147,N30]Result[]
insert into t2 values(4, 4, 4);

#SQL[@148,N33]Result[]
insert into t2 values(NULL, 5, 5);

#SQL[@149,N16]Result[15, 15, 15, 15, 15, 18]
select * from t1;
a  ¦  b  ¦  c
1  ¦  1  ¦  1
2  ¦  2  ¦  2
3  ¦  3  ¦  3
4  ¦  4  ¦  4
null  ¦  5  ¦  5

#SQL[@150,N16]Result[15, 15, 15, 15, 15, 18]
select * from t2;
a  ¦  b  ¦  c
1  ¦  1  ¦  1
2  ¦  2  ¦  2
3  ¦  3  ¦  3
4  ¦  4  ¦  4
null  ¦  5  ¦  5

#SQL[@151,N42]Result[]
delete t1, t2 from t1,t2 where t1.a = t2.a;

#SQL[@152,N16]Result[15, 18]
select * from t1;
a  ¦  b  ¦  c
null  ¦  5  ¦  5

#SQL[@153,N16]Result[15, 18]
select * from t2;
a  ¦  b  ¦  c
null  ¦  5  ¦  5

#SQL[@154,N30]Result[]
insert into t1 values(1, 1, 1);

#SQL[@155,N30]Result[]
insert into t1 values(2, 2, 2);

#SQL[@156,N30]Result[]
insert into t1 values(3, 3, 3);

#SQL[@157,N30]Result[]
insert into t1 values(4, 4, 4);

#SQL[@158,N33]Result[]
insert into t1 values(NULL, 5, 5);

#SQL[@160,N23]Result[]
drop table if exists t1;

#SQL[@161,N23]Result[]
drop table if exists t2;

#SQL[@162,N72]Result[]
create table t1(a int, b int, c int, unique key(a, b), unique key(b, c));

#SQL[@163,N30]Result[]
insert into t1 values(1, 1, 1);

#SQL[@164,N30]Result[]
insert into t1 values(2, 2, 2);

#SQL[@165,N30]Result[]
insert into t1 values(3, 3, 3);

#SQL[@166,N30]Result[]
insert into t1 values(4, 4, 4);

#SQL[@167,N33]Result[]
insert into t1 values(NULL, 5, 5);

#SQL[@168,N36]Result[]
create table t2(a int, b int, c int);

#SQL[@169,N30]Result[]
insert into t2 values(1, 1, 1);

#SQL[@170,N30]Result[]
insert into t2 values(2, 2, 2);

#SQL[@171,N30]Result[]
insert into t2 values(3, 3, 3);

#SQL[@172,N30]Result[]
insert into t2 values(4, 4, 4);

#SQL[@173,N33]Result[]
insert into t2 values(NULL, 5, 5);

#SQL[@174,N16]Result[15, 15, 15, 15, 15, 18]
select * from t1;
a  ¦  b  ¦  c
1  ¦  1  ¦  1
2  ¦  2  ¦  2
3  ¦  3  ¦  3
4  ¦  4  ¦  4
null  ¦  5  ¦  5

#SQL[@175,N16]Result[15, 15, 15, 15, 15, 18]
select * from t2;
a  ¦  b  ¦  c
1  ¦  1  ¦  1
2  ¦  2  ¦  2
3  ¦  3  ¦  3
4  ¦  4  ¦  4
null  ¦  5  ¦  5

#SQL[@176,N42]Result[]
delete t1, t2 from t1,t2 where t1.a = t2.a;

#SQL[@177,N16]Result[15, 18]
select * from t1;
a  ¦  b  ¦  c
null  ¦  5  ¦  5

#SQL[@178,N16]Result[15, 18]
select * from t2;
a  ¦  b  ¦  c
null  ¦  5  ¦  5

#SQL[@179,N30]Result[]
insert into t1 values(1, 1, 1);

#SQL[@180,N30]Result[]
insert into t1 values(2, 2, 2);

#SQL[@181,N30]Result[]
insert into t1 values(3, 3, 3);

#SQL[@182,N30]Result[]
insert into t1 values(4, 4, 4);

#SQL[@183,N33]Error[39]
insert into t1 values(NULL, 5, 5);
Duplicate entry '(5,5)' for key '(b,c)'

#SQL[@185,N23]Result[]
drop table if exists t1;

#SQL[@186,N23]Result[]
drop table if exists t2;

#SQL[@187,N51]Result[]
create table t1(a int, b int, c int, unique key(a));

#SQL[@188,N30]Result[]
insert into t1 values(1, 1, 1);

#SQL[@189,N30]Result[]
insert into t1 values(2, 2, 2);

#SQL[@190,N30]Result[]
insert into t1 values(3, 3, 3);

#SQL[@191,N30]Result[]
insert into t1 values(4, 4, 4);

#SQL[@192,N33]Result[]
insert into t1 values(NULL, 5, 5);

#SQL[@193,N51]Result[]
create table t2(a int, b int, c int, unique key(b));

#SQL[@194,N30]Result[]
insert into t2 values(1, 1, 1);

#SQL[@195,N30]Result[]
insert into t2 values(2, 2, 2);

#SQL[@196,N30]Result[]
insert into t2 values(3, 3, 3);

#SQL[@197,N30]Result[]
insert into t2 values(4, 4, 4);

#SQL[@198,N33]Result[]
insert into t2 values(NULL, 5, 5);

#SQL[@199,N16]Result[15, 15, 15, 15, 15, 18]
select * from t1;
a  ¦  b  ¦  c
1  ¦  1  ¦  1
2  ¦  2  ¦  2
3  ¦  3  ¦  3
4  ¦  4  ¦  4
null  ¦  5  ¦  5

#SQL[@200,N16]Result[15, 15, 15, 15, 15, 18]
select * from t2;
a  ¦  b  ¦  c
1  ¦  1  ¦  1
2  ¦  2  ¦  2
3  ¦  3  ¦  3
4  ¦  4  ¦  4
null  ¦  5  ¦  5

#SQL[@201,N42]Result[]
delete t1, t2 from t1,t2 where t1.a = t2.a;

#SQL[@202,N16]Result[15, 18]
select * from t1;
a  ¦  b  ¦  c
null  ¦  5  ¦  5

#SQL[@203,N16]Result[15, 18]
select * from t2;
a  ¦  b  ¦  c
null  ¦  5  ¦  5

#SQL[@204,N30]Result[]
insert into t1 values(1, 1, 1);

#SQL[@205,N30]Result[]
insert into t1 values(2, 2, 2);

#SQL[@206,N30]Result[]
insert into t1 values(3, 3, 3);

#SQL[@207,N30]Result[]
insert into t1 values(4, 4, 4);

#SQL[@208,N33]Result[]
insert into t1 values(NULL, 5, 5);

#SQL[@210,N23]Result[]
drop table if exists t1;

#SQL[@211,N23]Result[]
drop table if exists t2;

#SQL[@212,N66]Result[]
create table t1(a int, b int, c int, unique key(a), unique key(b));

#SQL[@213,N30]Result[]
insert into t1 values(1, 1, 1);

#SQL[@214,N30]Result[]
insert into t1 values(2, 2, 2);

#SQL[@215,N30]Result[]
insert into t1 values(3, 3, 3);

#SQL[@216,N30]Result[]
insert into t1 values(4, 4, 4);

#SQL[@217,N33]Result[]
insert into t1 values(NULL, 5, 5);

#SQL[@218,N66]Result[]
create table t2(a int, b int, c int, unique key(b), unique key(c));

#SQL[@219,N30]Result[]
insert into t2 values(1, 1, 1);

#SQL[@220,N30]Result[]
insert into t2 values(2, 2, 2);

#SQL[@221,N30]Result[]
insert into t2 values(3, 3, 3);

#SQL[@222,N30]Result[]
insert into t2 values(4, 4, 4);

#SQL[@223,N33]Result[]
insert into t2 values(NULL, 5, 5);

#SQL[@224,N16]Result[15, 15, 15, 15, 15, 18]
select * from t1;
a  ¦  b  ¦  c
1  ¦  1  ¦  1
2  ¦  2  ¦  2
3  ¦  3  ¦  3
4  ¦  4  ¦  4
null  ¦  5  ¦  5

#SQL[@225,N16]Result[15, 15, 15, 15, 15, 18]
select * from t2;
a  ¦  b  ¦  c
1  ¦  1  ¦  1
2  ¦  2  ¦  2
3  ¦  3  ¦  3
4  ¦  4  ¦  4
null  ¦  5  ¦  5

#SQL[@226,N42]Result[]
delete t1, t2 from t1,t2 where t1.a = t2.a;

#SQL[@227,N16]Result[15, 18]
select * from t1;
a  ¦  b  ¦  c
null  ¦  5  ¦  5

#SQL[@228,N16]Result[15, 18]
select * from t2;
a  ¦  b  ¦  c
null  ¦  5  ¦  5

#SQL[@229,N30]Result[]
insert into t1 values(1, 1, 1);

#SQL[@230,N30]Result[]
insert into t1 values(2, 2, 2);

#SQL[@231,N30]Result[]
insert into t1 values(3, 3, 3);

#SQL[@232,N30]Result[]
insert into t1 values(4, 4, 4);

#SQL[@233,N33]Error[31]
insert into t1 values(NULL, 5, 5);
Duplicate entry '5' for key 'b'

#SQL[@235,N23]Result[]
drop table if exists t1;

#SQL[@236,N23]Result[]
drop table if exists t2;

#SQL[@237,N54]Result[]
create table t1(a int, b int, c int, unique key(a, b));

#SQL[@238,N30]Result[]
insert into t1 values(1, 1, 1);

#SQL[@239,N30]Result[]
insert into t1 values(2, 2, 2);

#SQL[@240,N30]Result[]
insert into t1 values(3, 3, 3);

#SQL[@241,N30]Result[]
insert into t1 values(4, 4, 4);

#SQL[@242,N33]Result[]
insert into t1 values(NULL, 5, 5);

#SQL[@243,N54]Result[]
create table t2(a int, b int, c int, unique key(b, c));

#SQL[@244,N30]Result[]
insert into t2 values(1, 1, 1);

#SQL[@245,N30]Result[]
insert into t2 values(2, 2, 2);

#SQL[@246,N30]Result[]
insert into t2 values(3, 3, 3);

#SQL[@247,N30]Result[]
insert into t2 values(4, 4, 4);

#SQL[@248,N33]Result[]
insert into t2 values(NULL, 5, 5);

#SQL[@249,N16]Result[15, 15, 15, 15, 15, 18]
select * from t1;
a  ¦  b  ¦  c
1  ¦  1  ¦  1
2  ¦  2  ¦  2
3  ¦  3  ¦  3
4  ¦  4  ¦  4
null  ¦  5  ¦  5

#SQL[@250,N16]Result[15, 15, 15, 15, 15, 18]
select * from t2;
a  ¦  b  ¦  c
1  ¦  1  ¦  1
2  ¦  2  ¦  2
3  ¦  3  ¦  3
4  ¦  4  ¦  4
null  ¦  5  ¦  5

#SQL[@251,N42]Result[]
delete t1, t2 from t1,t2 where t1.a = t2.a;

#SQL[@252,N16]Result[15, 18]
select * from t1;
a  ¦  b  ¦  c
null  ¦  5  ¦  5

#SQL[@253,N16]Result[15, 18]
select * from t2;
a  ¦  b  ¦  c
null  ¦  5  ¦  5

#SQL[@254,N30]Result[]
insert into t1 values(1, 1, 1);

#SQL[@255,N30]Result[]
insert into t1 values(2, 2, 2);

#SQL[@256,N30]Result[]
insert into t1 values(3, 3, 3);

#SQL[@257,N30]Result[]
insert into t1 values(4, 4, 4);

#SQL[@258,N33]Result[]
insert into t1 values(NULL, 5, 5);

#SQL[@260,N23]Result[]
drop table if exists t1;

#SQL[@261,N23]Result[]
drop table if exists t2;

#SQL[@262,N72]Result[]
create table t1(a int, b int, c int, unique key(a, b), unique key(b, c));

#SQL[@263,N30]Result[]
insert into t1 values(1, 1, 1);

#SQL[@264,N30]Result[]
insert into t1 values(2, 2, 2);

#SQL[@265,N30]Result[]
insert into t1 values(3, 3, 3);

#SQL[@266,N30]Result[]
insert into t1 values(4, 4, 4);

#SQL[@267,N33]Result[]
insert into t1 values(NULL, 5, 5);

#SQL[@268,N72]Result[]
create table t2(a int, b int, c int, unique key(a, c), unique key(b, c));

#SQL[@269,N30]Result[]
insert into t2 values(1, 1, 1);

#SQL[@270,N30]Result[]
insert into t2 values(2, 2, 2);

#SQL[@271,N30]Result[]
insert into t2 values(3, 3, 3);

#SQL[@272,N30]Result[]
insert into t2 values(4, 4, 4);

#SQL[@273,N33]Result[]
insert into t2 values(NULL, 5, 5);

#SQL[@274,N16]Result[15, 15, 15, 15, 15, 18]
select * from t1;
a  ¦  b  ¦  c
1  ¦  1  ¦  1
2  ¦  2  ¦  2
3  ¦  3  ¦  3
4  ¦  4  ¦  4
null  ¦  5  ¦  5

#SQL[@275,N16]Result[15, 15, 15, 15, 15, 18]
select * from t2;
a  ¦  b  ¦  c
1  ¦  1  ¦  1
2  ¦  2  ¦  2
3  ¦  3  ¦  3
4  ¦  4  ¦  4
null  ¦  5  ¦  5

#SQL[@276,N42]Result[]
delete t1, t2 from t1,t2 where t1.a = t2.a;

#SQL[@277,N16]Result[15, 18]
select * from t1;
a  ¦  b  ¦  c
null  ¦  5  ¦  5

#SQL[@278,N16]Result[15, 18]
select * from t2;
a  ¦  b  ¦  c
null  ¦  5  ¦  5

#SQL[@279,N30]Result[]
insert into t1 values(1, 1, 1);

#SQL[@280,N30]Result[]
insert into t1 values(2, 2, 2);

#SQL[@281,N30]Result[]
insert into t1 values(3, 3, 3);

#SQL[@282,N30]Result[]
insert into t1 values(4, 4, 4);

#SQL[@283,N33]Error[39]
insert into t1 values(NULL, 5, 5);
Duplicate entry '(5,5)' for key '(b,c)'

#SQL[@285,N23]Result[]
drop table if exists t1;

#SQL[@286,N23]Result[]
drop table if exists t2;

#SQL[@287,N69]Result[]
create table t1(a int, b int, c int, unique key(a, b), unique key(c));

#SQL[@288,N30]Result[]
insert into t1 values(1, 1, 1);

#SQL[@289,N30]Result[]
insert into t1 values(2, 2, 2);

#SQL[@290,N30]Result[]
insert into t1 values(3, 3, 3);

#SQL[@291,N30]Result[]
insert into t1 values(4, 4, 4);

#SQL[@292,N33]Result[]
insert into t1 values(NULL, 5, 5);

#SQL[@293,N69]Result[]
create table t2(a int, b int, c int, unique key(a), unique key(b, c));

#SQL[@294,N30]Result[]
insert into t2 values(1, 1, 1);

#SQL[@295,N30]Result[]
insert into t2 values(2, 2, 2);

#SQL[@296,N30]Result[]
insert into t2 values(3, 3, 3);

#SQL[@297,N30]Result[]
insert into t2 values(4, 4, 4);

#SQL[@298,N33]Result[]
insert into t2 values(NULL, 5, 5);

#SQL[@299,N16]Result[15, 15, 15, 15, 15, 18]
select * from t1;
a  ¦  b  ¦  c
1  ¦  1  ¦  1
2  ¦  2  ¦  2
3  ¦  3  ¦  3
4  ¦  4  ¦  4
null  ¦  5  ¦  5

#SQL[@300,N16]Result[15, 15, 15, 15, 15, 18]
select * from t2;
a  ¦  b  ¦  c
1  ¦  1  ¦  1
2  ¦  2  ¦  2
3  ¦  3  ¦  3
4  ¦  4  ¦  4
null  ¦  5  ¦  5

#SQL[@301,N42]Result[]
delete t1, t2 from t1,t2 where t1.a = t2.a;

#SQL[@302,N16]Result[15, 18]
select * from t1;
a  ¦  b  ¦  c
null  ¦  5  ¦  5

#SQL[@303,N16]Result[15, 18]
select * from t2;
a  ¦  b  ¦  c
null  ¦  5  ¦  5

#SQL[@304,N30]Result[]
insert into t1 values(1, 1, 1);

#SQL[@305,N30]Result[]
insert into t1 values(2, 2, 2);

#SQL[@306,N30]Result[]
insert into t1 values(3, 3, 3);

#SQL[@307,N30]Result[]
insert into t1 values(4, 4, 4);

#SQL[@308,N33]Error[31]
insert into t1 values(NULL, 5, 5);
Duplicate entry '5' for key 'c'

#SQL[@310,N23]Result[]
drop table if exists t1;

#SQL[@311,N67]Result[]
create table t1(a int, b int, c int, primary key(c), unique key(a));

#SQL[@312,N30]Result[]
insert into t1 values(1, 1, 1);

#SQL[@313,N30]Result[]
insert into t1 values(2, 2, 2);

#SQL[@314,N30]Result[]
insert into t1 values(3, 3, 3);

#SQL[@315,N30]Result[]
insert into t1 values(4, 4, 4);

#SQL[@316,N33]Result[]
insert into t1 values(NULL, 5, 5);

#SQL[@317,N16]Result[15, 15, 15, 15, 15, 18]
select * from t1;
a  ¦  b  ¦  c
1  ¦  1  ¦  1
2  ¦  2  ¦  2
3  ¦  3  ¦  3
4  ¦  4  ¦  4
null  ¦  5  ¦  5

#SQL[@318,N26]Result[]
delete from t1 where a = 1;

#SQL[@319,N16]Result[15, 15, 15, 15, 18]
select * from t1;
a  ¦  b  ¦  c
2  ¦  2  ¦  2
3  ¦  3  ¦  3
4  ¦  4  ¦  4
null  ¦  5  ¦  5

#SQL[@320,N30]Result[]
insert into t1 values(1, 1, 1);

#SQL[@321,N30]Result[]
delete from t1 where a is null;

#SQL[@322,N16]Result[15, 15, 15, 15, 15]
select * from t1;
a  ¦  b  ¦  c
2  ¦  2  ¦  2
3  ¦  3  ¦  3
4  ¦  4  ¦  4
1  ¦  1  ¦  1

#SQL[@323,N14]Result[]
delete from t1;

#SQL[@324,N16]Result[]
select * from t1;

#SQL[@326,N23]Result[]
drop table if exists t1;

#SQL[@327,N70]Result[]
create table t1(a int, b int, c int, primary key(c), unique key(a, b));

#SQL[@328,N30]Result[]
insert into t1 values(1, 1, 1);

#SQL[@329,N30]Result[]
insert into t1 values(2, 2, 2);

#SQL[@330,N30]Result[]
insert into t1 values(3, 3, 3);

#SQL[@331,N30]Result[]
insert into t1 values(4, 4, 4);

#SQL[@332,N33]Result[]
insert into t1 values(NULL, 5, 5);

#SQL[@333,N16]Result[15, 15, 15, 15, 15, 18]
select * from t1;
a  ¦  b  ¦  c
1  ¦  1  ¦  1
2  ¦  2  ¦  2
3  ¦  3  ¦  3
4  ¦  4  ¦  4
null  ¦  5  ¦  5

#SQL[@334,N26]Result[]
delete from t1 where a = 1;

#SQL[@335,N16]Result[15, 15, 15, 15, 18]
select * from t1;
a  ¦  b  ¦  c
2  ¦  2  ¦  2
3  ¦  3  ¦  3
4  ¦  4  ¦  4
null  ¦  5  ¦  5

#SQL[@336,N30]Result[]
insert into t1 values(1, 1, 1);

#SQL[@337,N30]Result[]
delete from t1 where a is null;

#SQL[@338,N16]Result[15, 15, 15, 15, 15]
select * from t1;
a  ¦  b  ¦  c
2  ¦  2  ¦  2
3  ¦  3  ¦  3
4  ¦  4  ¦  4
1  ¦  1  ¦  1

#SQL[@339,N14]Result[]
delete from t1;

#SQL[@340,N16]Result[]
select * from t1;

#SQL[@342,N23]Result[]
drop table if exists t1;

#SQL[@343,N23]Result[]
drop table if exists t2;

#SQL[@344,N67]Result[]
create table t1(a int, b int, c int, unique key(a), primary key(b));

#SQL[@345,N30]Result[]
insert into t1 values(1, 1, 1);

#SQL[@346,N30]Result[]
insert into t1 values(2, 2, 2);

#SQL[@347,N30]Result[]
insert into t1 values(3, 3, 3);

#SQL[@348,N30]Result[]
insert into t1 values(4, 4, 4);

#SQL[@349,N33]Result[]
insert into t1 values(NULL, 5, 5);

#SQL[@350,N70]Result[]
create table t2(a int, b int, c int, unique key(b), primary key(b, c));

#SQL[@351,N30]Result[]
insert into t2 values(1, 1, 1);

#SQL[@352,N30]Result[]
insert into t2 values(2, 2, 2);

#SQL[@353,N30]Result[]
insert into t2 values(3, 3, 3);

#SQL[@354,N30]Result[]
insert into t2 values(4, 4, 4);

#SQL[@355,N33]Result[]
insert into t2 values(NULL, 5, 5);

#SQL[@356,N16]Result[15, 15, 15, 15, 15, 18]
select * from t1;
a  ¦  b  ¦  c
1  ¦  1  ¦  1
2  ¦  2  ¦  2
3  ¦  3  ¦  3
4  ¦  4  ¦  4
null  ¦  5  ¦  5

#SQL[@357,N16]Result[15, 15, 15, 15, 15, 18]
select * from t2;
a  ¦  b  ¦  c
1  ¦  1  ¦  1
2  ¦  2  ¦  2
3  ¦  3  ¦  3
4  ¦  4  ¦  4
null  ¦  5  ¦  5

#SQL[@358,N42]Result[]
delete t1, t2 from t1,t2 where t1.a = t2.a;

#SQL[@359,N16]Result[15, 18]
select * from t1;
a  ¦  b  ¦  c
null  ¦  5  ¦  5

#SQL[@360,N16]Result[15, 18]
select * from t2;
a  ¦  b  ¦  c
null  ¦  5  ¦  5

#SQL[@361,N30]Result[]
insert into t1 values(1, 1, 1);

#SQL[@362,N30]Result[]
insert into t1 values(2, 2, 2);

#SQL[@363,N30]Result[]
insert into t1 values(3, 3, 3);

#SQL[@364,N30]Result[]
insert into t1 values(4, 4, 4);

#SQL[@365,N27]Result[]
drop database if exists db1;

