#SQL[@1,N25]Result[]
drop table if exists dept;

#SQL[@2,N192]Result[]
create table dept(
deptno int unsigned COMMENT '部门编号',
dname varchar(15) COMMENT '部门名称',
loc varchar(50)  COMMENT '部门所在位置',
unique key(deptno)
) COMMENT='部门表';

#SQL[@9,N52]Result[]
INSERT INTO dept VALUES (10,'ACCOUNTING','NEW YORK');

#SQL[@10,N48]Result[]
INSERT INTO dept VALUES (20,'RESEARCH','DALLAS');

#SQL[@11,N46]Result[]
INSERT INTO dept VALUES (30,'SALES','CHICAGO');

#SQL[@12,N50]Result[]
INSERT INTO dept VALUES (40,'OPERATIONS','BOSTON');

#SQL[@15,N24]Result[]
drop table if exists emp;

#SQL[@16,N203]Result[]
create table emp(
empno int unsigned,
ename varchar(15),
job varchar(10),
mgr int unsigned,
hiredate date,
sal decimal(7,2),
comm decimal(7,2),
deptno int unsigned,
unique key(empno),
unique key(ename)
);

#SQL[@29,N75]Result[]
INSERT INTO emp VALUES (7369,'SMITH','CLERK',7902,'1980-12-17',800,NULL,20);

#SQL[@30,N78]Result[]
INSERT INTO emp VALUES (7499,'ALLEN','SALESMAN',7698,'1981-02-20',1600,300,30);

#SQL[@31,N77]Result[]
INSERT INTO emp VALUES (7521,'WARD','SALESMAN',7698,'1981-02-22',1250,500,30);

#SQL[@32,N78]Result[]
INSERT INTO emp VALUES (7566,'JONES','MANAGER',7839,'1981-04-02',2975,NULL,20);

#SQL[@33,N80]Result[]
INSERT INTO emp VALUES (7654,'MARTIN','SALESMAN',7698,'1981-09-28',1250,1400,30);

#SQL[@34,N78]Result[]
INSERT INTO emp VALUES (7698,'BLAKE','MANAGER',7839,'1981-05-01',2850,NULL,30);

#SQL[@35,N78]Result[]
INSERT INTO emp VALUES (7782,'CLARK','MANAGER',7839,'1981-06-09',2450,NULL,10);

#SQL[@36,N78]Result[]
INSERT INTO emp VALUES (7788,'SCOTT','ANALYST',7566,'0087-07-13',3000,NULL,20);

#SQL[@37,N79]Result[]
INSERT INTO emp VALUES (7839,'KING','PRESIDENT',NULL,'1981-11-17',5000,NULL,10);

#SQL[@38,N77]Result[]
INSERT INTO emp VALUES (7844,'TURNER','SALESMAN',7698,'1981-09-08',1500,0,30);

#SQL[@39,N76]Result[]
INSERT INTO emp VALUES (7876,'ADAMS','CLERK',7788,'0087-07-13',1100,NULL,20);

#SQL[@40,N75]Result[]
INSERT INTO emp VALUES (7900,'JAMES','CLERK',7698,'1981-12-03',950,NULL,30);

#SQL[@41,N72]Result[]
INSERT INTO emp VALUES (7902,'FORD',NULL,7566,'1981-12-03',3000,NULL,20);

#SQL[@42,N77]Result[]
INSERT INTO emp VALUES (null,'MILLER','CLERK',7782,'1982-01-23',1300,NULL,10);

#SQL[@45,N30]Result[]
drop table if exists employees;

#SQL[@46,N431]Result[]
create table employees(
empno int unsigned COMMENT '雇员编号',
ename varchar(15) COMMENT '雇员姓名',
job varchar(10) COMMENT '雇员职位',
mgr int unsigned COMMENT '雇员对应的领导的编号',
hiredate date COMMENT '雇员的雇佣日期',
sal decimal(7,2) COMMENT '雇员的基本工资',
comm decimal(7,2) COMMENT '奖金',
deptno int unsigned COMMENT '所在部门',
unique key(empno, ename)
) COMMENT='雇员表';

#SQL[@59,N81]Result[]
INSERT INTO employees VALUES (7369,'SMITH','CLERK',7902,'1980-12-17',800,NULL,20);

#SQL[@60,N84]Result[]
INSERT INTO employees VALUES (7499,'ALLEN','SALESMAN',7698,'1981-02-20',1600,300,30);

#SQL[@61,N83]Result[]
INSERT INTO employees VALUES (7521,'WARD','SALESMAN',7698,'1981-02-22',1250,500,30);

#SQL[@62,N84]Result[]
INSERT INTO employees VALUES (7566,'JONES','MANAGER',7839,'1981-04-02',2975,NULL,20);

#SQL[@63,N86]Result[]
INSERT INTO employees VALUES (7654,'MARTIN','SALESMAN',7698,'1981-09-28',1250,1400,30);

#SQL[@64,N84]Result[]
INSERT INTO employees VALUES (7698,'BLAKE','MANAGER',7839,'1981-05-01',2850,NULL,30);

#SQL[@65,N84]Result[]
INSERT INTO employees VALUES (7782,'CLARK','MANAGER',7839,'1981-06-09',2450,NULL,10);

#SQL[@66,N84]Result[]
INSERT INTO employees VALUES (7788,'SCOTT','ANALYST',7566,'0087-07-13',3000,NULL,20);

#SQL[@67,N85]Result[]
INSERT INTO employees VALUES (7839,'KING','PRESIDENT',NULL,'1981-11-17',5000,NULL,10);

#SQL[@68,N83]Result[]
INSERT INTO employees VALUES (7844,'TURNER','SALESMAN',7698,'1981-09-08',1500,0,30);

#SQL[@69,N82]Result[]
INSERT INTO employees VALUES (7876,'ADAMS','CLERK',7788,'0087-07-13',1100,NULL,20);

#SQL[@70,N78]Result[]
INSERT INTO employees VALUES (7900,NULL,'CLERK',7698,'1981-12-03',950,NULL,30);

#SQL[@71,N78]Result[]
INSERT INTO employees VALUES (7902,'FORD',NULL,7566,'1981-12-03',3000,NULL,20);

#SQL[@72,N83]Result[]
INSERT INTO employees VALUES (null,'MILLER','CLERK',7782,'1982-01-23',1300,NULL,10);

#SQL[@75,N38]Result[]
delete from emp t1 where t1.sal > 2000;

#SQL[@76,N17]Result[79, 82, 88, 87, 90, 87, 83, 82, 84]
select * from emp;
empno  ¦  ename  ¦  job  ¦  mgr  ¦  hiredate  ¦  sal  ¦  comm  ¦  deptno
7369  ¦  SMITH  ¦  CLERK  ¦  7902  ¦  1980-12-17  ¦  800.00  ¦  null  ¦  20
7499  ¦  ALLEN  ¦  SALESMAN  ¦  7698  ¦  1981-02-20  ¦  1600.00  ¦  300.00  ¦  30
7521  ¦  WARD  ¦  SALESMAN  ¦  7698  ¦  1981-02-22  ¦  1250.00  ¦  500.00  ¦  30
7654  ¦  MARTIN  ¦  SALESMAN  ¦  7698  ¦  1981-09-28  ¦  1250.00  ¦  1400.00  ¦  30
7844  ¦  TURNER  ¦  SALESMAN  ¦  7698  ¦  1981-09-08  ¦  1500.00  ¦  0.00  ¦  30
7876  ¦  ADAMS  ¦  CLERK  ¦  7788  ¦  0087-07-13  ¦  1100.00  ¦  null  ¦  20
7900  ¦  JAMES  ¦  CLERK  ¦  7698  ¦  1981-12-03  ¦  950.00  ¦  null  ¦  30
null  ¦  MILLER  ¦  CLERK  ¦  7782  ¦  1982-01-23  ¦  1300.00  ¦  null  ¦  10

#SQL[@79,N39]Result[]
delete from employees where deptno = 10;

#SQL[@80,N23]Result[79, 82, 88, 87, 85, 90, 85, 85, 87, 83, 81, 81]
select * from employees;
empno  ¦  ename  ¦  job  ¦  mgr  ¦  hiredate  ¦  sal  ¦  comm  ¦  deptno
7369  ¦  SMITH  ¦  CLERK  ¦  7902  ¦  1980-12-17  ¦  800.00  ¦  null  ¦  20
7499  ¦  ALLEN  ¦  SALESMAN  ¦  7698  ¦  1981-02-20  ¦  1600.00  ¦  300.00  ¦  30
7521  ¦  WARD  ¦  SALESMAN  ¦  7698  ¦  1981-02-22  ¦  1250.00  ¦  500.00  ¦  30
7566  ¦  JONES  ¦  MANAGER  ¦  7839  ¦  1981-04-02  ¦  2975.00  ¦  null  ¦  20
7654  ¦  MARTIN  ¦  SALESMAN  ¦  7698  ¦  1981-09-28  ¦  1250.00  ¦  1400.00  ¦  30
7698  ¦  BLAKE  ¦  MANAGER  ¦  7839  ¦  1981-05-01  ¦  2850.00  ¦  null  ¦  30
7788  ¦  SCOTT  ¦  ANALYST  ¦  7566  ¦  0087-07-13  ¦  3000.00  ¦  null  ¦  20
7844  ¦  TURNER  ¦  SALESMAN  ¦  7698  ¦  1981-09-08  ¦  1500.00  ¦  0.00  ¦  30
7876  ¦  ADAMS  ¦  CLERK  ¦  7788  ¦  0087-07-13  ¦  1100.00  ¦  null  ¦  20
7900  ¦  null  ¦  CLERK  ¦  7698  ¦  1981-12-03  ¦  950.00  ¦  null  ¦  30
7902  ¦  FORD  ¦  null  ¦  7566  ¦  1981-12-03  ¦  3000.00  ¦  null  ¦  20

#SQL[@82,N60]Result[]
delete from employees where empno = 7698 and ename = 'BLAKE';

#SQL[@83,N69]Result[8, 1]
select count(*) from employees where empno = 7698 and ename = 'BLAKE';
count(*)
0

#SQL[@86,N87]Result[]
delete t1, t2  from emp as t1,dept as t2 where t1.deptno = t2.deptno and t1.deptno = 10;

#SQL[@87,N17]Result[79, 82, 88, 87, 90, 87, 83, 82]
select * from emp;
empno  ¦  ename  ¦  job  ¦  mgr  ¦  hiredate  ¦  sal  ¦  comm  ¦  deptno
7369  ¦  SMITH  ¦  CLERK  ¦  7902  ¦  1980-12-17  ¦  800.00  ¦  null  ¦  20
7499  ¦  ALLEN  ¦  SALESMAN  ¦  7698  ¦  1981-02-20  ¦  1600.00  ¦  300.00  ¦  30
7521  ¦  WARD  ¦  SALESMAN  ¦  7698  ¦  1981-02-22  ¦  1250.00  ¦  500.00  ¦  30
7654  ¦  MARTIN  ¦  SALESMAN  ¦  7698  ¦  1981-09-28  ¦  1250.00  ¦  1400.00  ¦  30
7844  ¦  TURNER  ¦  SALESMAN  ¦  7698  ¦  1981-09-08  ¦  1500.00  ¦  0.00  ¦  30
7876  ¦  ADAMS  ¦  CLERK  ¦  7788  ¦  0087-07-13  ¦  1100.00  ¦  null  ¦  20
7900  ¦  JAMES  ¦  CLERK  ¦  7698  ¦  1981-12-03  ¦  950.00  ¦  null  ¦  30

#SQL[@88,N18]Result[26, 28, 26, 30]
select * from dept;
deptno  ¦  dname  ¦  loc
20  ¦  RESEARCH  ¦  DALLAS
30  ¦  SALES  ¦  CHICAGO
40  ¦  OPERATIONS  ¦  BOSTON

#SQL[@90,N95]Result[]
delete employees, dept from employees, dept where employees.deptno = dept.deptno and sal > 2000;

#SQL[@91,N23]Result[79, 82, 88, 87, 90, 87, 83, 81]
select * from employees;
empno  ¦  ename  ¦  job  ¦  mgr  ¦  hiredate  ¦  sal  ¦  comm  ¦  deptno
7369  ¦  SMITH  ¦  CLERK  ¦  7902  ¦  1980-12-17  ¦  800.00  ¦  null  ¦  20
7499  ¦  ALLEN  ¦  SALESMAN  ¦  7698  ¦  1981-02-20  ¦  1600.00  ¦  300.00  ¦  30
7521  ¦  WARD  ¦  SALESMAN  ¦  7698  ¦  1981-02-22  ¦  1250.00  ¦  500.00  ¦  30
7654  ¦  MARTIN  ¦  SALESMAN  ¦  7698  ¦  1981-09-28  ¦  1250.00  ¦  1400.00  ¦  30
7844  ¦  TURNER  ¦  SALESMAN  ¦  7698  ¦  1981-09-08  ¦  1500.00  ¦  0.00  ¦  30
7876  ¦  ADAMS  ¦  CLERK  ¦  7788  ¦  0087-07-13  ¦  1100.00  ¦  null  ¦  20
7900  ¦  null  ¦  CLERK  ¦  7698  ¦  1981-12-03  ¦  950.00  ¦  null  ¦  30

#SQL[@92,N18]Result[26, 26, 30]
select * from dept;
deptno  ¦  dname  ¦  loc
30  ¦  SALES  ¦  CHICAGO
40  ¦  OPERATIONS  ¦  BOSTON

#SQL[@95,N18]Result[]
truncate table emp;

#SQL[@96,N17]Result[]
select * from emp;

#SQL[@98,N19]Result[]
truncate table dept;

#SQL[@99,N18]Result[]
select * from dept;

#SQL[@101,N24]Result[]
truncate table employees;

#SQL[@102,N23]Result[]
select * from employees;

#SQL[@105,N15]Result[]
drop table dept;

#SQL[@106,N14]Result[]
drop table emp;

#SQL[@107,N20]Result[]
drop table employees;

